sentence,label
"Cramo , headquartered in Vantaa , Finland , rents construction machinery and equipment , as well as rents and sells modular space .",1
"The add-on order contains , among others , control valves and instrumentation as well as complete mill engineering and electrification with Metso drive controls .",1
Russia wants to utilise its huge forest reserves in a very different way from what has been done so far .,1
"Olvi 's target is to strengthen its market share in soft drinks , mineral waters , ciders , long drinks , and energy drinks .",1
"With the U.S. Federal Government putting a stake in the ground , vendors - and their customers - are focused on meeting the deadline .",1
"The E7 smartphone will be available for Rs35 ,000 per handset across India , '' Nokia India vice-president & managing director D Shivakumar told reporters .",1
"Ahlstrom , headquartered in Helsinki , Finland , is a global leader in the development , manufacture and marketing of high performance fibre-based materials .",1
"In addition to the Indian market , the new plant will serve Salcomp 's customers globally , the company said .",2
A PLUMBING business has announced it is sponsoring a professional darts player .,1
The share subscription period for stock options 2007A is between 1 April 2010 and 31 March 2012 .,1
"Tectia Corporation HEL : TEC1V , a provider of real-time security solutions , today announced that it has appointed LAN2LAN , a provider of IT services in the UK , to distribute its data security and manage file transfer software .",2
Operating profit fell from EUR 7.9 mn in the second quarter of 2005 to EUR 5.1 mn in the second quarter of 2006 .,0
"Together with Latvia , Cramo will operate 54 rental outlets in the Baltic States .",1
"In 2006 the company 's net sales amounted to approximately EUR259m and it has some 8,000 employees .",1
A total of 140 jobs will be reduced at the Raahe Steel Works .,0
"( ADP News ) - Feb 12 , 2009 - Finnish IT solutions provider Affecto Oyj ( HEL : AFE1V ) said today its net profit rose to EUR 8.5 million ( USD 11m ) in 2008 from EUR 7 million in 2007 .",2
"Via the agreement , Ramirent will expand the range of equipment and services it delivers to Destia , Ramirent Finland 's managing director Kari Aulasmaa , said .",2
Diluted earnings per share ( EPS ) fell to EUR 0.63 from EUR 1.71 .,0
"Finnish Vaahto Group that provides paper-making technology and process machinery is starting negotiations concerning the temporary lay-offs of all 140 employees at the company 's plants in Hollola and Tampere , in Finland .",0
"Finnish property investor Sponda said it has agreed a 100 mln eur , five-year mln credit facility with Swedbank and a 50 mln eur , seven-year facility with OKO Bank .",1
Mr. Doring has been with Eaton since 1989 and acted as the Business Unit Manager for Eaton 's Power Controls Business Unit since January 2007 .,1
It also recovers valuable raw material for Kemira 's water chemical production .,1
We are very proud to be able to use this kind of innovative mobile service for voting in elections .,2
Country : ; Germany Sector : Construction-Real Estate ; Machinery-Engineering Target : Caverion GmbH Buyer : YIT Oyj Deal size in USD : 90.3 m Type : Corporate acquisition Status : Agreed,1
"Finnish engineering and technology company Metso Oyj said on May 27 , 2008 it completed the acquisition of paper machinery technology from Japanese engineering company Mitsubishi Heavy Industries ( MHI ) for an undisclosed sum .",2
The number of customers is one of the most important parameters in determining the price of electricity networks .,1
"The reason for this is St. Petersburg status as a capital , one of the participants in the meeting quoted Chikunov as saying .",1
The robust growth was the result of the inclusion of clothing chain Lindex in the Group in December 2007 .,2
"The Estonian beverages maker A. Le Coq today brought to the market a new premium class beer , A. Le Coq Special , investing 6 million kroons EUR 383,000 into its development and planning to sell three million liters of the beer during the next year .",1
"STORA ENSO , NORSKE SKOG , M-REAL , UPM-KYMMENE Credit Suisse First Boston ( CFSB ) raised the fair value for shares in four of the largest Nordic forestry groups .",2
"Finnish GeoSentric 's net sales decreased to EUR 939,000 in January-March 2009 .",0
The company confirmed its estimate for lower revenue for the whole 2009 than the year-ago EUR93 .9 m as given in the interim report on 5 August 2009 .,0
Finnair said that the cancellation of flights would cause daily losses of  x20ac 2.5 million US$ 3 million .,0
"Operating profit fell to EUR 35.4 mn from EUR 68.8 mn in 2007 , including vessel sales gain of EUR 12.3 mn .",0
"The chilled meat products category led the meat , fish and poultry market in Finland , accounting for a share of 31.4 % .",1
No financial details were available .,1
"Finnish silicon wafers maker Okmetic Oyj said on September 17 , 2008 that it will invest a total of 15 mln euro $ 21.3 mln in its sensor wafer business .",1
TietoEnator signed an agreement to acquire Indian research and development ( R&D ) services provider and turnkey software solutions developer Fortuna Technologies Pvt. Ltd. for 21 mln euro ( $ 30.3 mln ) in September 2007 .,1
The terms and conditions of Stock Option Scheme 2004 are available on the Group 's website .,1
"Outokumpu of Finland , stainless steel manufacturer , plans to enter into a supply agreement with the Indian Railways .",2
"The contracts between Raute Corporation and Muling Kemian Wood Products Co. , Ltd. , which were announced on 3 November 2010 , have taken effect .",1
"Exel 's board of directors will propose a dividend of 0.2 euro $ 0.3 per share for 2006 at the annual general meeting on April 19 , 2007 .",1
"Profit for the period totalled EUR 1.1 mn , down from EUR 1.6 mn in the third quarter of 2008 .",0
The trucks feature an Eco Drive system - a fuel measuring tool which stores data particular to individual drivers .,1
Wellness services will be important in the future .,1
"`` The enterprise value of the Fray Bentos pulp mill and Forestal Oriental totals approximately euro1 .6 billion , '' UPM said .",1
Around 250 of these reductions will be implemented through pension arrangements .,1
"In January-June 2010 , diluted loss per share stood at EUR0 .3 versus EUR0 .1 in the first half of 2009 .",0
Operating profit in the fourth quarter fell to EUR33m from EUR39m a year earlier .,0
"Only this time , Nokia , India 's largest MNC , has sought out a topic that could spark off a million approaches ` Creativity in Emerging Markets .",1
Sales increased due to growing market rates and increased operations .,2
"The price of raw material aluminium went up at the end of 2005 , but the company considers its outlook for 2006 favourable .",2
- The Group -¦ s result before taxes was a loss of EUR 0.6 ( +0.6 ) million .,1
"Digia said its consolidated net sales for January-June 2010 were EUR67 .8 m , up 9.7 % on the same period in 2009 ( EUR61 .9 m ) .",2
"`` EB Tough VoIP was designed to fulfill the communications needs of military units , and we continue to strive towards achieving that goal , '' Mikko Viitaniemi , EB Elektrobit Defense Products , Wireless Solutions senior manager , said in a statement .",1
( I&H ) in a move to enhance growth .,2
"UPM is the biggest producer of magazine paper in Europe , with a market share of over 30 pct , and it is likely to say that prices in the segment were at best flat during the quarter , analysts said .",1
"The third applicant , Fortum , was dropped .",1
The business to be divested generates consolidated net sales of EUR 60 million annually and currently has some 640 employees .,1
26 January 2011 - Finnish software solutions provider Basware ( HEL : BAS1V ) said yesterday it adjusted its strategy and goals for the next four years with focus on international growth mainly via acquisitions .,1
"The Group 's consolidated net sales for 2008 totaled 3.4 billion euros and it employs approximately 13,000 persons .",1
UPM stock fell 3 percent to EURO 12.49 $ 17.24 in early afternoon trading in Helsinki .,0
"Profit for the period totaled EUR 39.4 mn , up from EUR 33.9 mn in the corresponding period in 2006 .",2
Both Mr Walden and Mr Ignatius will be responsible also for the newspapers ' business result .,1
"Kesko Agro Eesti , the retailer and wholesaler of grain , agricultural and warehousing machinery and accessories , had net sales of 81 million euros in 2007 , an increase by one-tenth over the preceding year .",2
Stora Chief Executive Jouko Karvinen has described the Russian tariff hikes as a threat to the future of the forest products industry in Finland .,0
Aspo serves demanding business-to-business customers .,1
Finnish plastic pipe maker Uponor is selling its Irish and UK infrastructure businesses to private equity company 3i .,1
Odell has not contacted the State of Finland in this issue .,1
"The company designs , manufactures and markets advanced composite products for industrial applications and consumer goods such as cross-country , alpine and Nordic Walking poles , floorball sticks and antenna radomes .",1
Their names have not yet been released .,1
"Tampere Science Parks is a Finnish company that owns , leases and builds office properties and it specialises in facilities for technology-oriented businesses .",1
This corresponds to 6.81 percent of Okmetic 's share capital and voting rights .,1
The company operates power plants in the Tyumen and Chelyabinsk regions and in the Khanty-Mansi Autonomous District .,1
"F-Secure reported that : - The first half of 2008 has seen a growing number of targeted malware attacks on individuals , companies , and organizations .",1
The volume of investments in the two phases of the project is estimated at USD 300mn ( EUR 215.03 mn ) .,1
"The segments through which the company operates are Frozen Food business , Seafoods , Vegetable Oil business , Grain Trading and Other business operations .",1
"Byline : Tim Moran Cellular phone giant Nokia Corp. is offering $ 8.1 billion for digital map supplier NAVTEQ Corp. , of Chicago .",1
"The poorest index figure was given to Finnish power company Fortum , 4.5 .",0
"Outotec is currently delivering a new oil shale processing plant for Eesti Energia in Estonia based on Enefit technology , which has been developed jointly by Eesti Energia and Outotec .",1
Metsa-Botnia will sell 82.1 % of its stake in the Uruguayan companies and Metsaliitto -- 5.5 % .,1
"As with other stakeholders , COMPTEL has been involved in the workshops , meetings and filed comments on the issues of greatest importance to the competitive sector of our industry .",1
The net sales decreased to EUR 49.8 million from EUR 59.9 million .,0
Nokian Tyres ' tyres are considered genuine winter tyres in Russia .,1
"` Nordea 's definitely too big for Sampo to acquire , ' said an analyst ` But Sampo would appear to have an agenda for Nordea ahead of the privatisation .",1
"`` I 'm pleased to receive the Nomination Committee 's request and confidence , '' says Jon Risfelt .",2
"In the third quarter , net sales increased by 12 % year-on-year to EUR 159.5 million , or by 6 % at comparable currency rates growth .",2
In 2005 the bank posted a net profit of Lt 8.2 mn .,1
Finnish business software group AffectoGenimap Oyj said its net profit halved to 1.2 mln euro ( $ 1.5 mln ) in the first nine months of 2006 from 2.2 mln euro ( $ 2.8 mln ) in the same period of 2005 .,0
"`` Indo-Russia trade can cross the targeted 10 billion dollars by 2010 and double to 20 billion dollars by 2015 , if trade irritants and procedural hassles are resolved , '' the chamber said in its survey on obstacles to trade with Russia .",2
The ore body is sufficient to support anticipated production for at least 46 years .,1
"Seventy-three of those also have more extensive training in products built on the latest ArchestrA technologies , such as the Wonderware System Platform .",1
The turbines are expected to be launched by the end of 2012 .,1
"Nordic banks have already had to write off sizable loans in Latvia , with Swedbank , Nordea , DnB NOR and SEB reporting combined losses in excess of $ 1.35 billion in the period 2007 to 2010 against a backdrop of near economic meltdown in Latvia .",0
Almost two thirds of Olvi 's net sales come from outside Finland .,1
"Poyry 's contract includes engineering management , civil and detail engineering services , and time scheduling and procurement services .",1
This wood lacquered clock comes with a stripy hand-crocheted cover .,1
"I can say categorically , no , ' Wahlroos was quoted as saying by the paper , when asked about Sampo 's interest in making a bid for RSA .",1
Operating profit decreased to EUR 11.2 mn from EUR 16.6 mn .,0
Saunalahti is a part of the Elisa group .,1
Financial terms were n't disclosed .,1
"Rinkuskiai raised the sales by 18.1 percent , to 1.37 million liters , while the sales of Kauno Alus grew by 14.3 percent , to 960,000 liters .",2
The Extraordinary General Meeting is expected to take place no later than 18 February 2011 .,1
"As a result , the distribution companies will start to distribute , in addition to their current product offering , Shimano reels , rods and other Shimano fishing tackle products on an exclusive basis .",2
"Mobile phone shipments jumped 26 percent to almost 112 million units , while Finnish company 's global market share rose to 39 percent from 36 percent .",2
"The divested company is part of TietoEnator 's business area Government , Manufacturing & Retail .",1
"Many of the commercial vessels had got stuck in the narrow Bay of Bothnia , where the ice is thicker , and around the Aaland islands .",0
Componenta will also offer a five-year subordinated loan for subscription by the public .,1
UPM-Kymmene is working closely with its shipping agents to reduce fuel consumption and greenhouse gas emissions .,2
"The Finnish business delegation includes representatives from over 20 companies that include Nokia Corp , Finnfund , Outokumpu Oyj , OKO Bank , Alteams Oy and Cargotec Corp. .",1
"Operating profit of Kauppalehti group rose to EUR 1.5 mn from EUR 1.3 mn , and that of Marketplaces to EUR 1.3 mn from EUR 1.0 mn in the third quarter of 2006 .",2
Sanoma Magazines Finland 's net sales grew to EUR 140.1 mn from EUR 131.8 mn .,2
"It is the first oil company to join RSPO and commits fully to sustainable sourcing of feedstocks for the production of its NExBTL biodiesel , it said .",1
Elisa has commissioned Finland 's Poyry Telecom Oy to conduct a study of reception in some of Estonia 's largest cities besides Tallinn .,1
"`` We 're delighted with the move '' says Morna Cowie , co-owner , above , `` it 's double the size of our current shop and has a lovely feel to it . ''",2
"Viking will pay EUR 130 million for the new ship , which will be completed in January 2008 .",1
"`` Beyond the improved voice capabilities , customers now have a streamlined way to comply with recalls and other traceability requirements , providing them with a competitive advantage .",2
The new factory working model and reorganisations would decrease Nokian Tyres ' costs in the factory by EUR 30 million ( USD 38.7 m ) .,2
"Nokia controls more than 50 percent of phone sales in India and Africa , and has a strong prosition on most other emerging markets .",2
"The first four of the new shop-in-shops will be opened this spring : on Madison Avenue in New York as well as in Chicago , Los Angeles and San Francisco .",1
"As a result of the share issue , the number of the company 's shares increases by 391,630 shares and the share capital by a total of EUR 15,665.20 .",1
We are also pleased to welcome the new employees to Tieto . ',1
"The contract value amounts to about EUR11m , the company added .",1
"Currently , YIT builds a housing estate Zapadnye Vorota 26,000 square metres in the city and a house 9,910 square metres , which will be completed at the end of 2009 .",1
"Earnings per share for the quarter were also higher year-on-year at 0.33 eur versus 0.27 , and above market expectations of 0.28 eur .",2
"Finnish property investment company Citycon will expand and refurbish +àkersberga shopping center in Stockholm , in Sweden .",1
"Cargotec Corporation , Press Release , August 26 , 2008 at 10 a.m. Finnish time Cargotec 's MacGREGOR business area providing marine cargo handling and offshore load handling solutions has received significant offshore crane retrofit order .",2
Central Europe is an important market area for Honka .,1
"Finnish publisher Alma Media ( HEL : ALN1V ) said Wednesday it has decided to further extend its EUR1 .85 ( USD2 .75 ) apiece mandatory tender offer for media group Talentum ( HEL : TTM1V ) , which started on 19 August , until 16 November .",1
"Metso Foundries Jyvaskyla , Inc. will begin personnel negotiations on temporary lay-offs and personnel reductions in Jyvaskyla , Finland .",0
This is the second successful effort for the financial investor this year .,2
"The store is located in Poznan in a shopping center named Pestka , the company added .",1
The transactions would increase earnings per share in the first quarter by some EUR0 .28 .,2
Atria Group is a leading Scandinavian meat products group .,2
"According to CEO Matti Karppinen , Frozen Foods posted a good result in 2010 , as it did in 2009 .",2
The MET is located in the Central Business District ( CBD ) of Bangkok .,1
"Coca-Cola was the market leader of manufacturers with a market share of 36.9 % , down 2.2 % from the corresponding period in 2004-2005 .",0
The value of the orders is over EUR 25mn .,1
"( ADP News ) - Dec 11 , 2008 - Finnish construction and engineering company Outotec Oyj ( OMX : OTE1V ) said today it won a EUR 28 million ( USD 36.8 m ) order to expand the phosphate concentrator in Siilinjarvi of Norwegian minera",2
For the new shares subscribed with stock options all shareholder rights commence from the date on which they are entered into the Trade Register .,1
Incap Contract Manufacturing is a subsidiary of Incap Corporation of Finland .,1
SSH Establishes New Global Sales and Marketing Group to be led by George Adams ; Adams Establishes Global Sales and Marketing Group to Drive Worldwide Programs Supporting SSH Tectia Enterprise Security Solutions,1
"`` The acquisition of Sampo Bank makes strategic sense for DB , '' says Lindsey Liddell , director of Fitch Ratings 's Financial Institutions Group .",2
"Finnish Talentum reports its operating profit increased to EUR 20.5 mn in 2005 from EUR 9.3 mn in 2004 , and net sales totaled EUR 103.3 mn , up from EUR 96.4 mn .",2
The reductions will be concluded by autumn 2010 .,1
Pohjola will act as the manager of the issue and the bond will be listed on NASDAQ OMX Helsinki Ltd. .,1
"ADPnews - Sep 28 , 2009 - Finnish silicon wafers maker Okmetic Oyj HEL : OKM1V said it will reduce the number of its clerical workers by 22 worldwide as a result of personnel negotiations completed today .",0
"The total value of the agreement is USD4 .0 m , the company said .",1
"The other seats would go to Edgar Edmonds , an American with experience of the clothing and retail industry , and Christian Fischer , an Austrian with experience in the winter sports goods business .",1
Finnish metal industry solutions supplier Outotec Oyj net profit rose to 50.4 mln euro ( $ 72.5 mln ) for the first nine months of 2007 from 20.1 mln euro ( $ 28.9 mln ) for the same period of 2006 .,2
"In addition a reduction of nine persons will be made through pension or other arrangements , the company added .",1
Nokia and Elisa will work together to bring a superior mobile gaming experience for Elisa customers .,2
"` It is a testament to the quality of our LTE solution and our commitment to the Japanese market ' , he added .",1
"Now , Nokia has announced the launch of Bicycle Charger Kit that is compatible with all Nokia phones that have a 2 mm charging interface .",1
Finnish department store chain Stockmann Oyj Abp net profit rose to 39.8 mln euro ( $ 56.8 mln ) for the first nine months of 2007 from 37.4 mln euro ( $ 53.4 mln ) for the same period of 2006 .,2
"Earnings per share for January-June 2010 were EUR0 .30 , an increase of 20 % year-on-year EUR0 .25 .",2
"Operating profit for the three-month period decreased from EUR1 .65 m while net sales increased from EUR14 .6 m , as compared to the corresponding period in 2005 .",0
A merger between UPM and Finnish-Swedish Stora Enso is not likely either .,1
"Finnish shipping company Finnlines , of the Grimaldi Group , reports its net sales decreased to EUR 241.8 mn in January-June 2009 from EUR 384.0 mn in the corresponding period in 2008 .",0
Major Order in India Comptel Corporation has received a significant long-term order for mediation and provisioning solutions being used by a leading operator in India .,2
"Finnish investment group Neomarkka Oyj ( HEL : NEMBV ) said today that it will buy the former production facilities of Kuitu Finland Ltd , as part of negotiations on the option to invest in specialty cellulose fiber business .",1
"Via the move , the company aims annual savings of some EUR3m , the main part of which are expected to be realized this year .",2
The company expects its net sales in the first half of 2008 to reach the previous year 's level .,2
Finnish aluminium products manufacturer Nordic Aluminium Plc ( OMX Helsinki : NOA1V ) reported on Monday ( 18 August ) an operating profit of EUR7 .9 m on net sales of EUR55 .2 m for the period January-June 2008 .,1
"On the other hand , Finnish sawmills ' production has decreased even more .",0
The value of the deal is estimated at between SEK25m and SEK50m .,1
"At 1411 CET , ArcelorMittal had lost 7.26 % to EUR 17.38 on Euronext Paris , coming at the lead of the blue-chip fallers .",0
"At first the contract envisaged the construction of three ferryboats with an option for two more units , further confirmed at a total value of 500 mln euro ( $ 645.8 mln ) .",2
Why not give your bedroom a cool makeover for summer .,1
Delivery is due in the second half of 2011 .,1
The order is included in Metso 's fourth quarter 2007 order backlog .,1
"After the sale , Savcor Group Ltd will comprise Savcor ART , a corporate function and an investment in Cencorp Corporation .",1
"One price category is for calls on the preferred operator 's network , and another for calls on other operators ' networks .",1
According to an  posted by the World Intellectual Property Organization : `` The present invention relates to hydrocarbons and particularly to the manufacture of hydrocarbon components suitable as aviation fuels or jet fuels and as blending stocks for aviation fuels .,1
"INTERNET BUSINESS NEWS - -® 1995-2006 M2 COMMUNICATIONS LTD As part of a drive to protect users of its Internet banking service , Barclays Bank has announced that it is to recommend F-Secure Internet Security to its customers .",1
"In addition to Russia , we now seek additional growth in Ukraine .",2
"Participants at any of the book discussions or other special events , or visitors to the car dealership were eligible to enter the drawing for the 2005 silver , four-door Altima .",1
"In the first nine months of 2010 , the company 's net loss narrowed to EUR415 ,000 from EUR7 .4 m for the corresponding period of 2009 .",2
"To choose BasWare as the tools for our Financial Service seemed like a natural continuation of our cooperation '' , says Tommi Leskinen , Financial Applications Manager , Neste Oil Corporation .",1
"Trading code : ELI1V Number of shares : 99,483 Price-share : Gratuitous After the transfer , Elisa holds a total of 10,435,023 own shares .",1
"Jarmo Honkamaa , head of the oil refining business at Neste Oil , says the situation looks promising from their viewpoint .",2
He is resting comfortably and is looking forward to getting back to work . '',1
"TietoEnator was down 1.13 pct to 18.38 , extending recent lows after last week 's second-quarter report , dealers said .",0
The Court 's decision will also promote genuine competition in services,1
Financing of the project will come mainly from China .,1
After 1 April 2007 Cencorp will not have any own employees in the territory .,1
"Cencorp estimates that its net sales in the last quarter will be as earlier stated , EUR4 .3 m to EUR5 .0 m , and operating profit (EBIT)is estimated to be positive .",2
The customers will have an access to integrated propeller and gear packages from one source .,1
No changes in media activity were seen in October compared with September .,1
The passenger tunnel is expected to be put into operation in 2009 .,1
"The talks involved the Food and Ingredients Divisions , as well as group service functions , the company said .",1
"A Flurry Analytics spokesperson said that , as it was only measuring Windows Phone 7 data for some weeks , the firm double-checked the data to make sure the 66 per cent rise was not an aberration .",1
The company expects its net sales in 2008 to increase 5-10 % from 2007 .,2
Scanfil has also issued a profit warning .,0
"The Annual Report will be sent automatically to shareholders holding at least 2,000 Sampo plc shares .",1
"Sampo Housing Loan Bank , a unit of Finland 's Sampo Bank , has priced its EUR1bn ( USD1 .3 bn ) bond at 99.889 % , Reuters reported .",1
"The company designs and manufactures high-quality clothing , interior decoration textiles , bags , and other accessories .",1
"In Finland , OP-Pohjola 's staff union is boycotting the group 's insurance sales tasks because the company has refused to take the sale of insurance into account in determining wages .",0
"The company has delivered the technical infrastructure , used by NAV for their data warehouse and business intelligence initiatives .",1
Russia 's Video International Group holds a controlling stake in Russian Media Ventures .,1
