sentence,label
"To check them out or to make a bid they will be in the Deka Showroom , Fortitude Valley .",1
"Protalix closed at $ 10.71 on Friday on the American Stock Exchange , giving a market cap of $ 827 million .",1
We do hope that this will in the future turn out to be a novel method for the prevention of alcohol and tobacco smoking associated oral cancers .,1
"PA ) , JPMorgan Chase and Co ( NYSE : JPM ) and Pohjoa Bank are joint lead-managers on the senior , unsecured deal .",1
"The floor area of the Yliopistonrinne project will be 7,900 sq m and the building 's gross area will total 12,800 sq m. A total 25.1 % of the facilities have been let .",1
"H+Ñkan Dahlstr+Âm , head of mobility services at TeliaSonera , has forecast that mobile data volume on the TeliaSonera network in Sweden will rise eight-fold to 200,000 TB by 2014 .",2
The following information was released by Comptel : Tomorrow the Chairman of the Federal Communications Commission is scheduled to deliver the National Broadband Plan to Congress .,1
The European Central Bank ECB is anticipated to raise its benchmark interest rate in the second half of 2011 at the earliest .,1
"Previously , the company expected its 2008 financial performance to remain at the same level as in 2008 .",1
Passenger volumes rose by 8.4 % in the accounting period .,2
"By the end of 2006 , the number of joint branch offices will total 170 .",1
Halonen 's office acknowledged receiving the letter but declined comment .,1
NetCom expects to complete Turbo 3G deployment in these areas this year .,1
An individual promotion also generated slightly higher-than-expected revenues .,2
"However , the orders received during the period under review fell by 17 % quarter-on-quarter from the EUR 213 million recorded in the second quarter of 2010 .",0
The report will be emailed within 2 business days of an order .,1
"Finnish construction group Lemminkainen Oyj HEL : LEM1S said today it has won a contract to provide technical services for the Nevsky Centre shopping mall to be opened in November in St Petersburg , Russia .",2
"The Polish business employs about 1,000 people , and it had net sales of about EUR 70mn in 2007 .",1
"The plant is scheduled for completion in late February 2007 with hand over of some areas in January Two other suppliers of Nokia - Aspocomp Group Oyj and Perlos - have announced their plans to establish plants within the Nokia complex Together , they will invest Rs 365 crore .",1
"The technology will become available to businesses from the fourth quarter , Nokia said .",1
Circulation revenue has increased by 5 % in Finland and 4 % in Sweden in 2008 .,2
Finnish Raute Precision has won large glass batch plant and mortar plant orders from Mexico and the US .,2
"The businesses to be divested offer dairy , edible fats , ready-meal and ice-cream packaging to multinational and local customers .",1
A profit is still on target .,2
The companies signed the letter of intent for the sale on 17 September 2010 and envisaged to seal the actual agreement on 1 January 2011 .,1
"3G data subscribers are also helping to maintain these growth levels , since data-only subscriptions push for more multiple SIM ownership .",1
"The German company has also signed a code share agreement with another Oneworld member -- American Airlines Inc , part of US-based AMR Corp ( NYSE : AMR ) .",2
The corrected chapter is in its entirety below .,1
The new technology improves the glass quality and consistency while increasing throughput .,2
"Sales VAT inclusive expanded by 19 percent , to 351 million euros .",2
"`` They would invest not only in the physical infrastructure , but would also provide know-how for managing and developing science and technology parks , '' said Sunrise Valley director Andrius Bagdonas .",2
Componenta 's objective with this agreement is to increase business on its existing production lines .,2
An Android app will be coming soon .,1
"`` In Ukraine , too , we act as a partner for major bakery clients in both production and product development .",1
Diluted earnings per share ( EPS ) rose to EUR 0.29 from EUR 0.05 .,2
"In a media advisory , the NTSB said that after subsequent testing , `` the train detection system intermittently failed . ''",0
"Back then , Tikkurila 's former owner , Finnish chemicals company Kemira Oyj HEL : KRA1V , distributed an 86 % stake to Kemira shareholders to facilitate the divestment and listing of Tikkurila .",1
"In 2007 , Huhtamaki will continue to invest in organic growth .",1
"Global Markets Direct 's Pohjola Bank plc - Financial Analysis Review is an in-depth business , financial analysis of Pohjola Bank plc. .",1
The sales price was not disclosed .,1
"Crucially , the decision to use ETSI ( European Telecommunication Standard Institute ) - backed DVB-H adds to the growing list of operators and equipment manufacturers opting for the standard ( see Global : 20 January 2006 : Competing Technologies Vie for Mobile TV ) .",1
Profit for the period fell to EUR 1.6 mn from EUR 7.5 mn in January-September 2008 .,0
"Both operating profit and sales for the three-month period increased , respectively from EUR0 .3 m and EUR13 .1 m , as compared to the corresponding period in 2005 .",2
Earnings per share ( EPS ) amounted to a loss of EUR0 .38 .,0
The fair value of investment properties was EUR 2 251.0 ( 1 281.4 ) million .,1
The deal means that ten persons in three countries will transfer to Tieto .,1
Basware offers full support for all SAP versions starting from SAP 4.5 .,1
"Exel Composites ' long-term growth prospects remain favourable , however .",2
"According to Tyrv+ñinen 's estimation , Japan is a very essential location in terms of Finnair 's Asian strategy .",1
"However , the suspect stole his burgundy Nissan Altima .",0
"`` I 'm happy with the outcome , '' Sneed said after the hearing .",2
"ADP News - May 29 , 2009 - Bank of America BofA downgraded today its ratings on Swedish-Finnish paper maker Stora Enso Oyj HEL : STERV and on Finnish sector player UPM-Kymmene Oyj HEL : UPM1V to `` underperf",0
Viking Line and STX Finland said on Monday that there were plans to build a 240 million euro ferry that would be launched on the Turku-Stockholm route in spring 2013 .,1
"In January-August 2009 , imports by sea in container , lorry , and trailer units fell by 27.7 % and exports by 28.6 % from the corresponding period in 2008 .",0
The operating margin came down to 2.4 % from 5.7 % .,0
Its market share widened to 48.51 percent from 48.31 percent a year earlier .,2
Financial details were not disclosed .,1
The repurchases shall decrease the distributable capital and reserves .,0
"The Liquid Handling segment offers laboratory equipment and accessories , including mechanical and electronic pipettes , and disposable tips used in the research institutions , universities , and hospitals , as well as in the pharmaceutical , food , and other industries under the Biohit brand .",1
"Sanoma also has an Executive Committee , in accordance with the Company 's Articles of Association , that prepares proposals for matters to be decided or noted by the Board of Directors .",1
"At this stage , a maximum of 60,000 Tulikivi Series A shares will be acquired , representing about 0.16 per cent of the company -¦ s shares outstanding .",1
EUR 152.4 mn of this was net interest income .,1
"`` BasWare 's product sales grew strongly in the financial period , by 24 percent .",2
Panostaja Oyj 's Board also decided at its organisational meeting held upon completion of the AGM to implement the AGM decision concerning Board member fees paid as shares in such a way that shares are transferred on a quarterly basis on the date following publication of the quarterly-annual report .,1
"Today , we are connecting people in new and different ways - fusing advanced mobile technology with personalized services to enable people to stay close to what matters to them .",1
"A coker crane will be supplied to Tesoro Corporation 's Golden Eagle Refinery in Martinez , California , while a similar crane will be delivered to BP 's Castell refinery in Spain .",1
L&T 's net profit for the whole 2010 dropped to EUR 36 million from EUR 45 million for 2009 .,0
There are no substitutes to AC drives .,1
"Unlisted British Biologicals makes B - and D - proteins , and other disease-specific supplements that cover diabetes , hepatitis , asthma and other cardiovascular ailments .",1
Metso Paper 's delivery will comprise an Advantage DCT 200 tissue machine including quality control and distributed control systems ( QCS-DCS ) .,1
`` Directors and shareholders alike should ask why these practices were allowed to continue . '',1
Nokia and Capcom announced that Resident Evil Degeneration will be released on N-Gage later this year .,1
"The Stena Poseidon is a so-called Panamax tanker , designed to be able to pass through the narrow passages in the Panama Canal 's locks .",1
"`` We will now , after the relevant authority approvals , make a mandatory bid as required by the Finnish Securities Markets Act .",1
Finnish communication electronics components supplier Scanfil Oyj Tuesday said sales in the first half of 2006 will be 15 % lower than during the same period a year ago .,0
"Nordea Bank AB publ holds 6.000 Alma Media shares , representing 0.008 % of share capital and voting rights .",1
"`` Adjustment to the fall in price level , in contrast , has been less effective .",0
"Dopplr members share personal and business travel plans privately with their networks , and highlight interesting places to stay , eat and explore in cities around the world .",1
"In Finland , insurance company Pohjola and the Finnish motorcyclist association have signed an agreement with the aim of improving motorcyclists ' traffic safety .",2
"Following the issue , the number of shares in the Swedish company will grow by 9 % .",1
"+£lemiste City is the environment for a knowledge-based economy providing work for 3,300 people with the total turnover of its companies amounting to EEK 5.4 bn , '' said +£lo P+ñrnits , chairman of the supervisory board of +£lemiste City and Mainor .",1
"Baltic Pearl CJSC , a subsidiary of Shanghai Foreign Joint Investment Company , is developing a project in St Petersburg , comprising about a million square meters of residential space , two hospitals and several schools and nurseries .",1
"Among paper issues , Stora Enso R was little changed -- up 0.08 pct at 12.03 eur , UPM-Kymmene was 0.48 pct higher at 18.77 eur and M-real B added 0.50 pct to 3.99 eur .",1
"The company said that its investments in the new market areas resulted in sales increase in Sweden , Poland , Russia and Lithuania .",2
"Ahlstrom Corporation STOCK EXCHANGE ANNOUNCEMENT 7.2.2007 at 10.30 A total of 56,955 new shares of Ahlstrom Corporation have been subscribed with option rights under the company 's stock option programs I 2001 and II 2001 .",1
"Our customers come from the following countries : UK , USA , Spain , France , Italy , Germany , China , Hong Kong , Sweden , Norway , Netherlands , Austria , Belgium , Switzerland , Czech Republic , Finland , Canada , Russia , Ukraine , Denmark , Ireland , South Korea and Liechtenstein .",1
Pohjola could increase its stake to 45 % in 2013 .,1
"The Process Products orders are for the installation of separation-filtration equipment at three natural gas pipeline projects in China , South America , and Saudi Arabia .",1
"In 2007 , Marimekko has also opened concept stores in Yokohama and Nagoya , central Japan , in Silver Spring in metropolitan Washington DC , USA , in Graz , central Austria , and in Aalborg , northern Denmark .",2
"Finnish metal components supplier Componenta on December 26 , 2006 applied for approval with the Turkish Capital Markets Board to launch a mandatory offer for the remaining shares in iron and aluminium castings producer Doktas Dokumculuk .",1
"The transaction , which includes US$ 1.5 billion euro1 billion in cash , vendor notes and share purchases , is expected to be completed in the first quarter of 2008 , the Finnish-Swedish paper maker said .",1
The revenues of the business reached NOK 12 million for 2008 .,1
The total value of the deal is USD 29mn .,1
Finnish lifting equipment maker Konecranes HEL : KCR1V said on 29 July 2009 it has raised its stake in Austrian manipulator maker ACS Konecranes to 80 % and bought German sector player Knight Europe .,2
"In the method the smelt spouts 2 are separated from the working area 6 by a shielding wall 8 , 10 arranged movable in relation to the smelt spouts .",1
"A structures BIM ( building information modeling ) software from Tekla , a model-based software provider , has been adopted for the construction management and delivery of a university project in Abu Dhabi .",1
"Galeria Podlaska , a shopping mall on Wysockiego Street in Bia ` ystok , is approximately 60-percent leased or reserved .",1
Altimo and TeliaSonera said yesterday that Usmanov would be welcome to join the new company .,2
"Destia Oy is a Finnish infrastructure and construction service company building , maintaining and designing traffic routes , industrial and traffic environments , but also complete living environments .",1
"According to the company , a decision in the issue will be made in the summer of 2010 , at the earliest , and in the summer of 2011 , at the latest .",1
"The Samsung Mobile Applications Store was launched in January 2009 by Samsung Mobile Innovator , a program which enables mobile software developers to create applications for use across Samsung mobile devices .",1
Finnish Okmetic that manufactures and processes silicon wafers for the semiconductor and sensor industries and Norwegian solar wafer company NorSun have signed a contract under which Okmetic will supply NorSun mono silicon crystals for use in solar cell manufacturing .,2
Last year 's third quarter result had been burdened by costs stemming from restructuring in the US .,0
hu will offer a further discount of between 25 % and 50 % on selected books .,1
The company will release its 2010 results on 11 February 2011 .,1
Last year 's net sales rose to EUR 68.3 million from EUR 62.2 million .,2
"Finland 's national carrier Finnair PLC carried a record 8.5 million passengers in 2005 , an increase of 4.5 percent on the previous year , the airline reported Tuesday .",2
Finnish fibre-based materials maker Ahlstrom Corp ( HEL : AHL1V ) said today it decided to close down its spunlace composite production line number 23 at Chirnside plant in the UK by the end of March 2011 .,1
"Operating profit decreased to nearly EUR 1.7 mn , however .",0
"The company 's operating income ( EBIT ) totalled EUR 0.0 mn , up from EUR -0.3 mn year-on-year .",2
LONDON MarketWatch -- Share prices ended lower in London Monday as a rebound in bank stocks failed to offset broader weakness for the FTSE 100 .,0
"Finnish airline Finnair has won a deal with the UK public sector to be the official airline for flights from London Heathrow to Osaka in Japan , as well as flights between Manchester in the UK and Helsinki in Finland .",2
The Finnish company has also reached arrangements regarding the working hours and annual holidays .,1
"Section : Regional News - The demand in Finnair 's Asian traffic , measured in passenger kilometers , was up 34.9 % in August compare to last year .",2
At the same time I am delighted by the fact that we were able to accomplish the organization with our own team members .,2
The company plans to expand into the international market through its subsidiaries and distributors from 2011 onwards .,2
"Finnish Metso will supply new wood handling and bleaching lines , as well as a rebuild of the kraft liner washing line for Klabin 's Tel+¬maco Borba mill in the Brazilian state of Paran+í .",2
F-Secure Online Backup automatically protects all the content stored on a computer or smartphone by making a copy of the content to an online location .,1
"When this investment is in place , Atria plans to expand into the Moscow market .",1
The value of the deal was not disclosed .,1
Finnish Cargotec has been awarded a significant order for a total of 292 Hiab loader cranes by BAE Systems in the US .,2
"The adapter , awarded with the `` Certified Integration for SAP -« ; NetWeaver '' endorsement , integrates Basware s invoice automation and procurement solutions with more than 200 different ERP systems .",2
"It is necessary to strengthen the company 's operations , however .",1
U.S. District Judge Douglas P. Woodlock yesterday extended a Jan. 17 temporary restraining order until March 7 .,1
"( ADPnews ) - May 4 , 2010 - Finnish cutlery and hand tools maker Fiskars Oyj Abp ( HEL : FISAS ) said today its net profit declined to EUR 12.9 million ( USD 17m ) in the first quarter of 2010 from EUR 17 million in the correspond",0
Currently the quarterly applied surcharges differ significantly from the actual market prices .,1
"Kalnapilio-Tauro Grupe ( Kalnapilis-Tauras Group ) , which is owned by Denmark 's Royal Unibrew , raised its market share to 25.2 percent from 23.91 percent , as beer sales for the nine months jumped by 11.4 percent to 52.99 million liters .",2
Net sales of the Vegetable Oil Business rose to EUR 10.6 mn from EUR 10.1 mn .,2
` Nordic infrastructure construction is one of our strategic growth areas .,1
"Poyry Energy GmbH is Austria 's leading engineering and consulting company in the energy , infrastructure and environment sector , owned by Poyry Plc. and the Austrian Verbund AG .",1
The company had net sales of EUR 19.8 mn and a pre-tax profit of EUR 1.8 mn in 2005 .,1
"According to Finnish insurance companies Tapiola , Local Insurance Group ( L+ñhivakuutus ) , and Pohjola the two fierce storms at the end of July and in the beginning of August 2010 that felled trees around Finland have speeded up sales of forest insurance .",2
IonPhasE 's second major owner is venture capital firm Aura Capital .,1
"`` We reached agreement with the union that flights will continue as normal , '' Finnair spokesman Usko Maatta said .",2
"He does not believe , however , that HKScan or Atria will start to use imported meat as Finnish consumers prefer domestic products .",1
The duration of the contract is 37 months .,1
Finnish plumbing and heating systems supplier Uponor Corporation ( OMX Helsinki : UNR1V ) said on Tuesday ( 12 August ) that its board of directors has authorised the management to proceed with a company-wide cost reduction program .,2
"Most recently , he founded Virent Energy Systems , Inc. , an 80 person catalytic biofuels company , where , as president and CEO , he led the company through multiple financings , defined the company 's market strategy , and secured the company 's first customers .",1
"Biohit and VWR have been in close cooperation for a number of years in the US , where Biohit is one of VWR 's focus suppliers .",2
The bridge is part of the highway 14 development project .,1
"Capacity of the facility made by Finland 's Vaahto Group is 86,000 tons of light coated paper .",1
Incap Corporation Stock Exchange Release 4 May 2010 at 8.30 a.m. INCAP CORPORATION 'S DIRECTED SHARE ISSUE WAS SUBSCRIBED IN FULL The Board of Incap Corporation has approved the subscriptions of directed share issue .,1
"The company is in the process of building a new fleet and has placed orders for 10 P-Max tankers of 65,200 dwt .",2
Pretax loss totalled EUR 162.3 mn compared to a profit of EUR 253.5 mn in 2007 .,0
`` Nokia is just interested in bring Nokia to the market . '',1
Delivery is expected to take place later this month .,1
The companies expect the first orders already in 2011 .,2
The manufacturing will begin in Pietarsaari in the beginning of the year 2009 and the delivery will take place in October 2009 .,1
HELSINKI ( AFX ) - Outokumpu said it has agreed to sell the Hitura nickel mine in Finland to Canadian group Belvedere Resources Ltd for 10 mln eur worth of Belvedere shares .,1
"Ahlstrom Corporation STOCK EXCHANGE RELEASE 13.02.2008 Ahlstrom , a global leader in high performance fiber-based materials , today announced the completion of the acquisition of Friend Group Inc. , which consists of West Carrollton Parchment Company and West Carrollton Converting Company .",1
"The platen edges in contact with the band are provided with a seal having a protrusion directed towards the middle area of the platen , and means are provided to exert and maintain a pressure in the volume defined by the platen , the band and the seal . ''",1
EuroChem CFO Andrey Ilyin said : `` This facility marks another important step for EuroChem in securing the long-term financing necessary for our potash and other strategic projects '' .,2
Kirsi Rantanen was previously development director for HK Ruokatalo 's poultry business .,1
"The 10,000-odd square metre plot that Stockmann has bought for the Nevsky Center shopping center is located on Nevsky Prospect , St Petersburg 's high street , next to the Vosstaniya Square underground station , in the immediate vicinity of Moscow Station .",1
"The equipment is designated to Bollore Africa Logistics terminal Societe d'Exploitation du Terminal de Vridi SETV in Abidjan , Ivory Coast and the delivery is scheduled to start in March 2010 .",1
Finnish component supplier Componenta Corporation ( OMX Helsinki : CTH1V ) reported on Tuesday ( 15 July ) an operating profit of EUR46 .2 m on net sales of EUR386 .0 m for the financial period January-June 2008 .,1
"The pulp production in Finnish Kemij+ñrvi will also be liquidated and about 1,100 employees loose their jobs .",0
"In accordance with our strategy , we strengthened our local presence by establishing a representative office in South Africa in October .",2
"Construction work on the Helsinki Music Centre is to start this autumn , with the total cost of the project estimated at 140 million euros .",1
Glaston also has efficiency measures in all other units .,1
Stora Enso Oyj said its second-quarter result would fall by half compared with the same period in 2007 .,0
The terms of the transactions remained undisclosed .,1
"The operating loss amounted to EUR 0.8 mn , compared to a profit of EUR 3.9 mn a year earlier .",0
"However , this increases signaling traffic which wastes network resources and allows fewer smartphones to connect .",0
"Net income from life insurance rose to EUR 16.5 mn from EUR 14.0 mn , and net income from non-life insurance to EUR 22.6 mn from EUR 15.2 mn in 2009 .",2
Brazilian mobile player Telemig Celular yesterday announced that it has selected Finnish software developer Tecnomen Oyj to expand its prepaid billing system .,2
"Several large stocks tacked lower , however .",0
The deal also includes a ten-year maintenance agreement .,1
"Poyry is a global consulting and engineering firm focusing on the energy , forest industry and infrastructure & environment sectors .",1
"Commenting on the deal , Shane Lennon , SVP of Marketing & Product Development at GyPSii said : ?",1
ASSA ABLOY Kaupthing Bank gave a ` neutral ' recommendation and a share price target of 174 crowns $ 24.7 - 19 euro on Swedish lock maker Assa Abloy AB .,1
The agreement must be approved by the Russian competition authorities before it enters into force .,1
Operating profit rose to EUR 9.2 mn from EUR 6.8 mn in the corresponding period in 2007 .,2
"Finnish software and hardware developer Elektrobit Oyj HEL : EBG1V , or EB , said today it will temporarily lay off up to 200 people for a maximum of 90 day in Finland , aiming to achieve cost savings of EUR 1.7 million USD 2m in the second half of 2010 .",0
"Following its strategy , Tikkurila has established a fully-owned sales company TOO Tikkurila in Almaty , Kazakhstan , for marketing decorative paints under the Finnish Tikkurila brand and the Russian Teks brand .",1
Prices and delivery volumes of broadband products decreased significantly in 2005 .,0
"Operating profit for the six-month period decreased from EUR111 .9 m , while sales increased from EUR1 ,275 m , as compared to the corresponding period in 2006 .",1
"We offer our clients integrated management consulting , total solutions for complex projects and efficient , best-in-class design and supervision .",1
Pretax profit jumped to EUR 21.9 million from EUR 3.1 million .,2
"In February 2011 , new wording of Identity Documents Act that makes Mobile ID a state-approved electronic document as of February 1st 2011 entered into force .",1
Sanoma News ' advertising sales decreased by 22 % during the year .,0
Related links : Flexiblebaseloadoperation TheWartsila32generating set Gasconversions This is the shorter of two versions of this press release .,1
Aspocomp has a large factory in China and a factory building project in India that was halted due to financing problems .,0
Bovine slaughtering and cutting at the Kuopio facility will be transferred to the Kauhajoki slaughterhouse .,1
NASDAQ-listed Yahoo Inc has introduced a new service that enables Malaysians to take their favorite Internet content and services with them on their mobile phones .,2
"Profit after taxes for the period was up to EUR0 .9 m , from EUR0 .01 m last year .",2
AffectoGenimap builds highly customised IT solutions for its customers in Finland and the Baltic countries .,1
"Glaston , headquartered in Tampere , Finland , is a growing , international glass technology company .",2
"The contracts awarded to date , in connection with the system , amount to a total EUR 36 million .",1
Finnish beverage company Olvi is introducing a new long drink Olvi Kultalonkero ( `` golden long drink '' ) in the market in Finland in the spring of 2009 .,1
"Employing 112 in Finland and 280 abroad , the unit recorded first-quarter 2007 sales of 8.6 mln eur , with an operating loss of 1.6 mln eur .",0
"The Finnish government announced Wednesday that it sold a 32 percent stake in chemicals and fertilizer group Kemira Oyj for (  x20ac ) 655.6 million ( $ 890US million ) , sending the company 's share price up 6 percent .",2
