sentence,label
Compnay also said that it would lower the price of projects by about one third with last November.,1
The implementation of the deal is subject to the approval the Finnish Authority.,1
"Net in the three months through March 31 fell to (x20ac) 103 million (US $ 165 million) from () 131 million a earlier, the Finnish said.",0
Other were not provided.,1
"Addition, the includes modification of the effluent treatment plant at Follum.",1
"Operating profit totalled EUR 30. 2 mn, EUR 43. 8 mn a year earlier.",0
Mr. Koistinen joins from Nokia Networks where he held various senior sales and business development positions since 1997.,1
"+ £ lemiste City is the a knowledge - based economy providing work for 3, 300 people with the of companies amounting to EEK 5. 4 bn, ' ' said + £ lo P + ñrnits, chairman of the supervisory of + £ lemiste City and Mainor.",1
The divestment of Raisio ' margarine business in May 2009 gave the company a focus on - based products.,2
"In the end, Sanoma News wants to secure its the savings.",1
ND = Not.,1
"The authorisation is in force until the end of the Annual General Meeting and repeals the to acquire own shares given the General Meeting held on 4, 2007.",1
"We look forward to part in the future of the, ' ' says Tomas Billing, President of Nordstjernan.",1
"The first phase of the logistics complex envisages the completion of some 70, 000 sq of logistics premises and the in November 2008.",1
"Finnish Vaahto Group that provides paper - making and process machinery is starting negotiations concerning the temporary lay - offs of all 140 employees at the ' plants in Hollola and Tampere, in.",0
The company also expects to sell products in other Russian.,2
The contract new energy - efficient AC drives that have been designed in cooperation between the.,1
Aspo ' s Group structure and business operations are continually any predefined schedules.,1
For the Department Store Division increased by 15% and sales for the clothing store Seppala increased by 8% Meanwhile for Hobby Hall decreased 12%.,2
Is one of the best - Duckburg illustrators.,1
Goal is to secure the company ' s and competitiveness.,1
"One of the headboxes will be equipped a modern consistency control system to cross machine profile of the plasterboard, company said in a statement by Network.",1
New B shares the right to dividend and other shareholder rights with effect from today.,1
"Plant will go on stream in November 2008 and its daily will be 120, 000 litres of bioethanol.",1
The sum is about EUR 10mn $ 12. 97 mn.,1
Estimated value of the is USD 9. 2 million.,1
"Apartment block will be well - located, in easy of the city center and close to both a school and kindergarten.",2
"Under the name UK, a former Uponor, the company has been Uponor ' s long - term partner in supplying Velta - branded systems particularly the commercial and building sector in the UK and internationally.",1
The business initiatives in America are headed by Lynn Shanahan.,1
"Have sound experience of project deliveries for large multi - purpose complexes and sports arenas ' ', says Sami Eronen, SVP, and Northern, Ruukki.",1
Componenta increased its stake in steel company Doktas Dokumculuk Ticaret Sanayi. S. to 92. 6 pct stake in March 2007.,2
The company said that has agreed to a EUR160m unsecured credit line lenders.,1
The technology park will be near St. - based Pulkovo airport.,1
"Sold shares for $ 19 at $ 6. 06 - 7. 12 share, compared with Friday ' high of $ 11. 33 and low of $ 10. 14.",0
Status:,1
"Finnish manufacturer Scanfil reports net sales of EUR 241. 2 mn in 2006, down from EUR 321. 6 in 2005.",0
"Alpina is a Lebanon, USA based distributor of e. g. Alpina ski shoes and, Exel ski poles, Start ski waxes and now also Peltonen cross - country skis.",1
"The beginning of the negotiations, the estimated number of reductions 50 at the maximum.",1
Business area ' s net sales were slightly 2m in 2006.,1
The figure does include food exports from Finland.,1
The contracts comprise turnkey orders for RoRo for two RoRo - cruise construction for Viking Line and Tallink.,1
"The machine, which will have a width of 6. 25 m and a design speed of 900 m - min, will close to 1, 400 of folding boxboard per day.",1
Sanoma wants a new and better frequency for the Helsinki area.,1
"The company that the operations will be sold to a newly established, CPS GmbH, where the present management of the plastics business is a -.",1
"Known Post Bank, the concept would see Fidelity Bank rolling 75 offices in Post premises, to provide financial services to the people.",2
Stora Enso owns 43 of Bergvik and earns therefore 1. 5 bn on the value appreciation.,2
An audio webcast will be available live and archived on ' s site at. cerner. com.,1
"Improvements in demand and the adjustments we made, theutilization rates of Cramo ' s fleet have. ' '",2
"` ` The Intel Atom processor has had in the marketplace since its launch over 2 ago, ' ' said Pankaj, director of global ecosystem programs for Intel Corp. ' Ultra Mobility Group.",2
"Finland - based rental company Ramirent Plc (OMX: RMR1V) said on Friday (9 May) that its president and CEO, Kallio, has informed the board of intention to retire in year 2009.",1
"HELSINKI - Konecranes said it raised its stake in MMH Holdings Inc, the owner of - based Morris Materials Handling, to 90. 9 pct from 74. 5 pct.",2
"Operating was EUR - 0. 1 mn, down from 1. 3 mn.",0
"The, awarded with the ` ` Certified Integration SAP - «; NetWeaver ' ', integrates Basware s invoice automation and solutions with more than 200 different ERP systems.",2
"The total amount was 40, 000 and the recipients were on the recommendation of fine arts universities and sports associations.",1
This PC application allows users to copy files and other data from their Nokia mobile device to their computer as as content.,1
"The StoneGate product family was designed to provide the full benefits of a unified management shared, reporting and auditing.",1
Dragonfly Love is video from start to finish using the Nokia N8.,1
The reduction from 1999 to 2017 will be thus 41%.,1
"ADPnews - Feb 5, 2010 - real estate investor Oyj HEL: SDA1V said that slipped to a net loss of EUR 81. 5 million USD 11. 8 m in 2009 from a of EUR 29. 3 million in 2008.",0
And that ' s exactly what happened on a recent when an baker was brought in to residents about the Easter tradition of making wheat and rice pies.,1
IonPhasE ' major owner is venture capital firm Aura Capital.,1
"The reporting period, BioTie North American licensing partner Somaxon Pharmaceuticals announced positive results in a pilot Phase 2 clinical trial for smoking cessation.",2
The transaction announced on September 29 when Pohjola Insurance to pay EUR 80 (USD 106. 3 m) in cash for Pohjantahti.,1
Financial or pricing details were disclosed.,1
The shipyard hopes the regional in Andalusia can offer its some form of financial.,1
"Both operating profit and net sales the 12 - month increased, respectively from EUR21. 5 and. 1 m, as compared to 2005.",2
Curators have divided their material eight themes.,1
"M - real, is part of Finnish paper maker Metsaliitto Group, is due to its second - report at 12: 00 EET on 5 August 2010.",1
Effect of the savings will be noticeable as of the of 2010.,2
Incap it will generate a of 10 mln euro ($ 13. 2 mln) from its operations for 2007.,1
"AHMS will also Hotel and Hotel Project, Services, Brand Franchise, Training and Sales and Marketing services on a pan - India basis.",1
Last year ' net sales rose to 68. 3 million from EUR 62. 2 million.,2
"At 10. 33 am, the market ' biggest faller, 8. 69 pct lower at 11. 35, while the OMX Helsinki 25 was 0. 32 at 3, 332. 41, and the OMX Helsinki was up 0. 47 at 11, 687. 32.",0
The Finnish daily surmises that Finnish supplier Rautaruukki has raised prices above Aker ' s comfort zone.,0
"In Finland, Cargo Terminal, of Finnish Nurminen Logistics, has purchased a warehouse with rights in the Port of Hamina.",1
The sales of the Tiimari segment by 4. 0% - on - year to EUR3. 3 m in 2010.,0
"Elisa Corporation will disclose its financial statements 2006 on Thursday, 8 2007.",1
"Both operating profit and net for the six - month period increased, respectively EUR7. 5 m and. 5 m, as compared to the period in 2005.",2
", 000 in Q1 2010 6 May 2010 - textile and clothing design Marimekko Oyj (HEL: MMO1V) said its profit rose to EUR928, 000 in the first quarter of 2010 from, 000 in the corresponding period a year earlier.",2
"` ` My is looking forward to getting a paycheck again, ' ' he quipped recently as a six - current swirled around anchored and sponsored jet sled.",1
"The quarter of 2010, the group ' s net profit rose to 3. 1 million from EUR 2. 5 million in April - 2009.",2
"In Q1 of 2009, the company ' result taxes from continuing operations, non - recurring items, totalled EUR - 0. 4 mn, to EUR - 0. 1 mn in the period in 2008.",0
"Kesko Eesti, the retailer and wholesaler of grain, agricultural and machinery and accessories, net sales of 81 million euros in 2007, an increase by one - tenth the preceding year.",2
` ` We be there.,1
"QPR has an international customer base, spread over 70 countries in 2009, and a variety of including banks, manufacturing companies, service and authorities.",1
"Stock price rose 70. 0 ores or 0. 9% to at SEK77. 65, a two - day streak of losses.",2
Raute said it has won an order worth 15 mln eur to supply several plywood production lines to operated by Russian wood products company Sveza.,2
"Swedish telco TeliaSonera is teaming up with Friends, a Swedish organization bullying, to fight bullying of and teenagers electronic channels.",1
The is to start production in the first half of 2007.,1
"Nyrstar has also agreed to supply to Talvivaara up to 150, 000 of sulphuric per annum for use in Talvivaara ' s leaching process the period of supply of the zinc in.",2
Airbus has 100 firm orders the A350 and 89 nonbinding.,2
"R, founded in 1649, is of the oldest companies in the world and is the largest manufacturer of lightweight steel scissors in the U. ..",1
"The fish of the nuggets is 85% , and the fish comes from and Finland.",1
Raffles Equities Ltd became a substantial holder in Exploration Ltd on January 12 with 11. 7 shares (18. 2 ).,1
CapMan made its investment in in June 2006.,1
The Finnish Stockmann has signed the with the company Technopolis.,1
"Fiskars, the World ' 1 Scissors Brand TM, recently Learning - « Magazine ' s 2011 Teachers ' Award for the Classroom.",2
"OMX Nordic 40 OMXN40 index, comprising the 40 traded Nordic on the Nasdaq OMX exchange, down 0. 87% at 1, 064. 14 points on Thursday.",0
"& Gabbana the European Union to declare Marimekko Corporation ' s ` ` Unikko ' ' pattern trademark invalid, in a continuing dispute between the two companies.",0
Operating profit fell to EUR 23. 26 mn from 32. 86.,0
Works has invested in its product and market research.,1
"Operating profit and sales the three - month period increased, from EUR0. 3 m and EUR13. 1 m, compared to the corresponding period in 2005.",2
The share of the capital of above mentioned shareholders remains below 5%.,1
"Profit for the six - month period decreased, net sales increased from EUR436. 9 m, as compared to the corresponding period in 2007.",0
"AD, Bulgaria ' s leading Internet company.",2
Diluted earnings per (EPS) fell to EUR 0. 63 EUR 1. 71.,0
- related revenue rose by 5. 1% to EUR 460. 8 mn 438. 5 mn in 2009.,2
"Most of the growth in consumption took place in the Far East, Latin America and.",1
This is the first time Finnair has awarded an agreement with the government.,2
"Operating profits in the half were 0. 8, down from 0. 9 as Glisten invested in the brand and the management.",0
"According to the prosecutor, the share were out after HK had proceeded in the negotiations concerning the acquisition of Swedish Meats.",1
Profit for the was EUR 15. 6 mn compared to 14. 1 mn in 2007.,2
"When the situation, the company will be to increase the amount of residential units for sale in Petersburg and Moscow, in particular.",2
The four - year contract between the bank and Ski Sport Finland will bring the bank ' s to skiers and.,1
Annual value of the contracts is estimated at USD 2mn over the three years.,1
The reported today an operating loss of. 1 m on net sales of EUR4. 5 for the first quarter 2008.,0
Has a good track record of major projects in Latin America.,2
The Group ' s business is by its portfolio of sports and presence in all major markets.,2
Costs for flight operations fell by 6. 4.,2
The maker did not disclose any financial details.,1
A quick ` ` - stop - shop ' ' to understand the.,1
"OMEO (www. omeo.) employs 55 and expects net sales of 23 euro ($ 29. 8) for fiscal 2006 - 2007, ending April 30, 2007.",1
"In January - June 2010, diluted per share stood at. 3 EUR0. 1 in the first half of 2009.",0
Cramo Group ' s financial for 2010 - 2013 sales growth higher than 10 percent per; return on equity above 15 percent.,2
"The evidentiary hearing in the Investigation is for 21 - May 1, 2008.",1
"The said that currently the distribution unit Ragot is located in Loudeac, , the distribution unit Waterqueen and supplier Tortue in Saint Marcel in mid - France and the hook manufacturing unit and hook distribution unit VMC Europe in Morvillars.",1
"Net income totaled EUR 15. 9 mn, to EUR 15. 6 mn a earlier.",2
Nokia is requesting that the companies stop and selling the mobile and pay monetary damages and costs.,1
"Tampere Science Parks is a company that owns, leases and builds properties and it specialises in facilities for technology - oriented.",1
Capital base and capital measurement is based on approaches Basel II.,1
Situation has now improved.,2
The category was by maturity and the recession.,1
"Business units of the InvestLesProm Group cover the full industry chain, and the Group owns forests, sawmills, paper and pulp mills, and other.",1
"Niina Nenonen, Marimekko ' s director clothing, bags and lines, will take up this role.",1
The Finnish company previously said result will be lower the break - even posted a year earlier.,0
The value of the is EUR 4mn.,1
"We have also our projections for paper and packaging, ' ' an analyst Goldman Sachs said on a note on Monday.",0
M - real ' s mill is starting negotiations to cut staff.,0
The new is planned to have an electricity generation capacity of up to 350 (MW) and the same heat generation.,1
"In providing managed, Nokia responsibility for building, operating and transferring as well as optimising the Indosat 3G.",1
"The combination of all services enabling us to offer a and service chain not only limited to the Baltic port connections but also for access to the world wide Grimaldi Network into the Mediterranean, Africa and North America ` ` says.",2
Mursula said they tried to macro - economic perspective to see how Malaysia doing.,1
In addition the deal includes a option which will enable Maritim Food AS to increase holding in Sandanger AS to 51% in the.,2
"mn, and pretax profit to EUR 46. 4 mn 35. 8 mn in the third of 2006.",2
Finnair has over 500 flights because of the strike.,0
After 1 April 2007 Cencorp will have any employees in the territory.,1
` ` Stonesoft great promise in the future of.,2
"In January - September 2009, the ' s interest income increased to EUR 112. 4 mn EUR 74. 3 mn in - September 2008.",2
"According to Gallup Food and Farm Facts, beef consumption 99mn in Finland in 2007.",1
"Seven - month sales of Ragutis, which is controlled by the Finnish Olvi, declined by 11. 2 percent, to 15. 41 million liters, and the 9. 89 of the.",0
"Beef fell from 2006, to 14mn kilos.",1
Operating profit - recurring items EUR 7. 8 million compared to EUR 11. 2 million.,0
"Thanks to his contact network and good knowledge of market and business, he will give a great contribution to the further development of our operations ' ', ' s President & CEO Juhani Hanninen.",2
The company ' model is based on developer contracting construction projects and focused project management.,1
"Could be any of at any time, ' ' she said.",1
AffectoGenimap builds highly customised for its customers in Finland and the Baltic countries.,1
Director Timo Kohtam + of Lemmink + Infra nevertheless points out the continued need for infrastructure construction in the Baltic markets.,1
Will bring cost savings of EUR 3mn a year.,2
"no compensation for its news, opinions distributions.",1
"Empresa de Desarrollo Urbano Quito, INNOVAR - UIO, Ecuador commissioned Poyry to prepare a feasibility study for a urban rapid mass transit system.",1
"Total investment in the company will be EUR58m, of which Wartsila ' s share will be EUR29m.",1
All are.,1
For the totalled EUR 15. 6 compared to a profit of EUR 6. 3 mn in 2008.,0
To the switchboard and directory services decreased significantly since our employees now have up - to - date information all their colleagues and customers on their phone and can place the call directly.,1
As an overall effect of the above - mentioned Glaston will recognize - expenses of EUR 12 million in the fourth quarter of 2008.,1
"A total of 15, 000 shares with a nominal value of EUR 1. 35 per share were subscribed between 17 and 23 March 2006 exercising the - B - options based on the ' s stock option plan 1999.",1
Efficiency programs totalling 100 million are under way in.,2
Finnish electronics manufacturer PKC Group Oyj (OMX Helsinki: PKC1V) said on Wednesday (31) that it has completed the of MAN Nutzfahrzeuge ' s cable harness from MAN Star Trucks & Spolka zoo in Poland.,2
This resulted in sales figures in Sweden.,2
"The company reported sales of EUR550m in 2005 and had some 3, 200.",1
"On investment 5. 0% , compared to a negative 4. 1% in 2009.",2
"26 January 2011 - Finnish metal products company Componenta Oyj (HEL:) said yesterday its narrowed to, 000 in the last of 2010 from EUR5. 3 m for the same period a year earlier.",2
The new name of the Sanoma will be News.,1
UPM - Kymmene has generated thirty - one consecutive of EBITDA.,2
"Cargotec ' s totalled 3. 4 in 2008 and it employs approximately 10, 500 people.",1
"Talvivaara Mining Company PLC (Talvivaara Mining) (LSE: TALV ), a Finland - based nickel, has its second production at its metals recovery plant on June 9, 2010.",1
"production facilities 6 2010 - Finnish Neomarkka Oyj (HEL: NEMBV) said today that will buy the former production facilities of Kuitu Finland Ltd, as part of negotiations on the option to invest in cellulose fiber business.",1
"Nordea AB publ 6. 000 Alma Media shares, representing 0. 008% of capital and voting rights.",1
The tunnel is expected to be put into in 2009.,1
"To Seikku, the retail sector in is controlled by 3 - 4 large actors, food manufacturers are still relatively small.",1
Nokia said the was a ` ` fair and responsible plan. ' ',1
Renesas Mobile Europe Ltd has approximately 470 in.,1
"As a of the merger, the largest professional electronics and telecommunications technology center in Finland will be formed in Sievi.",1
"The in the activeness of ' s customers, which started at the end of 2009, continued during the reporting period, the stated.",2
"In Switzerland, Teleste have been an of products for a long and primary customers include cable and fiber - to - the - home (FTTH) operators.",1
"The fair value of the investment properties totaled EUR 2, 534. 9, up from 2, 455. 1 in 2006.",2
Company expects its sales for the whole 2009 to be at previous year levels.,1
Finnish Okmetic that manufactures and silicon wafers for the semiconductor and sensor industries and Norwegian solar wafer NorSun signed a contract under which Okmetic will supply NorSun silicon crystals for use in solar cell manufacturing.,2
"The targets sales of 27. 1 mn (23. 498 mn) and a of Ls 300, 000 (Ls 371, 500) in 2007.",1
"May 29, 2010 (CompaniesandMarkets. delivered by Newstex) - - This report data and information on the meat, fish and poultry in Finland.",1
' s order book at the of 2010 was 30% up - on - year and 10% up quarter - on - quarter.,2
"Companies evaluated in the include Aladdin, CA, F - Secure, Kaspersky, Marshal, , Microsoft, Panda, Proofpoint, , Symantec, Trend Micro, Tumbleweed, and.",1
"The the company reports net sales of EUR 11. 9 mn, down EUR 14. 2 mn, and an EBIT of EUR - 2. 2 mn, down from EUR - 1. 7 mn.",0
"HELSINKI AFX - Kesko Corp is expected to report a second quarter EPS today due to tax charges, other earnings lines are higher year - on -, analysts said.",0
"Founded in 1985, ' s clientele consists of public sector builders, central trading companies and firms.",1
Elcoteq has a proven in electronics manufacturing services (EMS) and a global factory network coupled with modern manufacturing and consistent systems and processes.,2
Kone dropped 4. 1 percent to x20ac 43 US $ 55. 77 in.,0
"The company designs, manufactures and composite products for industrial applications and consumer goods such as - country, alpine and Nordic Walking poles, floorball and antenna radomes.",1
The net sales of the Plants business were 710. 3 million in 2005.,1
"At the of Finnish company Alma ' s newspapers, research manager Kaivo - oja at the Finland Futures Research Centre at the Turku School of Economics has up a future scenario for ' s national economy by using a model developed by the University of Denver.",1
Public will also be available.,1
Pretax loss EUR 162. 3 mn to a profit of EUR 253. 5 in 2007.,0
"Demonstrations of the broad capabilities of the Suite will be organized during the 3GSM Congress in Barcelona, from February 12th to 15th.",1
"Of the, Kesko ' s is 10 mln euro $ 15. 5 mln and it will recognize a gain of 4. 0 euro $ 6. 2 mln on the disposal will be in the result for the second of 2008.",2
"To the company, the - offs will be temporary.",1
It the companys strategic strengths and weaknesses.,1
"In ' s Hobby Hall ' s sales 10% , and international sales fell by 19%.",0
"The repeated its ` buy ' rating, based on expectations that current restructuring will lead to a improvement in performance in Europe in 2007.",2
"Ahlstrom STOCK ANNOUNCEMENT 7. 2. 2007 at 10. 30 total of 56, 955 of Ahlstrom Corporation have been subscribed with option rights under the company ' s stock option programs I 2001 and II 2001.",1
Panostaja did not disclose the purchase.,1
Fortum has a blocking stake in Northwestern - 1.,1
"Sullivan said some of the ` ` really involve a lot of, and people should get paid for time. ' '",1
"In Finland, the largest brands control 90% of the beer.",1
"Key shareholders of Finnish IT provider TietoEnator Oyj on Friday rejected a hostile EUR1. 08 billion $ 1. 67 billion from shop Nordic Capital, giving life to a possible counter offer Blackstone Group LP and Norwegian telecom Telenor ASA.",2
M - plans to discontinue production of coated paper in the Hallein and Gohrsm + + hle mills.,1
"Under the rental, Stockmann was to in the building of a bridge over the Gogol or build an underground tunnel for crossing the street by 2004.",1
"New units will be built at ' s of the art manufacturing facility in San Antonio, Texas, USA, which started operations in 2009.",1
"The orange - handled scissors from Fiskars are part of the design collection of the Museum of Modern in New York, as well the Philadelphia Museum of.",1
"It for the 12MP snapper, if else.",1
"EPS continuing operations came in at 0. 30 eur, up 0. 17.",2
"The first installment of the Cinema Series concludes with a profile of inventor Linden, whose personal artistic journey and at has led to dozens of design awards.",1
The expansion aims to new both in Finland and abroad.,2
Terms of the transactions remained undisclosed.,1
A spokeswoman for the Italian house declined comment on the.,1
Elisa has commissioned Finland ' s Poyry Telecom Oy to conduct a study of reception in of ' s largest besides Tallinn.,1
"YIT acquired investment rights to a 10, 000 square metre residential project in Yaroslavl and to a 16, 400 square in.",1
Personnel reductions concern approximately 104 people.,0
The current lay - offs are to the temporary lay - offs agreed in 2008 and in 2009.,0
"The company had earlier said that it was considering different strategic options for the struggling low - operator, including a divestment of holding.",1
"The Group, with sales of 235 million in 2009, employs than 2 000 people in 33 countries.",1
Expansion is to be finalized in the autumn of 2009.,1
"The shares shall be repurchased through public trading, for the shares are repurchased than in proportion to the holdings of the shareholders.",1
The company to open its first online shop in the in the summer in 2011.,1
"Is a retail chain of 11 stores, controlled by Finnish Non - Food Center KY, Rukax OY, and - Tukka OY.",1
Tielinja generated net of 7. 5 euro $ 9. 6 mln in 2005.,1
"Payment date is March 25, 2010.",1
"It includes the company ' s new, powerful, and scalable Flexi Multiradio 10 Base Station.",1
Finnish KCI Konecranes raised its net sales growth 2006 from over 25% to over 35%.,2
"Real estate company Sponda Oyj said on April 11, 2008 build Vuosaari Harbour Service Center at the Port of Helsinki.",1
Sales due to growing rates and increased operations.,2
"After the, Savcor Group Ltd will comprise Savcor, a function and an investment in Cencorp Corporation.",1
"About Marubeni Marubeni Corporation: 8002; ADR: was established in 1858, and is a company of Marubeni, one of Japan ' s leading general trading houses.",2
Metso said it has an order worth 40 eur to supply a kraftliner board machine to China ' s Lee & Man Paper Co..,2
"In 2008, revenue of approximately EUR 2. 8 billion and a staff of 9, 400.",1
"Estonian telecoms company Elisa ' s customer numbers cross 400, 000, Oct 22, BNS - company Elisa won approximately 50, 000 new clients in the nine months of, bringing the number to 401, 800 by the end of September, the company said.",2
