sentence,label
"HELSINKI - Salcomp, the phone charger manufacturer, said it has appointed Markku Hangasjarvi as its new, following the resignation of Mats Eriksson.",1
"The move is aimed at boosting sales, - efficiency and market in Finland.",2
We are pleased to you to M - real ' international conference call at 3: 00 p. m. EET.,1
"To PKC, the acquisition would a significant addition to PKC ' s customer base.",2
"Finnish shipping company Finnlines ' pretax 6. 5 mn in the third quarter of 2009, compared to a profit of EUR 0. 3 in the third quarter of 2008.",0
Facility consists of a seven year bullet term loan of 200 mln $ 292. 4 mln and a 150 euro $ 219. 3 five year revolving credit facility.,1
"Profit decreased to nearly EUR 1. 7 mn,.",0
Deliveries by will take place over 30 months.,1
Serves demanding business - to - business customers.,1
"The Lithuanian beer made up 14. 41 million liters in, a rise of 0. 8 percent the year - earlier, the Lithuanian Brewers ' Association reporting citing the from its members.",2
"Talvik says the of application programs on servers will continue, HP servers were approved because of HP supplying a tailor - made to Elisa.",1
"The original name Componenta + àm +, a subsidiary of the Finnish Componenta Group, has been changed to + àm + Ñl Components and the company a 63% growth in Q1 2010, in comparison to 2009.",2
Orion Pharma ' s profit by 42. 5% from 2004.,2
"In Finland, Sampo, now part of the Danske Bank group, will off staff from the and support functions.",0
Sales increased to in April to June 2010 from EUR438m a year earlier.,2
The layoff talks were first announced in.,1
"Earnings per amounted to EUR0. 03, up from the loss of EUR0. 08.",2
"The Bank of Tokyo - UFJ, Ltd acted as agent for the.",1
"O ' ' s Handling Services, located in Perth, is the leading company in Western Australia that supplies, installs and service for tail.",2
Company plans to increase the unit ' s specialist to several dozen - - on the market situation during 2010.,1
"Approximately 166 million in repayments has been demanded for in the Stockholm area, with the SEK 87 million taken the Western coast, the inspectorate said.",1
About Stonesoft Stonesoft Corporation (OMX: SFT1V) is an provider of integrated security solutions to secure the information flow of distributed organizations.,1
Consumer packaging manufacturer Huhtamaki said it swung to a profit of 84. 1 euro $ 105. 6 mln in the nine months of 2006 from a net of 2. 6 mln euro $ 3. 3 mln in the same period of 2005.,2
The terms and conditions of the Stock Scheme 2008 are on the Company ' s internet pages. sanoma. com.,1
"Byline: Tim Moran phone giant Corp. is offering $ 8. 1 billion for digital map supplier NAVTEQ Corp. , of.",1
"Several large stocks tacked, however.",0
RISING have forced packaging producer Huhtamaki to axe 90 at its Hampshire manufacturing plant.,0
"Wireless industry is bracing for the iPhone, which will launch on June 29.",1
"The mall will be on a parity basis Pearl Plaza LLC, the joint venture company established by the Chinese investor Shanghai Industrial Investment Holdings Co, and Group.",1
This is the second successful effort for the investor year.,2
Operating profit rose from EUR 1. 94 to 2. 45 mn.,2
EBIT excluding non - recurring items was to increase 2009.,2
"A local waste company, Turun Seudun J + ñtehuolto, has planned to set up a 150, 000 waste - facility.",1
"The sale will allow Campofrio to focus on recently announced takeover of Smithfield Holdings, the European of Smithfield Foods Inc. (SFD) of the U..",1
"Janno Reiljan, a member of the Eesti Energia supervisory board, the owners of Power Grid had informed Energia about their wish to sell.",1
"Only this time, , India ' largest MNC, has sought out a topic that could spark off a million approaches ` Creativity in Markets.",1
"The contract covers turnkey deliveries to five airports operated the authority - - John F Kennedy, LaGuardia, , Teterboro and Stewart International.",1
"Corresponding increase in the share, EUR422, 754, has been entered in the Trade Register.",1
Loss EUR 25mn compared to a profit of EUR 63mn in the corresponding period in 2005.,0
Tracker G400 is a GPS collar for hunting dogs to monitor the dog ' s position and movements a map application for mobile.,1
EPS to 0. 04 from 0. 02 eur.,2
Implementation of the project will be carried out by the company YIT in association the investment Evli Property Investment Russia (EPI ).,1
"Operating loss of the Pulp & Paper Machinery unit was EUR 3mn in 2007 - August 2008, compared to a profit of EUR 3. 7 a earlier.",0
", the production is almost entirely very labor intensive and based on small only.",1
"Meanwhile, minority shareholders, expecting to retain the bid, shares now.",1
"Seppala the to a greater extent than last year to, and this is reflected on the January sales figures.",1
Per were at loss of EUR0. 24.,0
1 February 2011 - Finnish textile and clothing company Marimekko Oyj HEL: MMO1V said its operating profit to EUR8. 2 m in 2010 EUR6. 3 m in 2009.,2
The estimated synergy benefits are at EUR7m annually.,2
Sanoma News ' decreased by 22% during the year.,0
"The most significant capital expenditure items were in the enterprise ERP project, product development and production machines.",1
SRV lowered its sales estimate for the whole of 2008 due to uncertainties in sales.,0
EPS to EUR3. 68 from EUR0. 50.,2
It ' s.,1
"Dollar fell, though, against the pound and the.",0
"Shares in and Sun Alliance continued to slide back from a 12 - month high of 172p last, after a potential suitor ruled of a takeover bid.",0
"Poyry is a global and engineering on the energy, forest industry and infrastructure & environment sectors.",1
M + ñkel + ñ is a Board for the company as well as discussions on the of Alma media and media company Talentum.,1
"Attention is paid to energy efficiency in the construction of the building, it is designed to meet the requirements of energy class B, and LEED will be applied for.",1
Put up cell phone towers in thinly populated areas when a few balloons would do?,1
"The third quarter result also a 400, 000 euro ($ 575, 000) provision for down - sizing of manufacturing in.",1
"Tekla ' s defense employs over 20 and is located in Espoo, Finland.",1
"Under the terms of the agreement, Bunge will Raisio ' s, Makuisa and Pyszny Duet brands and manufacturing plants in and Poland.",1
The Symbian Foundation to revise its for testing and signing software after digitally signing a trojan for its Symbian mobile operating system by mistake.,1
"` ` Adjustment to the fall in price level, in, has less effective.",0
"According to Kesko, the agreed with the city administration about of the building in 2006, its resettlement and construction of a five - hotel for 120 rooms.",2
"The negotiations concern of Cencorp Corporation and Singulase Oy as in Finland and in, the company said.",1
"The plant is scheduled for completion in late February 2007 with of some areas in Two other suppliers of Nokia - Aspocomp Group Oyj and Perlos - have their plans to establish plants within the Nokia complex Together, they will invest 365 crore.",1
The acquisition of Boats Oy is in with the Done Solutions strategy of developing its business through acquisitions.,2
Nordic was first used as a summer training method by cross - country.,1
Delivers a different user experience and enables us to widen the market can address. ' ',2
"The value of totalled EUR 2, 299. 9 mn, compared to EUR 2, 229. 5 mn in the corresponding in 2009.",2
"in Q1 ' 10 19 April 2010 - Finnish forest and equipment maker Ponsse Oyj: PON1V said that it expects to swing to a net profit of EUR6. 3 in the first quarter of 2010, from an EUR9. 6 m a year earlier.",2
"The estimated of the contract is EUR12. 4. Vaisala, headquartered in in Finland, develops and manufactures electronic measurement systems for meteorology, environmental sciences, and industry.",1
Rapala said it it will make savings of 1 - 2 mln eur a year by centralising its at one site.,2
"To Olvi, the company is already new agreements.",1
"` ` Tough VoIP was designed to fulfill the communications needs of military units, and we continue to strive that goal, ' ' Mikko Viitaniemi, EB Elektrobit Defense Products, Wireless Solutions senior, said in a.",1
Grew 12 percent to (x20ac) 3. 6 billion ($ 4. 5 billion ).,2
The ' s leasing arm Nordea ended the year with a of 4. 4 million euros.,1
The right margin will be viewed separately in detail every.,1
"In the building and home improvement, sales decreased 22. 5% to EUR 201. 4.",0
"Vaisala Press Release September 30, 2010 Vaisala signed a contract to sell its oxygen measurement technology and business to SICK Maihak.",2
"10. 58, Outokumpu 2. 74 pct to 24. 87 eur, the Helsinki 25 0. 55 pct higher at 2, 825. 14 and the OMX Helsinki added 0. 64 pct to 9, 386. 89.",1
Fell abroad but increased in Finland.,1
"The transaction covers a building lot of 46, 763 sq m and buildings of 19, 631 m. the autumn of 2007, when Scanfil discontinued its operations in Oulu, the facilities have been partly to other parties.",1
The announcement comes two weeks before a key licensing agreement expires between between the two companies are embroiled in a disagreement over for Instrument chips which use Qualcomm - patented technology.,0
Finnish Raute has won large glass batch plant and plant orders from Mexico and the US.,2
"` ` We are delighted to announce our support for Intel based platforms, the capabilities of which made development easier and faster.",2
"Proving that good design is truly a work of art, the the 6131 provides a colorful canvas for the expression of mobile - inspired sentiments.",2
The company reports a loss for the period of 0. 4 compared to a of EUR 1. 9 mn in the period in 2005.,2
` ` are pleased to deliver the Invoice Automation solution to a major retail in the US.,2
"At 1411 CET, had lost 7. 26% to EUR 17. 38 on Euronext, coming at the lead of the - chip.",0
"As of new strategy, Finnish Biohit is planning to incorporate its diagnostics business into a limited company.",1
"Paper mills may be set up, especially in the new EU states.",1
Finnish industry companies HK Ruokatalo and will form a joint venture company called L + ñnsi - Kalkkuna to produce meat.,2
A of interests in the sector is clearly way.,2
"To CEO Kai, the company ' s newspapers achieved the best financial result ever.",2
"In August - October 2010, the ' s result before taxes totalled EUR 9. 6 mn, up from EUR 0. 5 in the in 2009.",2
Mr Kivimeister said Deer former Timberjack stands to win in the situation: it controls 60% of ' s forest machinery market.,2
Expects its sales for the first half of 2009 to be less than in 2008.,0
The world ' biggest magazine paper maker the program to improve will include closing of its least competitive mills and would cover all the company ' s operations resulting in savings of some euro200 million US $ 240 million.,2
", headquartered in Tampere, , is a growing, international glass technology company.",2
"Samsung currently occupies place and ground the quarter, dropping by 1. 8% to an 11. 1% share overall.",0
"In the first quarter of 2010, the mark - to - a pretax profit of EUR 133 million versus a loss of EUR 32 million in the same last year.",2
"for the year 2009 improved to EUR484m, as compared EUR472m in 2008.",2
Arrangements do not apply to the group ' s units outside Finland.,1
"According to L + Tehtaat ' s CEO Matti Karppinen, the company to deliver products to its customers a day earlier than it currently does.",1
"In the Baltics, the merger of the businesses of the is to be in early 2008.",1
"` ` We reached agreement with the union that flights will as normal, ' ' Finnair spokesman Usko.",2
"Answers questions on how visitors Conversations gets, how big the team is and what the problems are when setting up social media.",1
"Operating profit and net sales for the - period increased, respectively, from EUR13. 8 m and EUR143. 6 m, compared to the corresponding period in 2007.",2
Viking Line and STX said on that there were plans to build a 240 million euro would be launched on the Turku - Stockholm route in spring 2013.,1
` ` The purchase of the operations is part of YIT ' s to expand its of building services geographically. ' ',2
"According to Saarioinen ' Managing Director M + ñkel + ñ, the food industry sector has a significant excess of production.",1
A is still on target.,2
He said: ` ` It is for sale again and will be actively marketing.,1
"The were carried in a constructive manner, and parties tried to find a solution to the situation.",2
CORPORATION Sami Ervio President and CEO Distribution: NASDAQ Helsinki Major media Comptel Dynamic OSS enable service providers to deliver services flexibly and charge them effectively.,1
"Than 50, 000 tonnes of asphalt mix will be used in the.",1
Profit before taxes decreased to EUR 31. 6 from 50. 0 mn the year before.,0
Finnish Bank of + àland will launch its long - term account at the of June 2010.,1
The full extended - hours analysis and news service is available in real - time through COMTEX.,1
1 2010 - Finnish textile and clothing company Marimekko Oyj (: MMO1V) announced on the opening of its first concept store in Seoul in cooperation with Japanese sector Inc (TYO: 8029 ).,2
"While I cant understand what theyre saying, its impressive to him hit that ball at those.",1
Ericsson and Nokia dominated the of best - selling handsets with five models each.,2
Construction group Lemmink + ñinen been awarded two road building contracts by the Lithuanian transport administration.,2
"Excluding non - items, pre - tax surged 45% to EUR80m.",2
"A light, bright and pretty to your life, it will keep a few pennies in your account.",1
"Unit prices for straddle carriers EUR700, 000 and EUR900, 000, the company added.",1
It recovers valuable raw material for Kemira ' s chemical production.,1
The presentation material be viewed on the company ' website in English after the conference.,1
"In accordance with our, strengthened our local presence establishing a representative office in South Africa in October.",2
Finnish metal solutions supplier Outotec Oyj profit to 50. 4 mln ($ 72. 5 mln) for the first nine months of 2007 from 20. 1 mln ($ 28. 9 mln) for the same period of 2006.,2
Poyry is recognized one of the ' s leading advisors to the global forestry industry.,2
Finnish Bank of + àland reports its operating profit rose to EUR 21. 3 mn in the second quarter of 2009 6. 1 in the period in 2008.,2
"Finnish construction group Lemminkainen Oyj HEL: said it has a contract to provide technical services for the Nevsky Centre shopping mall to be opened in November in St Petersburg,.",2
"Vaahto & Paper, of Finnish Vaahto Group, been awarded an order to renovate Finnish - Swedish forest company Stora Enso ' s paperboard machine at the Board Mill in Finland.",2
"3 January 2011 - Scandinavian lenders Sampo Bank (HEL: ), Pohjola Bank (HEL: POH1S) and Svenska (STO: A) have provided a EUR160m () line of credit to Lemminkainen Oyj (HEL: LEM1S ), the construction firm said on.",1
Liora ' got a brand - new bag.,1
"50 - 50 venture, to be called Nokia Siemens Networks, will be of Nokia ' network business group and ' carrier - related operations, creating estimated synergies of 1. 5 billion euros ($ 1. 9 billion) by 2010, Nokia.",2
"Regulatory News: The Nomination of Cybercom (STO: CYBE ), which is in proposal, the election of Jon Risfelt as the new Chairman of the Board.",1
Altimo and TeliaSonera said that Usmanov would be welcome to join the new.,2
Stora will a 19. 9 pct equity interest in the combined company.,1
"Savon koulutuskuntayhtyma, Finland based has contract for specialist agricultural or forestry machinery.",2
The aims to increase its sales and comparable operating profit in 2006.,2
"In future, the will focus on the production of flange profiles for wind towers.",1
"Berling Capital, Umo Capital and Veikko Laine are the biggest in Capital.",1
The measures result from decreased in technical and product information.,0
TELE2 Affarsvarlden gave a ` ` ' ' recommendation on mobile operator and a price target of 142 crowns ($ 23. 54 - 15. 19 euro ).,2
"Oyj, the Finnish maker of mobile chargers, Monday posted a. 49 million loss in the second quarter with a 1. 70 million profit in the same period the previous year.",0
"The company ' s sales, 38% acquired in Finland, 21% in other European countries, 40% in Asia, and 1% in the.",1
"LONDON (AFX) - Intertek Group PLC, a testing and inspection, its commercial and electrical division has bought - based Natlabs Oy from Oyj for 1. 3 mln eur in cash.",1
"Metso it has sold its roll business and related assets in the town of Nokia, southern Finland, to a group of Finnish investors, who will operate the business under the name of Finbow.",1
Export by 6 to 16. 4 million liters.,0
"Check them or to make a bid they will be in the Deka Showroom, Fortitude Valley.",1
"The contract includes design, construction, of equipment, installation and.",1
Finnish cutlery and hand tools maker Fiskars Oyj Abp (HEL: FISAS) today its net rose to EUR 24. 1 (USD 33. 6 m) in the quarter of 2010 from 17. 9 million a year earlier.,2
in Finland Finnish pharmaceutical company Orion Corporation OMX Helsinki: ORNAV said on Wednesday 7 that has concluded its negotiations in Finland and will the number of personnel by 205.,0
"As a result, the distribution companies will start to distribute, in addition to their current product offering, Shimano reels, and Shimano tackle on an exclusive basis.",2
"On the design of previous handsets, the Nokia E72 and Nokia E63 this Symbian - based model is promised to offer direct access to over 90 per cent of the world s corporate email Mail for and Lotus Notes.",1
"ENP - 22 March 2011 date - 21032011 - A total of 13, 000 Talvivaara Mining Company ' s new shares were subscribed for during the between 1 2011 and 28 February 2011 under the company ' s stock option rights 2007A.",1
"Nokia ' s share price less one percent to 18. 70 euros ($ 25. 41) in Helsinki, while Siemens 1. 02 percent to 90. 19 ($ 122. 57) in Frankfurt.",0
"Headquartered in city, the company is nearly 75 years and focuses on science - innovation and technology for environmental measurement.",1
The platform continue to be the development framework Symbian and MeeGo.,1
"The acquisition does not have to be from the frozen foods fish sector, as long it has synergies with L + ñnnen ' other businesses.",1
"Profit for the period totaled 39. 4, up EUR 33. 9 mn in the corresponding period in 2006.",2
"The donation is EUR 1, 115, 000.",1
"' s system features a new range of value - added for prepaid and post - billing, charging and rating of voice calls, data traffic, any of content services in both mobile and fixed networks.",1
` ` warmly welcome Michael Frei to Outotec.,2
Assignment strengthens Poyry ' position as an international provider of engineering and project services to the chemical process industry.,2
"` ` The summer 2008 will be joyfully fresh like a vitamin injection, ' ' said H & ' s head of design Margareta van.",1
"In the third, net increased by 12% - on - year to EUR 159. 5 million, or by 6% at comparable currency growth.",2
"Affecto will provide a new EFI Data and reporting solution, scoring supporting operational decision processes and Data Migration old legacy systems to the new EFI system.",1
"In the building and home improvement trade, sales decreased by 6. 3% , 154. 1.",0
"In the Baltic, Atria ' s target is organic.",1
"In, snow storms down on power lines, cutting off electricity for some 2, 000 households.",0
The Notice in its entirety with other proposals from the Nomination Committee and the will be at least four weeks 28 April on the ' s website and in Post - och Tidningar and Dagens Industri.,1
` ` We are pleased with the of both negotiating and look forward to a productive years ahead. ' ',2
Market share on the between Helsinki in Finland and Tallinn in Estonia by 0. 1 points to 24. 8%.,0
"Tower it chose to add, due to go into in the, will total capacity to 80 broadsheet or 160 tabloid pages, the ability to run 32 - and 48 - page products side by side.",2
Was 43% to 67% in 2004.,1
"In a announcement to the Helsinki stock, Atria revealed that the company ' third quarter profits declined from. 9 m in the third quarter of last year to EUR12. 7 in this year ' s Q3.",0
"The has a 3G base station at about 17, 000 feet at the foot of Mount Everest that will enable climbers at the 29, 035 - foot summit to surf the Internet and even videos of exploits.",2
This includes a EUR 39. 5 mn change in the fair of investment.,1
"Virala Ab was by the Board of Directors an of EUR 1, 9 million which is EUR 0, 25 million lower than maximum on 12 / 30 / 2010.",1
"He not believe, however, HKScan or Atria will start to use imported meat as Finnish consumers domestic products.",1
"Of the price, a sales gain of 3. 1 mln euro ($ 4. 5 mln) will be recognized in ' earnings for 2007.",2
A total of $ 78 will be invested in the.,1
Investment management and advisory are the company ' s sole line of business.,1
"The company ' s board of directors will propose a of 0. 95 per share 2008 at the annual general meeting, to be held on March 23, 2009.",1
The ground barleycorn has produced in Finland and will be available in as of the beginning of 2010.,1
Panostaja Oyj ' s Board also decided at meeting held upon completion of the to the AGM decision concerning Board member fees paid as shares in such a way that shares are transferred on a quarterly basis on the date following publication of the - annual.,1
20 October 2010 - products company Componenta Oyj: CTH1V said yesterday that its net loss narrowed to EUR7m for the first of 2010 from EUR23. 3 m for the same period of 2009.,2
Metso Paper ' s delivery will comprise an Advantage DCT 200 machine quality control and distributed control systems (- DCS ).,1
"Through its partnership with Finnish Paulig ' s subsidiary Oscar, Puljonki a sales organization in the European.",1
"SDM rental equipment, aluminium scaffolding, power generator and hoists to customers in the construction sector.",1
"Helsinki: ELIiV today reported EPS of EUR1. 13 for 2009, an increase over of. 12 in 2008.",2
Operating margin came to 2. 4% from 5. 7%.,0
"We succeeded in our market share of sold ' ', Mr Kari Kauniskangas, Head of YIT International Construction Services.",2
The combined value of the is EUR 3mn.,1
"Biohit, ., has expanded its mLINE of Pipettors with the of the NEW 1 - 10 ml volume range.",1
Okmetic Board of Directors has also decided on a new share ownership directed to the ' s top.,1
Earnings per share (EPS) in 2005 decreased to. 87 EUR1. 89 in 2003.,0
"The company, employing 6, 400, sales of 620 euro $ 823. 2 mln for 2006.",1
The transaction is expected to be finalized 2009.,1
"Are very with the fine co - operation between the two countries in recent, he said.",2
"It grew in Finland, Norway, and the Baltic.",1
"ALEXANDRIA, Va. , 16 - - Kenneth Bower of Vista, Calif. , has developed an design for a, the U. S. Patent & Trademark announced.",1
"- The Group - ¦ s before taxes EUR 0, 2 7, 8 million.",1
Quality chargers under CHARGZ brand are sold in retail stores and other sales locations - wide.,1
4) Complete name of the shareholder: Otto Bernhard 5) information: The amount of shares now transferred corresponds to 5. 68% of the number of shares in Aspo Plc..,1
"DnB of Norway is the ` ` most likely Nordic buyer ' ' for Citadele, while Nordea be a ` ` good fit ' ', according to the published by Pietiek.",1
"Israeli cable network operator Telecom has chosen Teleste, an international technology group, as its provider of FTTx equipment in, according to Teleste today.",2
"Tecnomen ' s solution can be used for prepaid and post - paid, for charging and rating of voice and video calls, data traffic and any of services in both and fixed networks.",1
The opening of the portal is part of the expansion strategy of Alma Media ' s unit.,1
The prices of stainless steel rose in Europe.,1
"Operating of operations in Finland in the period under totaled EUR 11. 3 mn, remaining at the 2005.",1
Beauty is an version of her chichi loop shade launched in 2001.,1
"The of permanent reductions of clerical workers is 22 employees, of which 19 in.",0
Olvi posted a strong set of figures for the first six of this year.,2
"Water Treatment Products Australia Today, Global Research & Data Services is going to publish a market analysis about the market for treatment products in Australia.",1
"However, the of the paid standing orders in 2009.",2
"Budapest, August 10 MTI - Finnish maker Elcoteq will off 700 workers at its plants in Pecs S Hungary at the end of September because of orders, director for Elcoteq ' s local unit, Zoltan Krippl MTI on Monday.",0
Other deal is for process cranes to the Russian steel mill PNTZ in Pervorouralsky through an order by Turkish construction Endustri Tesisleri Imalat ve Montaj AS.,1
"The Liquid Handling segment laboratory equipment and accessories, including mechanical and electronic pipettes, and tips in the research institutions, , and hospitals, as well as in the pharmaceutical, food, and other industries the Biohit brand.",1
The acquisition is part of Ramirent ' s Central and Eastern growth.,1
"The shopping center to be opened in St. Petersburg, Russia in November 2010 will turn the cash flow of Finnish department store Stockmann ' Russian for the first time in 2011.",2
"ADP News - 29, 2009 - Bank of America BofA downgraded its ratings on Swedish - Finnish maker Stora Enso Oyj HEL: STERV and on Finnish sector player - Kymmene Oyj HEL: to ` ` underperf",0
"The agreement, TietoEnator will provide with extended and business process management services and an IT infrastructure.",2
Circulation increased by 5% in Finland and 4% in Sweden in 2008.,2
"The share capital increase, EUR 1, 012, 945. 50 entered in the Register today.",1
