sentence,label
"Ragutis , which is controlled by the Finnish brewery , reported a 5.4-per-cent rise in beer sales to 10.44 million litres and held an 11.09-per-cent market share .",2
15 September 2010 - Finnish electrical components maker Salcomp Oyj ( HEL : SAL1V ) announced today the launch of its latest Twist charger platform .,1
"Kemira 's R&D organization comprises approximately 750 people , the company said .",1
Profit 23. 26 32. 86.,0
"Will an meeting analysts and media WTC Helsinki Marski, Aleksanterinkatu 17, the same day at 12: 30 - 1: 30 p. m. lunch will be.",1
"Operating profit the - period increased. 1 m and increased EUR61. 5, as compared to the period in 2007.",2
Inventor. ...,1
". 6 - - is the of and sales and a of up - to - date, - have cars.",0
"The Vaisala Group is a successful international technology company that develops , manufactures and markets electronic measurement systems and products .",2
Pohjola could increase its stake to 45 % in 2013 .,1
Total 30% of the order the fourth of 2009 and the remainder will be the quarter of 2010.,1
The event can also be viewed as a live audio webcast at www.ahlstrom.com .,1
Media ' sales 2009 totalled 307. 8 with an of 13. 5.,1
Deal 1. 2.,1
The present of shares.,1
"` ` Neste is working over 20 research in, , Africa, , and develop and new materials.",2
"Previously, Pulp has supplied and dilution technology for Stora ' mill in, Finland.",1
"At the same time profit of the company increased by 10 % in H1 and reached Ls 79,000 .",2
Value of the is 10mn.,1
"MIDNIGHTTRADER: is the source of - hours trading analysis, and forecasting for the and community.",1
"Henning of the trend, the become stronger and - making processes clear.",2
"Microsoft also churned up its courtship , agreeing to use the Navteq mapping service , which is offered by a company Nokia bought for $ 8.1 billion a few years ago .",2
Finnish metal industry solutions supplier Outotec Oyj net profit rose to 50.4 mln euro ( $ 72.5 mln ) for the first nine months of 2007 from 20.1 mln euro ( $ 28.9 mln ) for the same period of 2006 .,2
"Boomeranger Boats Oy specialises in boat building and designs , manufactures and sells customised Rigid Inflatable Boats RIB primarily for the Baltic Sea market .",1
"Period ' dropped to. 6. 3, to the interim report, today.",0
Joined 1997 to lead one of four business and up the of and in 2001.,1
"When the OMX forwards May 16, 2008, Finland Oy ' s direct shareholding in Sports Corporation - fifth 1 - 5 of the ' s shares and rights.",1
"The, the of the 9%.",1
The an annual savings of 1. 5 euros $ 2 the of 2010.,2
Government has an exchange of the state ' LMT to ' stake.,1
Was 43% 67% 2004.,1
"Combining the a EU - industry of global competition, added.",2
"Citigroup , Inc NYSE : C , Deutsche Bank NYSE : DB and Pohjola Bank are lead managers for the sale .",1
It estimates the operating profit to further improve from the third quarter .,2
"Marubeni has participated in GHG - Green House Gas - emission reduction projects overseas , obtained emissions credit from its projects and has provided these to Japanese clients .",1
Swedish Wallenberg family controlled Investor has bought a large stake of C shares in Swedish retail bank SEB .,1
Nokian Capacitors ' equipment will be used to raise the capacity and reliability of the Indian grid .,2
Nokia and Capcom announced that Resident Evil Degeneration will be released on N-Gage later this year .,1
Basic.,1
Finnish automation solutions developer Cencorp Corporation ( OMX Helsinki : CNC1V ) reported on Thursday ( 6 November ) an operating loss of EUR1 .3 m on net sales of EUR11 .9 m for the period January to September 2008 .,1
20 November 2009 - company Abp (HEL: GLA1V) said today a EUR74m revolving credit agreement with its banks.,2
Poyry a of Latin.,2
"Belarus OAO Lidskoe Pivo brewery , based in the Grodno Region , reported a 1.1 % decrease in output to 1.045 million decaliters in January-March 2010 , a representative in the administration of the company told .",0
"Country: ,: Construction - Real Target: - Talo Buyer: Oyj Vendor: Ruukki Group Oyj Deal size in: 102. 6: Divestment Status: Agreed",1
Fancy Dans on the move FAB Glasgow gift and interiors store Fancy Dans is moving !,1
"Kesko Agro Eesti , the retailer and wholesaler of grain , agricultural and warehousing machinery and accessories , had net sales of 81 million euros in 2007 , an increase by one-tenth over the preceding year .",2
"The subscriptions increase Cargotec 's share capital by EUR 27,060 .",2
"The company estimates that the trend in demand for sports equipment will be steady in 2006 , '' Amer 's report said .",2
FCC Chairman Kevin said that extending the rules the digital lines that telecom providers use broadband.,1
The aforementioned shareholders have informed that they will propose to the Annual General Meeting that the number of members of the Board of Directors shall be five and that besides the present members of the Board of Directors also Mr Lassi Noponen shall be elected to the Board of Directors .,1
"The acquisition does not be the frozen foods or fish sector, long it synergies + Tehtaat ' other businesses.",1
"It combines a perfect price performance with sophisticated management facilities , the company said .",2
"Ahlstrom, in Helsinki, , is a the, and marketing of performance - based.",1
Ore is sufficient at 46 years.,1
UPM-Kymmene is working closely with its shipping agents to reduce fuel consumption and greenhouse gas emissions .,2
Part of the reductions will be made through retirement arrangements .,1
"from 0. 30, 0. 17.",2
"` ` We have analyzed Sweden and found a which into Alandsbanken, ' ' said ' chief Wiklof in a.",2
"Poyry Energy GmbH is Austria 's leading engineering and consulting company in the energy , infrastructure and environment sector , owned by Poyry Plc. and the Austrian Verbund AG .",1
By will 30.,1
"Thanks to the multiplying effect of wagon performance , transport will be much more efficient , '' says development manager Juha Malkia from VR Cargo .",2
"High technology provider Group reports net of 41. 8 in the accounting period 2007 - February 2008, an of 11. 2% a earlier.",2
Devices Finnair ' own application for customer feed - and for.,1
Also the development of online businesses will continue .,1
"The decision reflects the underutilisation of the line , which produces nonwovens used in medical and wipes applications as well as for the automotive industry .",1
Following the the + totals 5. 5 mln $ 1. 98 - 1. 56 mln.,1
Growth is expected to continue in 2008 .,2
"According to L+ñnnen Tehtaat 's CEO Matti Karppinen , the company aims to deliver fish products to its customers a day earlier than it currently does .",1
Operating profit rose to EUR 13.5 mn from EUR 9.7 mn in the corresponding period in 2006 .,2
Finnish component supplier Componenta Corporation ( OMX Helsinki : CTH1V ) reported on Tuesday ( 15 July ) an operating profit of EUR46 .2 m on net sales of EUR386 .0 m for the financial period January-June 2008 .,1
Will be projects the UK and are also on the lookout local volunteers are interested out with the restoration projects.,1
Satama ' be the.,2
"Comparable profit the decreased EUR510m while increased from EUR860m, the 2007.",0
"The Liquid Handling segment offers laboratory equipment and accessories , including mechanical and electronic pipettes , and disposable tips used in the research institutions , universities , and hospitals , as well as in the pharmaceutical , food , and other industries under the Biohit brand .",1
This devices a few.,1
"The equipment will be made at Vaahto 's plant in Hollola in Finland , and delivery is scheduled for the first quarter of 2009 .",1
Merging the two free sheets will clarify the market situation .,1
Is the the financial.,2
"Seventy - of those also extensive on the latest, as the Wonderware System Platform.",1
"Aldata, retailers ensure their and selections customer demand and their. ' '",1
"Than 50, 000 of be the.",1
"Mill ' material 100, 000 of.",1
"The company 's net profit rose 11.4 % on the year to 82.2 million euros in 2005 on sales of 686.5 million euros , 13.8 % up on the year , the company said earlier .",2
Finnish cutlery and tools Fiskars Oyj Abp (: FISAS) said today net rose to EUR 24. 1 (USD 33. 6 m) in the third of 2010 from EUR 17. 9 a.,2
"- Secure reported that: - half of 2008 has seen a number of, , and organizations.",1
Chargers under brand retail stores and world -.,1
Expansion aims to and abroad.,2
Inspects the and.,1
"Projected revenue of $ 2. 2 billion $ 2. 3, of $ 2. 19.",2
"The company has established a 3G base station at about 17,000 feet at the foot of Mount Everest that will enable mountain climbers at the 29,035-foot summit to surf the Internet and even send videos of their exploits .",2
Nokian Tyres ' tyres are considered genuine winter tyres in Russia .,1
"` ` We can say the of become normalized by the moment, and therefore we have decided to devalue sale, ' '.",0
Order of a press by Vaahto 2001.,1
"In addition a reduction of nine persons will be made through pension or other arrangements , the company added .",1
"The major part of the deliveries include different AC and CXE amplifier solutions and products by Belgian DINH Telecom , a broadband solutions company acquired by Teleste in the spring of 2007 .",1
"EXEL is a company designs, manufactures and markets profiles and for industrial.",1
Is a and.,1
The arrangements do not apply to the group 's units outside Finland .,1
EuroChem CFO Ilyin said: ` ` marks important step EuroChem in securing the long - financing necessary our and projects ' '.,2
Ahlstrom 's share is quoted on the NASDAQ OMX Helsinki .,1
` ` of the operations is of ' s to its of building. ' ',2
"We now both the and the responsibility a new serve the readers of Alma Media ' s newspapers, ` `, head of the new Helsinki desk.",1
"As much biomass will be used as can be sourced locally , with the rest of the plant 's fuel needs met by peat .",1
Brazilian mobile player Telemig Celular yesterday announced that it has selected Finnish software developer Tecnomen Oyj to expand its prepaid billing system .,2
ABN : 59 087 901 620 now represent 5.10 % of the voting rights and share capital of Citycon Oyj .,1
"Highest would be in China, would continue, said.",1
The company confirmed its estimate for lower revenue for the whole 2009 than the year-ago EUR 93.9 million USD 137.3 m as given in the interim report on August 5 .,0
` ` and related the of Marimekko ' and brand.,1
"The go Edmonds, an of the clothing and retail industry, and Fischer, an Austrian with in the winter sports goods business.",1
Ruokatalo ' is the.,1
The additional.,1
The personnel reductions will primarily affect those working for the parent company in the diagnostics business or in production and logistics in the liquid handling business .,0
"Utility also services to management, hedging trades and and.",1
"However , the orders received during the period under review fell by 17 % quarter-on-quarter from the EUR 213 million recorded in the second quarter of 2010 .",0
Panostaja did not disclose the purchase price .,1
Nokia is the stop and the and pay and.,1
Facility consists of a year bullet term loan of 200 mln $ 292. 4 mln and a 150 mln $ 219. 3 facility.,1
The commission said the hydrogen peroxide and PBS market was worth about 470 million euros in 2000 .,1
"One can also apply the iPad, which CV to attach and covering is appropriate each.",1
"In the first nine months of 2010 , the company 's net loss narrowed to EUR415 ,000 from EUR7 .4 m for the corresponding period of 2009 .",2
"The Annual Report will be sent automatically to shareholders holding at least 2,000 Sampo plc shares .",1
"Protalix closed at $ 10.71 on Friday on the American Stock Exchange , giving a market cap of $ 827 million .",1
"In managed, takes, operating and as as optimising the 3G.",1
"Profit 3. 8 mn, down 4. 5 mn the 2005.",0
"Service is allow the of Mediterranean reach the rapidly, a single carrier.",2
"Thus the method will cut working costs , and will fasten the planning and building processes .",2
"Altona stated that the private company of Altona chairman Kevin Maloney , Tulla Resources , would take up its entitlement in full .",1
"Prothious Engineering ( www.prothious.com ) employs more than 1,000 and has a large portfolio of projects and an annual detailing capacity of more than 100,000 tonnes .",1
middle be with a control.,1
"However , its market share shrank to 47.59 per cent from 48 per cent a year earlier .",0
` ` The rest of week ' of have canceled he is his feet.,1
Loss 162. 3 a of 253. 5 in 2007.,0
It also recovers valuable raw material for Kemira 's water chemical production .,1
"Operating profit was EUR -0.1 mn , down from EUR 1.3 mn .",0
"Of Mayawas by Nokia Siemens and -, and be advertised Maxis in the end of 2007.",1
"Interfaces that are more similar to in the real can experiences are more natural and intuitive, the same way that and movies are more immersive the use of realistic 3 - graphics.",1
Decisions are to be made as quickly as possible .,1
"S&P has kept its `` sell '' rating , while Nordea and UBS have reaffirmed their `` buy '' recommendations .",1
"Nordea, according previously, forward contracts Media shares.",1
"Metso Foundries Jyvaskyla , Inc. will begin personnel negotiations on temporary lay-offs and personnel reductions in Jyvaskyla , Finland .",0
- The Group -¦ s result before taxes was a loss of EUR 0.6 ( +0.6 ) million .,1
", information, and.",1
Will certainly disagree ' the.,0
18 January 2010 - Finnish IT consultancy Trainers ' House Oyj HEL : TRH1V said last Friday it resolved to issue a EUR5m hybrid bond to domestic investors in a bid to strengthen its capital structure .,2
"Based upon its unique fiber expertise and innovative approach , the company has a strong market position in several business areas in which it operates .",2
"The company has the poser , who wants to impress people with the latest handset .",1
One of my colleagues summed up the E7 quite aptly when he remarked : `` Fantastic hardware .,2
"Seven - month of Ragutis, which is by the brewery, by 11. 2 percent, to 15. 41, and the company 9. 89 of the.",0
"News - 13, 2009 - Finnish industrial and measurement equipment Vaisala Oyj: yesterday will develop an reference radiosonde for climate observations.",1
The business area 's net sales were slightly over 2m in 2006 .,1
"OMX 25 0. 92 pct at 2, 518. 67 and the portfolio index was 0. 91 4, 711. 19.",2
` By will be able expand and.,2
"These 14, 747, 084 by the Company and the of outstanding shares and voting rights the amounts thus 161, 256, 847.",1
Net sales decreased to EUR 220.5 mn from EUR 470.0 mn in the corresponding period in 2009 .,0
"Has a strong of, which, ,, and Buster.",2
Has 130 in.,1
Return on equity stood at 18.3 % compared to 15.4 % in the third quarter of 2005 .,2
Forecasts a for 2007.,2
The layoff.,1
Combined creates interesting opportunities.,2
2008 3. 398 million in 48. 012.,1
"The selling consortium includes funds managed by OKO Bank 's venture capital unit , Bio Fund Management and Finnish Industry Investment , a government-owned investment group .",1
It half of its business operations and the Stock Exchange via the back through an buyout arrangement.,1
"Company will try the lay - of different duration, arrangements, training and development.",1
Finnair the strike cause it daily in of EUR 2mn due reservations and -.,0
The Company said EB delivered a solution LG and now is making it commercially available mobile vendors as well wireless operators.,1
Finnish financial group Aktia 's operating profit for 2009 increased to EUR 47.0 mn from EUR 6.6 mn in 2008 .,2
"The group intends to relocate warehouse and office space in Loudeac and Saint Marcel to Morvillars , in the east of the country , where it already operates a hook manufacturing and distribution unit .",1
"The company is headquartered in Sievi , Finland , and is listed on the Nordic Exchange in Helsinki .",1
Why not give your bedroom a cool makeover for summer .,1
"Finnish publisher Alma Media ( HEL : ALN1V ) said Wednesday it has decided to further extend its EUR1 .85 ( USD2 .75 ) apiece mandatory tender offer for media group Talentum ( HEL : TTM1V ) , which started on 19 August , until 16 November .",1
Jortikka is of the base of and is the executive committee of.,1
"Ixonos estimates that it will hire 20 specialists in mechanical engineering , electronics design , and R&D for its new unit in Jyvaeskylae by the end of 2009 .",2
"Cargotec 's brands , Hiab , Kalmar and MacGREGOR , are global market leaders in their fields and their solutions are used on land and at sea - wherever cargo is on the move .",1
Pharma ' 42. 5% 2004.,2
"Jarmo Honkamaa , head of the oil refining business at Neste Oil , says the situation looks promising from their viewpoint .",2
"In Sweden , operating profit for the period under review totaled EUR 3.4 mn , up 30.8 % from the corresponding period in 2005 .",2
"LCS ' s cover the of and information systems, from modelling and tailored software development, services, , maintenance and support.",1
Flow operating is be.,2
Short-term licenses for the games cost as little as $ 3 while purchasing a game outright can cost as much as $ 10 or $ 15 .,1
"Tip of the great to catch, for to.",1
"( ADPnews ) - Feb 3 , 2010 - Finland-based steel maker Rautaruukki Oyj ( HEL : RTRKS ) , or Ruukki , said today it slipped to a larger-than-expected pretax loss of EUR 46 million ( USD 64.5 m ) in the fourth quarter of 2009 from a",0
"Shares in Royal and Sun Alliance continued to slide back from a 12-month high of 172p last month , after a potential suitor ruled itself out of a takeover bid .",0
Rapala VMC Corporation ( Rapala ) is a Finland-based company engaged in the manufacture and distribution of fishing equipment and accessories .,1
"In addition to Russia , we now seek additional growth in Ukraine .",2
Value of the is 3. 3.,1
"The certain steel products from anti - dumping duties, - based Outokumpu today said will look to supply the Indian Railways soon.",1
"Last week , however , Nokia announced that it will pursue a long-term relationship with Microsoft , and make the Windows Phone 7 operating system the foundation for Nokia mobile phones .",1
"As the largest market the world, output of continued to to 262, 000 units 2009, 5% - - yr.",2
"Addition, Oy start producing a magazine, (Money) the Association.",2
"In addition , nine fixed-term employment contracts will not be extended and two people will leave the company under pension arrangements .",1
"GUANGDONG , October 26 , SinoCast -- Nokia Telecommunications Dongguan branch entered into a letter of intent to open a Nokia Class in Qingyuan Polytechnic , Qingyuan City of Guangdong Province .",1
KESKO FOOD LTD PRESS RELEASE 04.01.2006 AT 13.00 Kesko Food Ltd is launching a major TV campaign to recruit as many as one hundred new K-food retailers .,2
Finnish paper maker UPM - Kymmene Corp. on Monday the sale of its wrapping unit to the CapMan investment group a its business.,1
"Operating and turnover the three - increased, respectively EUR0. 9 and EUR8. 3 m, compared to the period 2005.",2
"Finland, the is Alma Media ' Etuovi. com, Finland ' s most and best known for and property sales.",1
"` ` ' a figure the scale, ' ' Noop, that this also includes beer by Finnish tourists.",1
"Finnish heat-retaining fireplaces maker Tulikivi Oyj said on August 29 , 2007 that its local tiled stoves and utility ceramics subsidiary Kermansavi Oy will merge into Tulikivi by means of absorption in order to streamline the latest 's corporate structure .",1
Finnish mobile operator DNA will function as a subcontractor to Maingate and will be responsible for telecommunications connections .,2
"Back then , Tikkurila 's former owner , Finnish chemicals company Kemira Oyj HEL : KRA1V , distributed an 86 % stake to Kemira shareholders to facilitate the divestment and listing of Tikkurila .",1
Phones time users in.,1
The number of customers is one of the most important parameters in determining the price of electricity networks .,1
"The figure includes the change in the fair value of the property portfolio , EUR 26.2 million .",1
The value of the deal was not disclosed .,1
Image data produced by the browser at the phone server is converted into a bitmapped image that is sent to the handset for display . '',1
Net sales grew in the period to  x20ac 402 million $ 585US million from  x20ac 401 million in 2006 .,2
Raute is listed on the Nordic exchange in Helsinki .,1
"26 October 2010 - Finnish environmental management company Lassila & Tikanoja Oyj ( HEL : LAT1V ) , or L&T , said today its net profit declined to EUR20 .9 m for the first nine months of 2010 from EUR27 .6 m for the same period a year earlier .",0
"Profit totaled 6. 7, 7. 2 the period in 2005.",0
"Net cash flow from operating activities was a negative EUR 3.1 mn , compared to EUR 23.3 mn in the corresponding period in 2009 .",0
"Profit the 12 - month period decreased from. 9 m increased from. 3, as to 2007.",0
"narrows to. 8 m 9 - mo ' 09 29 October 2009 - Finnish software and developer Oyj HEL: EBG1V, or EB, said today that its loss narrowed EUR2. 8 m for the first nine of 2009 from EUR35. 6 for the period a.",2
"May 29 , 2010 ( CompaniesandMarkets.com delivered by Newstex ) -- This report provides key data and information on the meat , fish and poultry market in Finland .",1
Appointments be until the appointed.,1
"From Nordea, Ergo is competing the position the top three.",1
Profit the quarter EUR33m from a.,0
"Sales rose by 25. 5% - - year to EUR59. 6, the number of went up by 41% 65. 9 million.",2
"Finnish security and privacy software solutions developer Stonesoft Oyj said on January 7 , 2008 that the preliminary sales of its StoneGate products grew by 59 pct year-on-year to 3.6 mln euro ( $ 5.3 mln ) for the fourth quarter of 2007 .",2
"Media ' s operating to 11. 9, from 15. 0 a year.",0
"LLC, a and data management solution provider companies with operations, will be transferring its. . operations to the Finnish mobile, includes civil and site acquisition services.",1
Services be.,1
Hearst will be 20% of Russian advertising after the.,2
`` Consumers have very well received our packed fresh meat .,2
Tiimari operates 194 stores in six countries -- including its core Finnish market -- and generated a turnover of 76.5 mln eur in 2005 .,1
A high court in Finland has fined seven local asphalt companies more than   lion ( $ 117 million ) for operating a cartel .,0
"The 19,200-square metre technology center is located near University of Tampere in central Tampere .",1
"In 1994, the company a - step, - focused, project financial institutions ' revenue.",1
The purchase price was not disclosed .,1
"Said some of the ` ` really a of, and people should. ' '",1
Meeting of the bid be held 12.,1
It is the most thing ' the hand.,0
"Higher bit rates for outgoing traffic improves the end-user experience of mobile broadband services such as video conferencing , file sharing and sending e-mails with attachments .",2
` ` activities and be good for and.,2
Profit 37% 193. 1 305. 6.,0
"Result showed a of 2. 9 mn, while a year, a of 0. 6.",0
However an and strong.,1
"Total of 15, 000 a nominal value of EUR 1. 35 per share were subscribed between 17 and 23 2006 exercising the A - B - based on the company ' s stock plan 1999.",1
"According to ' President Harri, Scanfil ' investment activity the on in 2010.",1
"We succeeded in increasing our market share of sold apartment '' , comments Mr Kari Kauniskangas , Head of YIT International Construction Services .",2
"Expands: plans add flights Kong, and Russia.",2
"` ` conditions in market have affected our quarter result, ' ' Chief.",0
Lay - start and from weeks.,1
"Contract the, - and of the.",1
Year the is the.,1
Stichting Pensioenfonds ABP : 4 118 122 shares representing 5.19 % of the share capital and voting rights .,1
Of.,2
Is Mantyharju.,1
"' two - 1, 740 MW Olkiluoto 14. 2 TWh an ratio across both reactors of 93. 5% , which the company as ` ` international standards ' '.",1
"One of the opportunities would be to bring all Baltic meat processing to Rakvere , like processing was concentrated at the Vantaa meat-packing unit in Finland , the paper wrote .",1
Posted an of 2. 7 ($ 3. 5 mln) and net of 89. 1 ($ 116. 8 mln) 2006.,1
"This ' s global presence a of 18 countries, serving 250 in 80 countries.",2
"Finnish Scanfil , a contract manufacturer and systems supplier for communication and industrial electronics reports net sales of EUR 108.7 mn in the first half of 2008 , down from EUR 111.1 mn a year earlier .",0
The value of the orders is over EUR 25mn .,1
"HK Ruokatalo now accounts for about 50 % of poultry sales in Finland , and profitability is at a good level .",2
"Will be flights Stuttgart every, well departures on, Fridays and.",1
"One of the be a - elevator, more efficient use of the ' core.",2
Company 2008 5 - 10% 2007.,2
Aspo the of '.,1
"Improvements demand and the, theutilization rates of ' substantiallyimproved. ' '",2
"( ADP) - Nov 28, 2008 - Finnish - supply solutions provider Efore (: EFO1V) today the launch of OPUS DC, the power system its.",2
The world 's biggest magazine paper maker said the program to improve efficiency will include closing several of its least competitive mills and would cover all the company 's operations resulting in annual savings of some euro200 million US$ 240 million .,2
"On 5. 0% , a 4. 1% 2009.",2
This organization will assume the responsibility for operations in Russia .,1
Biohit many Genesis customers and the is expand a result of.,2
As an overall effect of the above-mentioned measures Glaston will recognize non-recurring expenses of EUR 12 million in the fourth quarter of 2008 .,1
Margin call of Zanadvorov has given the chance to make such purchase under the credit of Deutsche Bank for USD 560 million .,1
