sentence,label
"Neste Oil extended yesterday ' s gains and on 0. 49 pct to 22. 72 eur, while Fortum 1. 14 to 20. 76 eur.",1
"Shipping company Finnlines, of the Group, reports its net sales decreased to EUR 241. 8 mn in - June 2009 from EUR 384. 0 mn in the corresponding period in 2008.",0
"Outotec said won orders worth 492. 9 mln eur during the quarter, compared with 240. 4 mln eur a earlier.",2
"The Group and operates a fleet of more than 800dwt, container is 17, 000 TEUs, and manages a diversified fleet of its railway rolling stock of over 17, 000 units.",1
Reductions will be concluded by autumn 2010.,1
Per share (EPS) dropped to EUR 0. 21 from 0. 31.,0
"The chilled products category led the meat, fish and poultry in Finland, for a share of 31. 4%.",1
"Marimekko all sorts of colorful impulse buys ` ` umbrellas, baby bibs, change purses ` ` and they ' re all sale, the better to take of shoppers who ca ' t commit to but want a piece of the action.",1
"Kemira ' s & organization comprises approximately 750 people, the company said.",1
The EPS outlook was increased by 5. 6 pct for 2007 and 7. 0 2008.,2
The company said that in Poland a profitability program has been launched at the frame and sandwich panel plant.,2
LONDON MarketWatch - - Share in London Monday as a rebound in bank stocks failed to offset broader weakness for the FTSE 100.,0
The medium - term operative of the company unchanged.,1
"However, net sales in 2010 are to have grown to EUR598. 3 EUR582. 3 m in 2009.",2
Kaupthing Bank will publish its results 2007 before markets open on Thursday 31 January.,1
"The scope of the project is to find the cost - method phosphorous removal and to deliver the storing and dosing equipment, which be used in continuous operation at the plants.",1
Following the increase the company + óEUR TM capital totals 5. 5 Romanian lei $ 1. 98 - 1. 56 mln euro.,1
s already position in the technical building services in Ostrobothnia.,1
"Shareholder ' name and ID code: - Petri Ailus, 15. 9. 1966 further information, please contact Isto Hantila, CEO, tel. + 358 9 591 8342.",1
These six are the company ' first customer acquisitions in India since taking over TVS Electronics ' contract manufacturing facility in 2007.,1
The are scheduled for the summer and of 2008.,1
Halonen ' s office the letter but declined comment.,1
Original contract was signed last summer.,1
Neste Shipping is the likely to remain Finnish as the sector and its transports are significant for emergency.,1
"Fiskars report net sales of EUR 145. 8 mn, up EUR 138. 4 mn.",2
"The segment has an annual revenue of approximately, the said.",1
"To the Act, universities can now private funding.",1
Ruukki forecast a 15 - 20% sales growth and a positive pretax result 2010.,2
Russia ' s Video International Group holds a controlling stake in Ventures.,1
Their names not yet been released.,1
The shale feeder - supply solution will deliver crushed oil shale to the oil already in operation as well as to the Enefit - 280 shale oil technology processing plant.,1
Industry Investment is very interested in Glaston ' solar projects.,2
"Typically, the transmission power level can be when the noise is above a predefined value.",1
"On top of that, the US Commerce Department published worse - than - expected construction for.",0
Finnish Stockmann Group ' mail order unit Hall has launched a trial marketing campaign in Russia.,1
"1 p. . office of Bank 19 3 - ulitsa Yamskogo, Building 1 Telephone: 495 777 - 34 - 77 ext. 3932, 3931 03. 02. 2011 Unimilk - EGM 03 - 04. 02. 2011 international business - summit Food Business Russia 2011 will take.",1
"MILAN (AFX) - The Italian group Grimaldi has increased its in the Finnish company Finnlines to 35. 4 pct from the 30. 5 pct in June, according to agency ANSA.",1
The company its outlook for 2009.,1
"The acquisition was financed $ 2. 56 of arranged by Goldman, Sachs & Co..",1
Kershaw takes up the position effect from previous role as marketing manager of Sankey Home & Garden Products.,1
"` ` Indo - Russia trade can cross the targeted 10 billion by 2010 and double to 20 billion dollars by 2015, trade irritants and hassles are resolved, ' ' the chamber in its on obstacles to trade with Russia.",2
"The group posted of 35. 3 mln euro $ 46. 5 mln and an operating of 760, 000 euro $ 1. 0 in 2005.",1
A result some 20 persons will longer be needed.,0
Kaupthing forecasts a significant price printing paper in 2007.,2
"The rally, which authorized the city administration, a consulate official came out to the workers, spoke to them and took a from them.",1
"Prove the efficiency of the China Mobile system, Rod Baber, an English climber, to the Mount Everest summit and successfully calls.",2
The company ' s strength is its brand.,2
"Global Markets Direct ' s Bank plc - Financial Analysis Review is an in - depth, analysis of Pohjola Bank plc..",1
Accounts about one tenth of the company ' s annual turnover of one billion kroons.,1
"The power, DC and inverters designed and manufactured by Efore, and systems incorporating them are used in many different applications.",1
"In Middle East & Africa, Tecnotree has grown in the recent years.",2
Event can also be viewed a live webcast at www. cargotec. com.,1
"Payment for acquired shares will be made in cash, and the price per will be 1 an administration fee.",1
"Inventors Bylander Johan, Ponten Fredrik and Lundberg Jorgen.",1
"Sampo Bank, of Danish Danske Bank group, reports before taxes of EUR 152. 3 mn in 2010, up from 32. 7 mn in 2009.",2
"As part of the reorganisation measures will take in spring 2006, Tamglass Finton will start personnel that will affect its entire staff of 33.",0
"The order consists of capacity expansion, maintenance services and new charging, the company.",1
"Rimvesta is now controlled by the Estonian - owned real estate development ELL Turtas, which a member of Merko, the largest in the Baltic countries.",1
"' s contract engineering management, civil and detail engineering services, and time scheduling and services.",1
"Founded in 1994, the company uses a six -, time -, collaborative project approach to improve financial ' revenue streams.",1
"We also existing partnership with Cybercom ' ', says Teleste CTO Esko Myllyla.",2
"( ADP) - 28, 2008 - Finnish power - supply provider Efore Oyj (OMX: EFO1V) announced the launch of OPUS, the latest power system in its OPUS product line.",2
"The agreement, Ramirent will expand the range of equipment and it delivers to Destia, Ramirent Finland ' s managing director Aulasmaa, said.",2
"IT services firm TietoEnator the general trend, holding flat at 22. 70 eur, after slipping back earlier gains.",0
At the same I delighted by the that we were able to accomplish the organization with our own team members.,2
"The equipment will expand container capacity at Namibia ' s main port of, on the west coast.",2
"The Americas 25% of Gemalto ' s, and Latin America is one of the fastest regions for the company.",1
"Finnish publisher Alma Media (HEL: ALN1V) Wednesday it has to further extend its EUR1. 85 (USD2. 75) apiece mandatory tender offer for media group Talentum (HEL: ), started on 19 August, 16 November.",1
"In the quarter of 2009, sales through operator business partners represented 47% of the Group ' s total sales.",1
"This from. M. Best is the highest among the countries, Central and Eastern Europe.",1
Production is to by the end of April 2007.,1
These measures are to annual cost savings of EUR 1. 5 million starting in 2007.,2
"Upon establishment, the is directed to 20 persons.",1
Scanfil issued a profit warning on 10 2006.,0
"Lithuanian beer makers sold 256. 88 million liters of beer in 2005, a of 4. 5 per cent from the year - of 245. 92 million.",2
"Panostaja owns a 68. 77 pct of share capital and the rights of Suomen following an exchange of which was carried out on May 30, 2007.",1
Finlan ' food industry company HKScan Group companies in the Baltics revenues by EUR 3. 5 mn to EUR 160. 4 mn in 2010 from EUR 156. 9 in the year before.,2
"Finnish company sold its operation - consisting of 50 staff in offices in London, Birmingham and Manchester - as part of a deal with Hampden in July 2001 European - wide property and arm Sampo Industrial.",1
"The company has supplied than 200 MW of power generating equipment a of projects in Papua New Guinea, including 12 engines of the Wartsila 32 type to Lihir Gold.",1
Organization will assume the responsibility for operations in Russia.,1
"The Brazilian unit of Finnish security solutions provider F - Secure up 1, 500 new clients year, online news source Reseller Web quoted the ' s director, Vladimir Brand +, as saying.",2
"Ahlstrom Corporation Seppo Parvi, CFO Distribution: Main www. . com Ahlstrom in brief Ahlstrom is a global leader in the development, manufacture and marketing of high nonwovens and papers.",1
Total value of the deal is USD 29mn.,1
Fair of the company ' investment properties went down to EUR2. 769 bn at the end of 2009 from EUR2. 878 bn a year earlier.,0
The following information was by Comptel: Tomorrow the Chairman of the Federal Commission is scheduled to deliver the National Broadband to Congress.,1
"Was founded in 2000, and its have risen on an average by 40% with margins in 30s.",2
Finnish forest manufacturer Ponsse has agreed with Volvo on the start of cooperation in America.,2
"Group intends to warehouse and space in Loudeac and Marcel to Morvillars, in the east of the country, where it already operates a hook manufacturing and distribution unit.",1
"Galeria Podlaska, a shopping on Wysockiego in Bia ` ystok, is approximately 60 - percent or reserved.",1
3 January 2011 - carrier Finnair Oyj (HEL: FIA1S) said it sealed a nine - year sale and leaseback agreement for its newest Airbus A330 aircraft for syndication into the operating market.,2
"- 3, 2009 - Finnish media group Ilkka - Yhtyma Oyj HEL: ILK2S today net profit fell 45% on the year to EUR 5. 9 million USD 8. 4 m in the half of 2009.",0
Deal means that ten persons in countries will transfer to Tieto.,1
"The year September 30, 2009 the revenue from these customers was $ 10. 012 million around 11. 0% of the transportation group ' s revenue.",1
Border has banned the mooring of the company car - shipping ferry on its test travel at the railroad - car of the Russian as the border checkpoint is not yet ready.,0
TELECOMWORLDWIRE - 7 April 2006 - TJ Group sells stake in Morning Digital Design Oy Finnish IT company TJ Group said on Friday 7 April that had signed an agreement on selling its shares of Digital Design Oy to Edita.,1
Soapstone deposits in the Medvezhyegorsk area are expected to increase Tulikivi ' s reserves considerably.,2
"Ahlstrom, headquartered in Helsinki, , is a global leader in the development, and of high performance fibre - based materials.",1
The operating profit for Grain increased to EUR 2. 0 mn 1. 4 mn in 2005.,2
StoneGate solution offers protection against inbound and outbound attacks.,2
After the renovation the biggest line in the Orhangazi foundry is the most modern line in.,2
Filmiteollisuus Fine Ab will be to Talentum Oyj in the of a subsidiary.,1
"Aug. 31, 2009 (Gawker Media delivered by Newstex) - - If you love fishing video games felt that there just was n ' t enough wackiness involved, Activision ' s (: ATVI) Rapala: We Fish might just catch eye its family - hook.",1
"The company is in the process of building a new fleet and has placed orders 10 P - of 65, 200 dwt.",2
The shares carry a right to and other as from their registration with the Finnish Trade Register.,1
"The guidance has been set at 90 basis over mid - swaps, the said.",1
Business after helped plant a small story Rapala lures in a Life magazine issue that featured Marilyn Monroe on the cover.,2
LSC ' s 30 employees will move to with their existing and benefits.,1
"Juhani + ñrvi, Corporate President of Kesko, says the Russian food retail sector is fragmented.",1
Of shares shall be effected on subscription.,1
"Will launch a campaign in September to promote the brand on the Moscow market, he said.",2
"In 2007, Marimekko has opened stores in Yokohama and Nagoya, central Japan, in Silver Spring in metropolitan DC, USA, in Graz, central, and in Aalborg, northern Denmark.",2
Finnish Cargotec has been awarded a significant for a total of 292 Hiab loader by BAE Systems in the.,2
The price of GMO soy is 5% - 7% lower than of - GMO.,1
Jacobs has been Storengy ' investment of developing storage sites since 2006 as owner ' s engineer.,1
"Lemminkainen Infra Oy ' subsidiary Lemminkainen Sverige will perform the construction work, is expected to start in 2011 and to be completed in the summer of 2013.",1
"Stocks were among the biggest fallers, with Stora Enso down 2. 30 to 14. 01 eur, M - real 2. 86 pct to 5. 09 eur and - Kymmene 1. 14 lower at 19. 10 eur.",0
"The unit ' s clients mainly in the field of specialist, as well as in the textile, shoe and furniture businesses.",1
"Meanwhile, Electrowatt - Ekono Philippines, Inc. also awarded a three - year operation and maintenance (O &) contract FR Cement Corporation.",2
"Oriola - KD, headquartered in Espoo, , is a leading of pharmaceutical and healthcare with 1, 300 employees in the and Baltic countries.",1
Profit to EUR 14. 0 from EUR 4. 9 mn in the corresponding period in 2005.,2
"The opportunity will be available for few employees,.",1
Ramirent made 18 million EUR 1. 15 mln loss last; the year before the company was 7. 3 million kroons in the.,0
"One of the opportunities would be to all Baltic meat processing to Rakvere, like processing concentrated at the Vantaa meat - packing unit in, the paper.",1
Mr serves as the manager responsible for ABB Oy ' s system modules for low voltage drives.,1
"Profit totalled EUR 21. 1 mn, up EUR 18. 6 mn in 2007, representing 9. 7% of sales.",2
` ` pleased to welcome Tapeks Noma into Cramo group.,2
"The Innova 2 building will be close to downtown, in the vicinity of Paviljonki and the travel, and within walking from the heart of the city thanks to the trade fair bridge.",1
Last SysOpen Digia invested in IBM product know - how in the of portal and trading place systems and implemented customer solutions supported by it.,2
Analysts surveyed by expected revenue of $ 69 million for the quarter.,1
"Fiskars is in the global supply of marine and energy equipment and services through its associated company, Wartsila Corporation.",1
The announced restructuring will significantly the Company ' s.,2
"Profit taxes amounted to EUR 56. 5 mn, from 232. 9 mn a year ago.",0
Company expects sales to significantly increase from 2009.,2
"As reported 26, ` ` both circuits to alternately report the track as and then occupied almost constantly from June 17, when part of the track device was, to the time of the, according to the Metro source. ' '",1
The are located in the capital region and the Paijat - Hame.,1
"The will be given by Hannu Kyrolainen, Finland ' s Ambassador to the Czech Republic.",1
Offers advanced machinery maintenance and process development services to the pulp and paper in Northern China.,1
"Said it will reduce the number of personnel by 10, and lay off 10 of its own personnel.",0
"In Finland, 71% of paper and is.",1
"Previously, the company its profit to improve over the same period.",2
Finnish plumbing and heating systems supplier is temporarily laying off whole workforce in Finland for two weeks of mid - July 2009.,0
"2007, Alma Media ' s operating profit was EUR 53mn.",1
` ` The new unit is a investment in the media scene.,1
Total two offers were received Contracting Authority for participating in this contract; the contract was allotted to Finland Oy.,1
"Raw materials prices have surged in the past year, fueled in part because of the industrialization of China, India and other.",0
"Finland ' s national carrier Finnair carried a record 8. 5 passengers in 2005, an of 4. 5 percent on the previous, the airline reported Tuesday.",2
"After the, Tikkurila has no powder related operations.",1
Medical - Russia This - new market analysis gives a clear overview of the actual situation and future outlook of the device market in Russia.,1
"Unbelievably, the company that makes them - Fiskars Corporation - was formed in 1649 when a merchant named Thorwoste was given a charter to a blast furnace and forging operation in the village of Fiskars.",1
Finnish Cargotec ' Kalmar has received a significant order from the US of Defense.,2
"In the reporting period, rose by 8% - on - year to EUR64. 3 m, due to the acquisitions during the first half of 2008 - 09, the effect of which was EUR10. 9 in the review period.",2
Operating profit to EUR 16mn EUR 21. 1 mn in 2008.,0
Nokian Capacitors ' equipment will be to raise the capacity and of the Indian grid.,2
Finnair said that the cancellation of flights would daily losses of x20ac 2. 5 million $ 3.,0
"According to, OP - Pohjola is an exciting enterprise because the cooperation will bring huge opportunities customers and the itself.",2
"Sales improved to 1, 553, compared with SEK 1, 408 mn.",2
The company has some 410 employees and an turnover of EUR65. 4 m. Group is on the Nordic Exchange in Helsinki.,1
"Konecranes has previously communicated an estimated reduction of about 1, 600 employees on in 2009.",0
Intent of the article was to attention on the fact that the model that China had followed was different than the model that India had followed.,1
Value of the deal was not disclosed.,1
The first will be by the end of 2012.,1
The MET is in the Central Business District (CBD) of.,1
Silicon wafer technology company Okmetic OMX: OKM1V said on Wednesday 17 September that it will invest EUR6m in its sensor wafer business during 2009.,1
The companies signed the of intent for the on 17 September 2010 and envisaged to the actual agreement on 1 January 2011.,1
Delivery is expected to take place later this.,1
Net in the same period in 2009 euro18. 6 million.,1
The agreement includes maintenance and support services.,1
Elcoteq group recently announced that the last three months of the previous year to it a major loss of more than half a billion kroons (EUR 32 mln) for the fifth running.,0
The fair value of the ' s investment properties went to EUR 2. 768 billion at the end of 2009 from 2. 916 a year earlier.,0
The stake represented about 2. 7 m shares in Okmetic ' s.,1
"Of release dated March 26, 2008 should read: Acacia Subsidiary Enters into Settlement Agreement for Rule Based Monitoring Technology with F - Secure (Acacia Licenses Rule Based Monitoring to - Secure ).",1
"Gross area of houses will be 12, 167 m2.",1
"Pretax profit to EUR 1, 019 EUR 1, 007 in the corresponding period in 2005.",2
The share period will on 30 September 2007.,1
African Sappi will become the largest foreign forest industry company operating in a result of the Finnish M - real Corporation ' s Graphic Papers Business unit.,2
The resignation will be in immediately.,1
Nokia will certainly disagree Qualcomm ' s views on the patent.,0
J + ñrvi - Suomen is also planning to reduce the use of nitrite.,1
"Sales inclusive expanded by 19 percent, to 351 million.",2
The of investments in the two phases of the is estimated at USD 300mn (EUR 215. 03 ).,1
"The period - end cash and cash equivalents totaled EUR6. 5, compared to. 5 m in the previous.",0
Is headquartered in Mantyharju in Finland.,1
Aspocomp intends to set up a to printed circuit boards with an investment of Rs310 crore.,1
Finnish fibers and plastics producer Suominen Corporation OMX Helsinki: SUY1V reported on Wednesday 22 an operating loss of EUR0. 8 m on net sales of EUR55. 2 for the of 2008.,1
Delhaize Le has the Aldata G. O. L. D. Vocal PDA on the Motorola WT4090 PDA terminal.,1
' s aim is to Botnia ' s strategic development and investments.,1
6 October 2010 - Finnish paints and coatings Tikkurila Oyj HEL: TIK1V announced today the of Tikkurila ProHouse for protection of wooden surfaces via treatment with Pro waterborne products.,1
The is also featured in the Ethibel Investment Register and in Innovest ' s Global 100 list of the world ' s most sustainable corporations.,2
"Made an operating profit of EUR 151. 0 mn, up from EUR 143. 7 mn, which 2007 a record year.",2
Newspapers of Alma Media and Arena will enter a cooperation agreement on using Alma ' s services in their respective regions.,1
"Finnish high technology provider Group reports sales of EUR 41. 8 mn in the accounting period September 2007 - February 2008, an increase of 11. 2% from a.",2
"from BUSINESS LINE, May 16, 2008, May 15 - Nokia ' s two key suppliers - and - are likely to start operations within three months in the Nokia Telecom Park at, 45 km off Chennai.",1
Investments in product stood at 6. 0 mln euro ($ 8. 8 ).,1
"Our solutions are fully Arabized, and our message is that we want to become the of choice for in the Near - East region.",1
The employment contracts of 14 of the employees will end in March 2009 a result of the company ' s - employee talks.,0
The company said estimates to make a slight profit thanks to - cutting measures.,2
Componenta ' objective with this agreement is to increase business on existing production lines.,2
The is scheduled to start in the second quarter of 2009 and the new building is scheduled to be in place by the of 2010.,1
The factory working model and reorganisations would decrease Nokian Tyres ' costs in the factory by EUR 30 (USD 38. 7 ).,2
The sale price not disclosed.,1
For the new shares with stock all shareholder rights commence from the date on which they are entered into the Register.,1
"Both operating and net sales for the 12 - month period increased, respectively from. 7 and. 7 m, as compared to 2004.",2
". Jorma Valkama, Director of Suomen Paikallissanomat, states that Rannikkoseutu complements in an outstanding way the current product range of the company.",1
"- three of those have more extensive training in built on the latest ArchestrA technologies, such as the Wonderware System Platform.",1
"The services also give the supplier opportunity to key - in invoices, receive orders electronically, to send order and to and create catalogues.",2
Revenues at the same grew 14 to 43 million euros.,2
"F - Secure, a of security solutions as a service Internet Service Providers and mobile operators, announced results from its annual Online Wellbeing.",1
"Change in holdings in Chapter 2, Section 9 of the Finnish Securities Markets Act is described below.",1
` ` profit declined mainly due to the increased cost of and recycled and the strengthened euro. ' ',0
"Bit rates for outgoing traffic improves the end - user experience of mobile broadband services such as video, and sending e - mails with attachments.",2
Company is well positioned in Brazil and Uruguay.,2
"' s leading shares today almost 100 points, 1. 7% , as the market opened.",2
"Marubeni participated in - Green House Gas - emission reduction projects overseas, obtained emissions credit from projects and has provided these to Japanese clients.",1
Waste management and cleaning group & Tikanoja Oyj (L & T) net profit went to 32. 2 mln euro ($ 47. 7) for 2007 from 35. 3 euro ($ 52. 3 mln) for 2006.,0
"As, the space has blond wood (unlike the rest of the store) and a Scandinavian vibe.",1
Bertrand Sciard has been the chairman of the board of directors of Aldata Solution since 2007.,1
"Seller is the Elcoteq Group, the largest European electronics services company.",1
HELSINKI AFX - Outokumpu it has signed a 3. 5 mln eur agreement with Mongolia ' s Erdenet Corporation for the engineering of the first HydroCopper to be built at the Erdenet mine site.,2
"EBIT excluding non - recurring, totalled EUR 67. 8 mn, up from 38. 1.",2
Can capitalize on our experience from a number of similar bridge in the Nordic countries.,2
Sales at the unit last year the industry was hit poor snowfall in the major resorts in the winter of 2006 - 07.,0
ABB Deutsche Bank upgraded recommendation on Swiss - Swedish group ABB Ltd. to ` ' from ` Hold '.,2
The solution will be installed in the USA to the North American of the customer.,1
Pharmaceuticals - Belgium This brand - analysis gives a clear overview of the actual situation and future outlook of the pharmaceutical market in.,1
Cymed ' s net are expected to amount to EUR 3. 5 in 2006.,1
Finnish sports equipment maker Sports Oyj (HEL: AMEAS) said that its net loss to EUR 16. 9 million (USD 22. 3) in the second quarter of 2010 from 23. 2 in the corresponding period a year earlier.,2
"Tiimari Latvian representative Ineta Zaharova said the company earned LVL 122, 000 in 2005, which is 20 more that in 2004.",2
"` ` Installation of the automatic varnishing is an important of the company ' s in the region of central and eastern Europe, ' ' said Jozef Misurec, the director of Ruukki.",2
"In Europe, the industry ' situation is paradoxical.",1
"To him, work will start in spring 2007, and the facility is to be commissioned in 2008.",1
Finnish OKO bank signed a agreement with Raiffeisen concerning Finnish companies ' investments in Russia.,2
"Through the Exchange, OMX offers to approximately 80 percent of the Nordic and Baltic securities market.",1
", the company expected its 2008 financial performance to remain at the level as in 2008.",1
"The Process Products for the installation of separation - filtration at three natural gas pipeline projects in China, South America, and Saudi Arabia.",1
"Following the transaction, Tulikivi restructured its into the Soapstone Fireplaces Business, Natural Stone Product and Ceramic Products units.",1
The ongoing project where Structures is being used is the Vashi Centre being developed by Insteel Pvt Ltd - IIVRCL Infrastructures & Projects Ltd & CIDCO.,1
Upon of the sale Proha would some USD12. 7 m for its stake in Artemis.,1
"HUHTAMAKI OYJ, 16. 9. 2008 AT 13. 32 Huhtamaki ' Markets Day for institutional investors and analysts is held in Espoo, September 16, 2008 starting at 13. 30 pm Finnish time.",1
