sentence,label
Brazilian mobile player Telemig Celular yesterday announced that it has selected Finnish software Tecnomen to expand prepaid billing system.,2
"Tekla Structures BIM Information Modeling software is being according to a long - term plan of improved experience, process, and functionality.",2
"The item included restructuring costs of EUR1. 6, a year earlier they. 1 m. Diluted EPS stood at EUR0. 3 versus a loss per share of EUR 0. 1.",2
"In July - 2008, YIT ' s net sales to EUR 970. 8 mn, to EUR 906. 8 in the corresponding period in 2007.",2
Sales of clothing best.,2
"Operating EUR 37, 7 mn, up from EUR 37. 2 mn in the corresponding period in 2006.",2
"Finland - based Elcoteq SE, a privately held provider of electronics manufacturing services to communications, said Thursday it a long - term supply deal with communications equipment company Corp..",2
"The - Allure of the Seas and its sister ship, Oasis of the Seas, which was last year are the world ' s largest cruise ships.",1
Margin call of Zanadvorov given the chance to such purchase under the credit of Deutsche Bank USD 560 million.,1
"The total of the project is about EUR53m, the plots that will be transferred to Atria.",1
"Moreover, Konecranes and Kito intend to transfer the hoist distribution business of ' Japanese joint venture to Kito.",1
"The are for 26 - room - less KONE elevators, which would be installed during 2006.",1
Merrill Lynch analyst Campbell Morgan upgraded on PaperlinX from ` ` ' ' to ` ` buy ' ' in May.,2
"When open next year, will be the largest facility in the world to diesel fuel from renewable feedstock such as oil and animal fat.",2
"Chain posted of 298 million euros for full 2005, a rise of 19. 5 percent, year - on - year.",2
The company did disclose the price of the.,1
30 November 2009 - Finnish maker Martela Oyj HEL: today that it will make redundant three people and other nine will be laid off permanently from the company ' s office staff and workers.,0
"EBIT for the half was EUR13. 6 m US $ 17. 8 m, falling of the. 5 m it posted for the same period of 2009.",0
"The gross area of the Innova 2 project will be 10, 000 sq (107, 600 ft ).",1
"Finnish Talentum reports operating profit increased to 20. 5 in 2005 from EUR 9. 3 mn in 2004, and net totaled EUR 103. 3 mn, up EUR 96. 4 mn.",2
Technopolis said before the protocol was that the techno - park be at a site covering more than hectares in the Neudorf special economic zone and that it planned to invest 200 euros in the project until 2009 inclusive.,1
"In 2006, Kone received an order from Aker to 43 customised elevators for the very first cruise which is scheduled to be completed in 2009.",2
"On the other hand, Montevideo said having the two working in the area will generate jobs.",2
"In 2007 Talentum will disclose three - Q1 (- March) on Friday, 27 April, 2007 - Q2 (-) on, 20 July, 2007 - Q3 (July - September) on Friday, 26 October, 2007.",1
"Before Kemira ' s installation was producing 3, 500 tons of and solid waste per year.",1
"- Utenos, which is controlled by the Nordic group Baltic Beverages Holding (BBH ), a 6. 1 percent in beer sales for January - September to 101. 99 million liters.",2
"TVO ' s two - unit 1, 740 MW Olkiluoto plant generated 14. 2 TWh an operating ratio across both of 93. 5% , the company described as ` ` high by ' '.",1
"In the first nine of 2010, the ' net loss narrowed to, 000 from EUR7. 4 m for the corresponding period of 2009.",2
"BasWare ' CEO Ilkka Sihvo comments in conjunction with the Interim Report: ` ` As a, BasWare well in the second quarter of 2007.",2
"Strong company brands - ESL, Leipurin, Telko and - aim to be the market leaders in their sectors.",2
The total investment in 2006 and 2007 is to amount to about.,1
Total of 140 jobs will be reduced at the Raahe Works.,0
"ADP - Feb 13, 2009 - Finnish Kesko Oyj HEL: KESBV said today its total, excluding value added tax VAT, at EUR 661. 3 USD 853. 1 m in January 2009, down 15. 2% year - on -",0
"The Estonian beverages maker. Le Coq today to the market a new class beer, A. Le Special, investing 6 million EUR 383, 000 into development and planning to sell three million liters of the beer during the next year.",1
Juha Haapakoski will continue as Editor - in - Chief with responsibility also the new publisher.,1
Net sales grew in the period to x20ac 402 million $ 585US from x20ac 401 in 2006.,2
The company will propose a dividend of. 12 share for 2008.,1
"112 in and 280 abroad, the unit recorded - quarter 2007 sales of 8. 6 mln, with an operating loss of 1. 6 mln eur.",0
Approval shareholders of Cencorp in accordance with law.,1
"Motorola accounted for 11. 5 percent of the South Korean handset market as of the end of April, Samsung held 55 percent and LG 19 percent, to Korea - Research Group.",1
"The report also said Nokia ' operations comprising the sites at Bochum, Ulm, Dusseldorf, Munich and Frankfurt operating profit interest of 246 mln.",1
Increase range will vary up to 10%.,1
"China Unicom, : CHU, HKSE: 0762, and SHSE: 600050, the largest mobile carrier in the.",1
"Finnish GeoSentric ' s net sales to EUR 939, 000 in January - 2009.",0
"According to Tyrv + ñinen ' s, Japan is a location in terms of Finnair ' s Asian strategy.",1
"MADISON, Wis. , Feb. 6 - PRNewswire - - - Fiskars announces the United States Patent and Trademark Office has granted a registration for the color on its iconic handles.",2
"Marathon now has a 4. 6 percent stake in, it said, to Bloomberg.",1
STOCK EXCHANGE ANNOUNCEMENT 20 July 2006 1 (1) BASWARE SUBSCRIPTIONS WITH WARRANTS AND INCREASE IN SHARE CAPITAL A total of 119 850 shares have subscribed Warrant Program.,1
Profit after taxes EUR 12. 1 mn.,1
Service developed Digia facilitates the work and resourcing of health care personnel during vaccination campaigns while providing them with and management tools.,1
"According to Swedish authorities, traces of the very toxic tetroxide found on the coast of Per + ñmeri, the Northernmost part of the Gulf of.",0
"( News) - Feb 12, 2009 - IT solutions provider Affecto Oyj (HEL:) said today its profit rose to EUR 8. 5 million (USD 11m) in 2008 from 7 million in 2007.",2
"In addition, Lehdentekijat Oy will start a new membership magazine, Viisas (Money) for the Association.",2
"The operator is one of 6 operators to have been a WiMAX in Taiwan, and to be the first to launch services in early 2009.",1
The difference can be explained by the fact that shipping companies stopped in the Gulf of Finland.,1
"We to ensure Vacon is in good when capital expenditure starts to pick up again, ' ' comments Vacon Plc President and CEO Vesa Laisi.",2
Forest certification is a voluntary system aimed at promoting forest management in commercial.,1
Uponor has actions to attempt to recover the cost of the replacement from the supplier of the clamps as well as its insurance.,1
The operates power plants in the Tyumen and Chelyabinsk and in the Khanty - Mansi Autonomous District.,1
This to 6. 81 of Okmetic ' s share capital and voting rights.,1
"The business has operations in Finland, Sweden, Denmark, Estonia, and Lithuania.",1
R & D ).,1
Around 250 of these reductions will be through pension.,1
"In June sold a 30 percent stake to Nordstjernan, and the investment has now taken up the option to acquire EQT ' remaining shares.",1
"Finnish airline has a deal with the UK public sector to be the official airline for flights from London Heathrow to in, as as flights between Manchester in the UK and Helsinki in Finland.",2
"The brokerage said 2006 seen a ` true turning point ' in European steel base prices, with better pricing carrying through the second of 2006.",2
"Earnings per () amounted to EUR1. 37, down from EUR2. 30.",0
"Pearl CJSC, a of Shanghai Foreign Joint Investment, is developing a project in St, comprising about a million square meters of residential space, two hospitals and several schools and nurseries.",1
"The Finnish food Atria is about to acquire meat processing companies, Woro Kommerts and Vastse - Kuuste Lihatoostus, reported the website www. investinestonia. com.",1
"According to media reports, Usmanov planned to transfer his MegaFon stake to the - controlled Svyazinvest, in exchange a stake in the merged RosTelecom.",1
There are no to AC drives.,1
Cramo to a pretax loss of EUR 6. 7 million from a pretax of 58. 9 million.,0
"` ` will continue to make it easier for users to explore services on handsets and will work Internet to a wider range of devices including and low - end devices, ' ' said Kallasvuo.",1
The company said will be able to on the agreement at an EGM scheduled for later this.,1
"ALEXANDRIA, ., . 22 - - United States Patent no. 7, 854, 608, on Dec. 21, was assigned to Outotec Oyj (Espoo, ).",1
Finnish beverage company is one of the last listed companies in Finland that not yet its financial result for the second quarter of 2009.,1
The contract includes both design and construction works.,1
HELSINKI AFX - KCI Konecranes said it has won an order four hot metal cranes from Indian steel producer Bhushan Steel and Ltd..,2
"Expanded agreement covers the sale, marketing and distribution of ' s navigation and devices in China.",1
"In Finland, export industry a large for the packaging industry.",1
"On Wednesday he that the government would granting a for two reactors, one to be built by Fennovoima, and the other by TVO.",2
Value of the ' s forestry holdings increased by SEK 3. 6 bn.,2
"October, UPM reported a third - quarter net loss of million $ 110 million compared with a net of euro120 million in 2007.",0
"Rapala VMC Corporation STOCK EXCHANGE RELEASE October 10, 2008 at 11. 45 am Bank Oyj (` ` Kapthing ' ') has Rapala VMC (` ` Rapala ' ') that it has the liquidity for Rapala ' s share for the time.",0
"Swedish consultant firm Etteplan is to establish a in town Borl + ñnge, by the turn of the month March - 2008.",1
Finnish stainless steel manufacturer Outokumpu in Degefors is planning to recruit new engineers in to meet a wave the next few years.,1
"ALEXANDRIA, Va. , Dec. 19 - - States no. 7, 853, 620, issued on Dec. 14, was to Nokia Corp. (, Finland ).",1
Managing Director Kari Inkinen says that ' s leasing developed highly favourably.,2
Swedish Wallenberg family controlled Investor has bought a large of shares in Swedish retail bank SEB.,1
"Finnish retailer Stockmann has won approval from the of Swedish rival Lindex for a public offer with the aim of expanding the ' presence in and other CEE countries, Stockmann said Monday.",2
The company confirmed its estimate for lower revenue for the whole 2009 the year - EUR93. 9 m given in the interim report on 5 2009.,0
"This increase Huhtamaki ' s registered share capital is EUR360. 62 m and the number of shares is 106, 063, 320.",1
"The ' s profit before fell to EUR 21. 1 mn in the quarter of 2008, compared to EUR 35. 8 mn in the corresponding in 2007.",0
"In addition, nine fixed - term employment will not be extended and two people will leave the under pension.",1
"According to Pietinalho, doctors should motivate their who smoke time they visit their doctors.",1
The group posted sales of approximately 84 million kroons for 2007.,1
"As an alternative to the share exchange, Panostaja offers a full consideration at the value of 1. 27 $ 1. 7 share.",1
"Ragutis, which is by the Finnish brewery, reported a 5. 4 - - cent rise in beer sales to 10. 44 litres and held an 11. 09 - - market share.",2
"The reason for this is. Petersburg status as a capital, one of the in the meeting quoted Chikunov as.",1
"The contract covers the manufacturing, surface - and installation of the structures.",1
"France + ® l + ® com spent time studying TeliaSonera than other potential takeover targets because has a shareholder that wants to sell, Pellissier.",1
EuroChem CFO Andrey Ilyin said: ` ` facility another important step for in securing the long - term financing necessary for our and other strategic projects ' '.,2
With this appointment Kaupthing Bank aims to further co - ordinate Markets within the Group and to improve the overall to clients.,2
Viking has canceled some services.,0
"Professional and consumer applications personal navigation, personal safety, field and workflow management, and asset.",1
"Of the HK Ruokatalo Group in Finland, Scan, is launching a venture with Team Ugglarp in Sk + Ñne, southern Sweden.",1
"The podcast, sees provide the low - on GyPSii ' s platform, which takes ' s location and demographic information to produce a index of the world around them.",1
HELSINKI () - Outokumpu said it has agreed to sell the Hitura nickel in Finland to Canadian group Belvedere Resources for 10 mln eur worth of shares.,1
"` Ruukki has of logistics construction, competence in management and also has the best references in terms of steel frame and installation, ' says Stefan, General Manager of Arxikon Construction Company SRL, is Ruukki ' s customer.",2
Atria is a leading Scandinavian meat products group.,2
This is bad for the barbeque season.,0
"Value of the contract is about EUR1. 0 m. Poyry, in Vantaa, Finland provides consulting and engineering services to the energy, and infrastructure & environment.",1
The robust growth the result of the inclusion of chain Lindex in the Group in December 2007.,2
' s net in 2006 totaled EUR 225. 9 million.,1
"Currently, YIT builds a estate Zapadnye Vorota 26, 000 square metres in the city and a house 9, 910, which will be at the end of 2009.",1
"Production will rise from 170, 000 tonnes to 215, 000 tonnes.",2
"The Samsung Store was launched in January 2009 by Samsung Mobile Innovator, a program which enables software developers to create applications for use across mobile devices.",1
"In Finland, metal sector company Componenta is laying off temporarily the staff of mill from Christmas 2008 6 January 2009.",0
"The Report will be automatically to shareholders holding at least 2, 000 Sampo plc shares.",1
Antniemi refuted a report the daily Turun Sanomat as if the company was its operations in the Baltic countries.,1
"Copper, and nickel also dropped. .. (HBOS) plummeted 20% to 70. 3 pence after saying year + ó??",0
"Company: Tieto, Identity Code: 0101138 - 5 of in holding: 22 January 2010 Portion of the shares and votes: group holding of OP - Pohjola Group Central Cooperative (OPK) is 2982 587 shares, which represents 4. 14% of the shares and voting rights.",1
"Jobs will not be transferred Finland, however.",2
"` ` The transaction strengthens position. .. in design and branded goods, ' ' said Fiskars president and Heikki Allonen, pointing out the two groups have relatively overlapping operations.",2
"SysOpen Digia Plc, Press, 7 February 2006 IBM Finland rewarded most distinguished partner companies for 2005.",2
"Under the changes, HK would reduce its of industrial places of business in Finland from eight to six.",1
Certain have irrevocably agreed to vote in favor of the issue.,2
"New Chairman of the Board of Directors, Mr Chaim Katzman, will give a and answer.",1
FCC Chairman Kevin Martin said that required extending the deregulatory rules to the digital subscriber lines that telecom providers use for broadband networks.,1
"According to the Latvian register, Latvia closed in red with 99, 000 EUR 139, 538. 17 USD 194, 556. 48 on of LVL 2. 346 mn for 2009.",0
Nordea has a share and vast experience in the Nordic credit card market.,1
Decisions to be made as quickly as possible.,1
"Currently it a fleet of eight carriers, well as nine pushers and barges.",1
"Total headcount reduction will be 50, the company said.",0
"Corporation STOCK EXCHANGE RELEASE 13. 02. 2008 Ahlstrom, a global leader in high performance - materials, today announced the completion of the acquisition of Friend Inc. , which consists of West Carrollton Parchment Company and West Carrollton Company.",1
The will no significant effect on the acquiring company ' s equity ratio.,1
"Housing Loan Bank, a unit of Finland ' s Sampo Bank, has priced (USD1. 3 bn) bond at 99. 889% , reported.",1
"Demand seems to have now, and some signs of improvement can be seen.",2
"` ` Korean are - and leading the pack in terms of design, ' ' Gill Hyun - chang, of Motorola Korea Inc. , told Dow Jones Newswires in an interview.",1
"City24 users can search for homes and properties in areas where is, even outside their own country.",1
The order is a - on to an 11 ($ 16. 1 mln) deal made in July 2007.,1
"Motorola, the world ' s second - largest of phones, unveiled the new phone Tuesday in a bid to resurrect its ailing business.",1
"Finnish - owned contract manufacturer of electronics Elcoteq Hungary Kft has to recruit more than 650 new staffers to fulfill orders in P + ® cs, where the company has plants.",2
Finnish pharmaceuticals company Orion ' s sales rose to EUR 190mn in the quarter of 2009 from EUR 180mn in the quarter of 2008.,2
Earnings per (EPS) amounted to a of EUR0. 38.,0
"The Polish business employs 1, 000, and it had sales of about EUR 70mn in 2007.",1
AFX - Fortum said it has agreed to sell its industrial maintenance operations to funds managed by CapMan an undisclosed sum.,1
"YIT ' s Baltic in the first quarters of 2008 106. 2 million euros, representing a drop of 29 percent year on year.",0
Affecto has participated in the program for the of the Norwegian pension since 2007.,1
"Per share for January - June 2010 were EUR0. 30, an of 20% year - on - year EUR0. 25.",2
Ramirent Finland is the domestic unit of machinery company Ramirent Oyj HEL:.,1
"Jussi Pesonen, member of the Board since 2006, will renounce his in Sampo Board.",1
"` ` I ' m pleased to receive the Nomination Committee ' and confidence, ' ' says Jon.",2
"Finnish silicon technology company Okmetic Oyj (OMX Helsinki: OKM1V) reported on (7 August) an operating of EUR5. 3 m for the January - June 2008, up from EUR3. 3 m in the period in 2007.",2
The development of online businesses will continue.,1
"Finnish, a systems supplier and contract manufacturer to the communications sector and the industry, reports its net sales totalled 94. 7 mn in the first half of 2010, from EUR 99. 5 mn in the first of 2009.",0
National sponsors for Big Read National Endowment for the Arts in with the Institute of Museum and Library Services and Arts Midwest.,1
"MD of Stockmann Gruppen praises the trend, since the chains become and their decision - making processes more clear.",2
"The firm ' s UK head is in Road, Lutterworth.",1
"Turnover surged to. 8 m from EUR47. 6 m to increasing service demand, especially in the third quarter, and the overall of business.",2
"In addition to fireplace, demand for lining has exceeded the level of the earlier part of the year and will continue to be clearly brisker the remainder of the.",2
The carrier said Area travel agency is to sell most of its outlets to sister chain Matkatoimisto (SMT) and use its bricks - and - presence to primarily target business customers going forward.,1
Diluted loss per share narrowed to EUR 0. 27 from 0. 86.,2
"Teleste, the an entry into services business in a market where it has long been an established and significant supplier of products.",2
Panostaja is a financially secure Finnish multi - field that healthy companies and company entities.,1
"Finnish AC manufacturer Vacon is acquiring the AC drives business of TB Wood ' s, of the US group Holdings.",1
", a - year historic analysis is provided for this market.",1
"( ADP News) - 22, 2009 - mobile phones maker Oyj (: NOK1V) today its operating profit decreased to EUR 5 billion (USD 6. 5 bn) for 2008 from EUR 8 billion for 2007.",0
"The business goals for 2009 will with the temporary - offs out in the summer of 2009, and with other savings measures.",1
"Finland, insurance company Pohjola and the Finnish motorcyclist association have signed an agreement the aim of improving motorcyclists ' safety.",2
"Operating loss totaled 0. 8, compared to a profit of EUR 0. 5 mn.",0
Aker Finland will begin using Chinese subcontractors at its Finnish.,1
"Stonesoft is a provider of proven, next generation solutions that network security management.",1
"As a of the share issue, the number of the ' s shares increases by 391, 630 shares and the capital by a total of 15, 665. 20.",1
Both Mr Walden and Mr Ignatius will be responsible for the newspapers ' business.,1
"ADPnews - Sep 28, 2009 - silicon maker Okmetic Oyj HEL: OKM1V said it will reduce the number of its clerical by 22 worldwide a result of personnel negotiations completed today.",0
"Can say categorically, no, ' Wahlroos was as saying by the paper, when asked Sampo ' s interest in making a bid for.",1
"The agreement GeoSentric will GyPSii - powered hotel and reservation services to visitors to China, including such popular cities as Beijing and Shanghai.",2
"Linde responsibly towards shareholders, business partners, , society and the environment - in every one of its business areas, and locations across the globe.",1
"Compared the FTSE 100 index, which fell 35. 2 points (0. 6%) on the day, was a relative change of 0. 6%.",1
Basic banking activities continued normal.,1
The total value of the contract is 8 million.,1
"Jensen, Njastein and Mike, the head of America business unit, will report to Toivola.",1
` ` Nokia is interested in Nokia to the market. ' ',1
Together they generate Aspo ' goodwill.,1
Operating profit of the Asian plants grew.,2
"Compared with the FTSE 100, which rose 94. 9 points (1. 6%) on the day, this was a change of - 0. 4%.",0
"Can even receive on the spot alerts soon as jobs are posted, putting you at the front of the queue opportunities.",1
"Previously announced, GeoSentric Oyj entered into financing agreements with lead investor on June 30, 2010 enabling the Company to receive financing up to the aggregate of 6M.",1
( & H) in a move to growth.,2
Terms of the funding are considerably below the ' s current CDS levels in the market and have a maturity ranging 1 to 7. 5 years.,0
"Following the registration, the of issued and shares of Basware is 12, 890, 829.",1
"Only L + ñnnen Tehtaat showed a loss, has only recently started streamlining measures.",1
"The equipment Ixonos acquires with this includes mechanical engineering hardware; an RF and measurement laboratory; facilities for the of audio, cameras and displays; as well as devices and robot for the testing of mobile.",1
"Weber his friend, who owned a Lake Street sporting goods store, to sell the lures.",1
"A few months, vice chairman Phillip Frost and Marathon Venture Fund TASE: MARA sold Protalix shares.",1
"The launch of the plant in went well, and it has been producing the advanced for a couple of.",2
Rautaruukki aims to find work from the group ' s other locations for who been made redundant.,1
"ASPOCOMP GROUP STOCK EXCHANGE RELEASE 15, 2006 at 4: 50 PM to the disclosure received today by Group Oyj, the share of Henrik Nyberg in Aspocomp Group Oyj ' s share and votes has decreased below 5 percent.",1
"Raute posted a of 1. 8 mln euro $ 2. 6 mln the third of 2007, compared to a loss of 299, 000 euro $ 430, 000 for the corresponding period of 2006.",2
"The OMX Helsinki 25 ended 0. 47 pct lower at 3, 150. 55 and the OMX Helsinki 0. 21 at 10, 736. 42 on 1. 523 bln eur.",0
"Operating profit and sales for the 12 - increased, respectively from EUR10. 5 m and EUR28. 8 m, as compared to the financial year 2004.",2
"It includes the installation of new equipment, training and start - up services, as well as service work of the shoe delivered in 2001.",1
"The Swedish buyout firm has sold its remaining 22. 4 percent stake, months after the company public in Finland.",1
ZAO YIT builds housing in and its surrounding cities.,1
", sales of new passenger cars and light commercial in the declined by 5. 4% year - on - year last month.",0
"Viking Line has also been forced to alter its so ferries traveling from Stockholm to Helsinki, Finland, only depart at.",1
"In addition, a good durability is. ' '",1
", the company saw its net for the third quarter to EUR 1. 4 million from EUR 1. 5 million for the corresponding of 2009.",0
"ST. PETERSBURG, Oct 14 (PRIME - TASS) - - Finnish producer Nokian Tyres plans to invest about 50 million euros in the expansion of its tire in the of Vsevolozhsk in Russia ' s Leningrad Region in 2011, the company ' s told reporters Thursday.",2
The Line 4 will underground and will comprise 10 stations will be executed in two implementation stages.,1
"4 February 2011 - data communication systems provider Teleste Oyj HEL: TLT1V saw net profit jump to EUR2. 1 m for the quarter of 2010 from EUR995, 000 for the period of 2009.",2
Marathon the value of its remaining in Protalix at $ 27 million.,1
"Instead, Elcoteq has signed a non - Letter of Intent with another strategic investor.",2
The secondary antenna can be used for reception of the high power signal of the to the transmission channels of the radar. ' ',1
"- tax loss EUR 0. 3 mn, compared to a of EUR 2. 2 mn in the first quarter of 2005.",2
The sale will lead to a pretax capital gain of EUR 22 million for the in 2011.,2
"The portfolio comprises of 118, 000 m2 of leasable space with a of roughly 5% , let to around 140 tenants of which of the are the Swedish government and Ericsson.",1
", the growth margin slowed down to the financial crisis.",0
"Finnish Neste Oil that previously on the list, has fallen the list completely.",1
` ` Marimekko operates in an industry in changes in the business are reflected in consumer demand.,1
"Creating interfaces that are more to interactions in the real world can enable experiences are more natural and intuitive, in the same that modern and movies are more immersive the use of realistic 3 - D graphics.",1
"Finnish construction machinery and rental group Cramo said on March 21, 2007 its Swedish sector subsidiary Cramo AB will sell subsidiary Nederland B. V. (CNL) to Dutch rental and scaffolding company Jaston Groep B. V. for an undisclosed.",1
The Swedish player majority owner of UCell in - 2007.,1
The sales price not disclosed.,1
