sentence,label
This amount will not be included in the pensionable salary .,1
Other details were not provided .,1
Finnish business software Oyj said it signed an acquire all the shares in Swedish sector company Intellibis Ab 12 mln ($ 15. 8) a debt - basis.,2
"To, the will also temporarily lay off 3, 200.",0
"The workforce will be reduced also in the Amsterdam office , in the Netherlands .",0
Hobby Hall 's sales decrease 26 pct due to implementing a new information system that involved changing in the principal of posting sales .,0
"The company 's profit totaled Ls 134,700 .",1
"Both operating profit and turnover for the six-month period increased , respectively from EUR0 .1 m and EUR29 .0 m , as compared to the corresponding period a year ago .",2
"The were a manner, and tried to a solution the.",2
The transaction is in line with Aspo 's strategy to expand in the Baltic Sea region and in the eastern markets .,2
"Berling Capital , Umo Capital and Veikko Laine are the biggest shareholders in Amanda Capital .",1
The order for plywood mill machinery and equipment announced by Finnish Raute in September 2006 will be delivered to Thebault Plyland in France .,1
"Galeria Podlaska , a shopping mall on Wysockiego Street in Bia ` ystok , is approximately 60-percent leased or reserved .",1
"Forestries were also higher , driven by yesterday 's bullish analyst comment on Stora Enso in Dagens Industri , dealers said .",2
HELSINKI - said unit won a 28 mln eur from Bosnia - Herzegovina ' s Mostar to upgrade an.,2
Customer is Osuuskauppa -.,1
"The deal includes all rental equipment and related merchandise , the rental contract of the depot and two employees , the company said .",1
`` Our approach is very much to only use raw materials that are produced in line with the principles of sustainable development .,1
Protalix has $ 42 million in cash and no sales .,1
"- are expected 10% , the.",2
"There been 15 initial announced in Sweden this year, with two during the a year,.",1
The Finnish company Stockmann has signed the contract with the company Technopolis .,1
"Controls than 50 of phone sales in India and, and a prosition most markets.",2
Under the terms of this agreement Lextel Group committed an order of EUR3. 75 m mobile be co - with the China market.,1
"Mobile phone sales rose 25 % to 5.87 billion euros , while enterprise solution sales dropped 39 % to 186 million euros .",2
+ the most of the houses can not be.,1
"Via the move , the company aims annual savings of some EUR 3 million USD 4.3 m , the main part of which are expected to be realized this year .",2
The use case dramatically narrows if you go only with the hot s Ltd.,1
"Ruukki, the local of metal, increased by 900, 000 euro ($ 1. 14 mln) through cash, it was September 19, 2006.",2
",. , Dec. 22 - - States no. 7, 854, 608, Dec. 21, to Outotec (Espoo, ).",1
"New Delhi , July 17 -- Sahlberg Teppo , Kallio Timo and Mustonen Tuomas of M Real OYJ , Espoo , Finland have developed novel markings and methods of producing the same .",1
Panostaja Oyj 's Board also decided at its organisational meeting held upon completion of the AGM to implement the AGM decision concerning Board member fees paid as shares in such a way that shares are transferred on a quarterly basis on the date following publication of the quarterly-annual report .,1
"One is on the preferred ' network, and another calls on '.",1
"Equipment Ixonos acquires deal includes mechanical engineering hardware; an RF and antenna laboratory; facilities for the measurement of, and displays; as as devices and units for the testing of.",1
"Operating profit totalled EUR 21.1 mn , up from EUR 18.6 mn in 2007 , representing 9.7 % of net sales .",2
"Thanks to his wide contact network and good knowledge of market and business environment , he will give a great contribution to the further development of our Indian operations '' , tells Incap 's President & CEO Juhani Hanninen .",2
"In February 2011 , new wording of Identity Documents Act that makes Mobile ID a state-approved electronic document as of February 1st 2011 entered into force .",1
` ` The lowering of by us and by competitors the real market stabilised and into and apartments are a price in the eyes of our clients.,2
Combined of the is 45mn.,1
"Profit for the period totaled EUR 39.4 mn , up from EUR 33.9 mn in the corresponding period in 2006 .",2
' a -.,1
Group ' - are estimated by 10%.,2
` ` is no the share. ' ',1
Less than ten people will face pension agreements .,1
The group said it intends to initiate within this year the process of buyout of minority shareholders of Ragutis with the aim of becoming the sole owner of the company .,1
We can capitalize on our experience from a number of similar bridge projects in the Nordic countries .,2
"Under a memorandum of understanding MoU the parties will collaborate in preparing and implementing joint projects in the fields of combined power and heat generation , environmental protection and energy efficient technologies .",2
"Order a, , and.",1
"Last July , the group said it intended to relocate warehouse and office space in Loudeac and Saint Marcel to Morvillars , in the east of France , where it already operates a hook manufacturing and distribution unit .",1
"To, motivate their time they doctors.",1
Total of the is 8.,1
More staff has been recruited in Japan to further complement its network of close to 50 service locations in more than 20 countries worldwide .,2
"The company had net sales of EUR 10.8 million in 2008 , and today has approximately 120 employees in Finland , Estonia and Poland .",1
Work on the assignment has already started and is due for completion in spring 2011 .,1
"AGJ recorded EUR 43 mln sales in 2006 , most of which was generated by exports to customers in Western Europe , the statement said .",1
The revenues of the business reached NOK 12 million for 2008 .,1
The Group 's business is balanced by its broad portfolio of sports and presence in all major markets .,2
"The that currently the French unit Ragot is located in Loudeac, Normandy, the distribution unit Waterqueen and Tortue in Saint Marcel in - France and the hook manufacturing unit and hook distribution Europe Morvillars.",1
Tekla will implement the renewal in software versions which will be introduced in spring 2011 .,2
Have long - in the '.,1
Finnish media company Talentum Oyj ' decreased to 2. 5 ($ 4. 0 mln) for the first of 2008 from 3. 0 euro ($ 4. 7 mln) the of 2007.,0
Profit the 2006 () 172.,1
"In 2007 Talentum disclose - Q1 (January - March ), 27 April, 2007 - Q2 (- June) on, 20 July, 2007 - (July - September) Friday, 26 October, 2007.",1
"According to Soosalu , particular attention was paid to residents privacy and security in the design of the Aleksandri Street building .",1
"` ` Our customers now the chance make bookings all the services they want one, ' ' Mikko Tuomainen, - charge of Finnair ' ().",2
"Tecnotree 's convergent charging solution includes functionality for prepaid and post-paid billing , charging and rating of voice calls , video calls and raw data traffic for both mobile and fixed networks .",1
"Divested is of ', &.",1
"Finland-based international machinery rental company Ramirent Plc ( OMX Helsinki : RMR1V ) said on Friday ( 9 May ) that its president and CEO , Kari Kallio , has informed the board of his intention to retire in year 2009 .",1
The companies expect the first orders already in 2011 .,2
"I make the clothes, to allow your breathe and be eco -.",2
"Poyry 's contract includes engineering management , civil and detail engineering services , and time scheduling and procurement services .",1
"Atria will launch a campaign in September to promote the CampoMos brand on the Moscow market , he said .",2
"In accordance with our strategy , we strengthened our local presence by establishing a representative office in South Africa in October .",2
"The building complex consists of high-quality office and retail space totalling 49,200 square metres , the company said .",1
Operating profit decreased to EUR 11.2 mn from EUR 16.6 mn .,0
To raise consumer awareness and encourage people to recycle their old mobile devices Nokia runs regular recycling campaigns around the world .,1
And of 2005.,0
"To Management, Finnish ' 2009 are.",0
The expansion includes the doubling of the floor space and the addition of more lifting capacity and production equipment .,2
The increase range will vary up to 10 % .,1
- real to discontinue of the and + + hle mills.,1
"in ' 10 19 April 2010 - Finnish forest and equipment Oyj: said today that it expects to swing to a net profit of some. 3 in the quarter of 2010, an EUR9. 6 m loss a year earlier.",2
"Janno Reiljan , a member of the Eesti Energia supervisory board , said the owners of Narva Power Grid had informed Eesti Energia about their wish to sell .",1
YIT in and.,1
"EBIT -, 67. 8, 38. 1 mn.",2
"The Nordic 40 OMXN40, the 40 stocks on the Nasdaq exchange, 0. 87% at 1, 064. 14 on Thursday.",0
Medical Devices - Russia This brand-new market analysis gives a clear overview of the actual situation and future outlook of the medical device market in Russia .,1
"Helsingin Uutiset , Vantaan Sanomat and Lansivayla reach some 385,000 readers , or more than 40 % of the consumers in the greater Helsinki region .",2
"Vaisala expects of EUR 253. 2 million 2010, with EUR 252. 2 2009.",2
"Koduextra is operating a retail chain of 11 stores , controlled by Finnish Non-Food Center KY , Rukax OY , and Scan-Tukka OY .",1
"The Marimekko ' design manager, Noora Niiininoski, explains the are a fit for because they both a timeless style.",1
Consolidated operating profit from continuing operations decreased by 62.3 % to EUR 51.2 mn from EUR 135.7 mn in 2007 .,0
Some of the lay-offs will be implemented using part-time employment contracts .,1
Lee he Neste ' will ` pave the for collaboration projects two countries '.,2
Subject - of the is the of the. ' ',1
"Finland, the 90% of the.",1
Profit the quarter April - June 2006. 2 on of. 62.,1
"To the, the - be.",1
"Crucially , the decision to use ETSI ( European Telecommunication Standard Institute ) - backed DVB-H adds to the growing list of operators and equipment manufacturers opting for the standard ( see Global : 20 January 2006 : Competing Technologies Vie for Mobile TV ) .",1
"The company can be split into two parts over the coming months , with Essent owning and operating production and supply , and Enexis owning and operating the grid .",1
"In the autumn , it plans to expand service to St. Petersburg and Moscow and launch service to Yekaterinburg , Russia , flying there three times a week .",2
"Finnish equipment maker Konecranes Oyj said July 30, 2008 its rose 71. 2 mln euro ($ 111. 1 mln) the first of 2008 57. 1 euro ($ 89. 1 mln) for the same period of 2007.",2
Profit 27. 8 17. 5 2008.,2
This assignment Poyry ' an international provider of and project the.,2
"Mr Clausen , however , refused to comment the option that Nordea would consider buying into Citadele Bank .",1
"The facility, be known as Technopolis Pulkovo, will to the an entirely of creating, operating and a commercially - funded science and technology park to the growth of - intensive companies.",1
Controls a 5% of the Power. EUR 1. 0 = 1. 397,1
` ` be.,1
Rautaruukki Corporation Stock exchange release 3 December 2009 at 12 noon Ruukki 's construction and engineering divisions are to further improve and adjust their operations in Finland .,2
"Yara Suomi also provides nitrogen and technical sectors of industry, well products environmental.",1
"Shipping company Finnlines ' pretax loss 6. 5 the of 2009, compared to a profit of EUR 0. 3 mn the quarter of 2008.",0
"The paper ' s de - inking sludge, which is in mills that recycled fiber ink is from paper, is a material.",1
"`` We will continue to make it easier for users to explore services on their handsets and will work towards bringing Internet to a wider range of devices including mid and low-end devices , '' said Kallasvuo .",1
"+£lemiste City is the environment for a knowledge-based economy providing work for 3,300 people with the total turnover of its companies amounting to EEK 5.4 bn , '' said +£lo P+ñrnits , chairman of the supervisory board of +£lemiste City and Mainor .",1
"The technology will become available to businesses from the fourth quarter , Nokia said .",1
"Communications is Helsinki,.",1
"Addition, the a of.",0
"- owned contract of electronics Elcoteq Hungary has announced recruit more than 650 new staffers to new in P + ® cs, the has two.",2
"was established the of institutional investors; , the annually results interest an increasing number of customers and groups of the.",1
Personnel concern 104.,0
Be one means creating value.,1
"Diversified holding Aspo said on 8, 2008 will the Finnish tape business of its Kaukomarkkinat to Oy Ab.",1
The Department Store Division reported an increase in sales of 4 per cent .,2
Finnish and arts and crafts Tiimari Plc (OMX Helsinki:) reported on Monday (18) an operating loss of. 3 on of. 9 m for the period January - June 2008.,1
"In the Baltic countries , development of operations and reorganisation continued , and non-recurring items related to the takeover process lowered earnings .",0
"Parallel, conduct a.",1
"Cramo, headquartered in, Finland, machinery and, as and.",1
"A maximum of 666, 104 shares further be B the 2004 option.",1
Sales is increase.,2
", the company the third quarter down to EUR 1. 4 1. 5 million for the period of 2009.",0
Shops located the and the -.,1
Few employees would remain at the other.,1
"Finnish Cargotec ', the business area providing container handling, has been awarded an a further ten E - One rubber - tyred gantry from Newport, in Vietnam.",2
"We are glad that our long co-operation with SODRA continues '' , comments Stig-Goran Sandberg , Affecto 's Area Manager for Baltic operations .",2
Sales 14 per in Finland and up 27 cent abroad sales lifted by the sales in Russia and.,1
"In the second quarter of 2009 , net sales through operator business partners represented 47 % of the Group 's total net sales .",1
"The company is the the sale of, , and personal loans, financial brokerage and finance.",1
"A structures BIM ( building information modeling ) software from Tekla , a model-based software provider , has been adopted for the construction management and delivery of a university project in Abu Dhabi .",1
"ES Vostok also owns stakes power sales companies (:) (50. 9% ), Altaienergosbyt (100% ), Saratovenergo (RTS: SARE) Body (48. 36%) and Power Sales Company (RTS: TASB) (49. 01% ), all it received the.",1
"Segments the are, Seafoods, Oil business, Grain Trading and business operations.",1
"Member of the HK Ruokatalo Group in Finland , Scan , is launching a joint venture slaughterhouse with Team Ugglarp in Sk+Ñne , southern Sweden .",1
Pretax loss totaled EUR 117mn compared to a loss of EUR 65mn in the corresponding period .,0
"Outsourced and Capture solutions transfer paper invoices electronic, and Basware Business Transactions allows the to and send invoices an format.",1
The company did not disclose the price of the acquisition .,1
"Corresponding in the share, , 754, has in the.",1
"Earlier, the company signed a with India - based information technology services giant transfer and sell its radio related R & activities in Berlin.",2
Those will be by a 186 mln the of pulp plant.,2
Stora Enso owns 43 percent of Bergvik and earns therefore SEK 1.5 bn on the value appreciation .,2
Finnish forest industry group Stora Enso Oyj issued on Thursday ( 20 March ) a profit warning for the first quarter 2008 .,0
"At first the contract envisaged the construction of three ferryboats with an option for two more units , further confirmed at a total value of 500 mln euro ( $ 645.8 mln ) .",2
"Of the ' sales, 38% Finland, 21% other European, 40% , and 1% in the US.",1
"The investigators set to sight tests 18, trains similar those in the accident.",1
"The fixed-term contract of Mr. Jarmo Ukonaho , the current General Manager of Incap 's Indian operations , will finish by the end of the year .",1
The value of the order is EUR 4mn .,1
"Also , it is bringing in `` the right kind of people '' to upgrade its human resources .",2
"Most recently , he founded Virent Energy Systems , Inc. , an 80 person catalytic biofuels company , where , as president and CEO , he led the company through multiple financings , defined the company 's market strategy , and secured the company 's first customers .",1
in Finland Finnish pharmaceutical company Orion Corporation OMX Helsinki : ORNAV said on Wednesday 7 January that it has concluded its personnel negotiations in Finland and will reduce the number of personnel by 205 .,0
` ` the. ' ',2
"One the soon as jobs posted, putting you the front of the queue for.",1
Finnish department store chain Stockmann Oyj Abp net profit rose to 39.8 mln euro ( $ 56.8 mln ) for the first nine months of 2007 from 37.4 mln euro ( $ 53.4 mln ) for the same period of 2006 .,2
Pharmaceutical Global & recently a market analysis the in Belgium.,1
"The dollar bounced back after hitting another record low against the euro , which reached $ 1.41 for the first time .",1
The fair value of CapMan Plc 's own investments on 30 September 2008 amounted to MEUR 59.8 .,1
Last year 's third quarter result had been burdened by costs stemming from restructuring in the US .,0
", Media has purchased a 35% share of, a of Partners with a development.",1
3 January 2011 - Finnish flag carrier Finnair Oyj ( HEL : FIA1S ) said today it sealed a nine-year sale and leaseback agreement for its newest Airbus A330 aircraft for syndication into the Japanese operating lease market .,2
"Under the terms of the agreement , Bunge will acquire Raisio 's Keiju , Makuisa and Pyszny Duet brands and manufacturing plants in Finland and Poland .",1
The company expects its net sales in the first half of 2008 to reach the previous year 's level .,2
"Finnish Sampo-Rosenlew manufactures approximately seven forest machines monthly , and about half of machines are exported .",1
"When next year, will be the largest in the world to produce diesel renewable palm oil and.",2
"In January-November 2009 , the group 's sales totalled EUR 7,801.7 mn , which was a drop of 12.6 % from the same period of 2008 .",0
"The operator is one of 6 operators granted a in Taiwan, and to be the first services early 2009.",1
- brand - new analysis gives a overview of the actual and outlook of the pharmaceutical in Czech.,1
Unit costs for flight operations fell by 6.4 percent .,2
"&, .: 5 534 626 4. 985% of the and.",1
"Operating 0. 6, a of 19mn a.",2
"` ` Activision ', to: We, ' ' said, Rapala.",2
hu will offer a further discount of between 25 % and 50 % on selected books .,1
"Innova 2 building will be located close downtown, in the immediate of and the travel center, and walking the heart of the thanks the trade fair bridge.",1
"We aim to ensure that Vacon is in good shape when capital expenditure starts to pick up again , '' comments Vacon Plc President and CEO Vesa Laisi .",2
"Finnish software QPR Software (OMX Helsinki:) (23 October) an of EUR63, 000 net of EUR1. 5 m for the third quarter 2008.",1
Said before the was that the techno - park would be at a more than six hectares the Neudorf special economic zone and it planned to 200 million euros in the project until 2009 inclusive.,1
"The company reported a profit of 800,000 euro ($ 1.2 mln)on the sale of its Varesvuo Partners sub-group and a loss of 400,000 euro $ 623,000 caused by the sale of its program production subsidiary Oy Filmiteollisuus Fine Ab .",1
"EBIT for the half. 6 m $ 17. 8, falling short of the EUR22. 5 m it posted the of 2009.",0
"The Vuokatti unit will be developed to focus especially on the manufacture of prototypes , the ramp-up of new products and the demanding testing and after-sales services .",1
"The, Kesko ' share is 10 mln euro $ 15. 5 mln and will recognize a of 4. 0 euro $ 6. 2 mln the which will be included in the the second quarter of 2008.",2
The stock was hit by the profit warning of Finnish rival Rautaruukki Oyj ( OMX : RTRKS ) .,0
"Year, , and slashed 700.",0
"Is a of, next simplify.",1
Jones is of.,1
"` ` Beyond the improved, now a to comply and other traceability requirements, providing them with a.",2
No service pricing details were disclosed .,1
"The company , which makes garden tools , scissors and other consumer goods , said earnings were boosted by 6.9 mln eur of income it received from its 16.7 pct shareholding in Finnish engineering group Wartsila .",2
"Both operating profit and sales for the three-month period increased , respectively from EUR0 .3 m and EUR13 .1 m , as compared to the corresponding period in 2005 .",2
Cymed 's net sales are expected to amount to EUR 3.5 mn in 2006 .,1
The estimated annual value of the frame agreement is about EUR 50mn .,1
The presentation material can be viewed on the company 's website in English after the conference .,1
"Fiskars, the World ' 1 Brand, - « ' 2011 Teachers ' Choice Award the.",2
Kalmar be responsible the and of the.,1
"The liquidity was interrupted May 11, 2007 when Aspocomp ' s shares 0. 50 cent (Aspocomp ' 11. 5. 2007 ).",0
"The negotiations concern personnel of Cencorp Corporation and Singulase Oy as whole in Finland and in Sweden , the company said .",1
"Finnish electronics manufacturing services EMS company Elcoteq SE posted a net loss of 66.4 mln euro $ 91.2 mln for the first half of 2007 , compared to a net profit of 7.1 mln euro $ 9.8 mln for the same period of 2006 .",0
"- Group - the 31. 6 million EUR 36. 6, 1 - 6 / 2007 and profit before taxes EUR 0. 2 1. 3 million.",1
The total value of the project is valued at SEK 30bn ( EUR 2.83 bn USD 3.81 bn ) .,1
Metsa-Botnia will sell 82.1 % of its stake in the Uruguayan companies and Metsaliitto -- 5.5 % .,1
"The study was not designed to enable formal statistical evaluation of therapeutic activity , the company said .",1
Bertrand Sciard the of the of of 2007.,1
Net sales fell by 5 % from the previous accounting period .,0
"The bank also expects additional costs , related to the Dash 8 - Q400 jets , which the group shelved in October 2007 .",1
", the - headquartered private equity firm, has a first close second estate fund as it continues its push the property.",1
"According the, normal fluctuation the weakened during 2008.",0
The company also said that in Poland a profitability program has been launched at the Oborniki steel frame and sandwich panel plant .,2
"The German company has also signed a code share agreement with another Oneworld member -- American Airlines Inc , part of US-based AMR Corp ( NYSE : AMR ) .",2
"Finnish machinery and maker Ponsse Oyj October 5, 2007 it will deliver a total of 67 cut - to - method forest and 44 heads to Brazilian paper maker Bahia and unnamed wood harvesting contractors.",2
"Consisting of seven interconnected units , Mega Image 's logistics center will be 347 metres in length and 12 metres in height .",1
"The company is in the process of building a new fleet and has placed orders for 10 P-Max tankers of 65,200 dwt .",2
`` We 've been feeling quite positive about the region as a whole .,2
"Furthermore , the company will sell the warehouse and office buildings in Loudeac and Saint Marcel and lease new joint premises for these operations in Morvillars .",1
The front surfaces of these valve plates are directed towards each other .,1
"Loss 0. 8, a of 0. 5.",0
"Helsinki on October 22 , 2008 SSH COMMUNICATIONS SECURITY CORP Board of Directors For further information , please contact : Tomi Laamanen , Chairman , tel. +358 0 400 609 544 Distribution : NASDAQ OMX Helsinki Ltd. .",1
Sales to. 3. 9 m and profit rose 34. 2% to EUR43. 1 m. (=. 4 ),2
The reductions will be concluded by autumn 2010 .,1
"Company: Tieto, Code: 0101138 - 5 Date of change in: 22 2010 Portion of the and votes: current group holding of OP - Group Central Cooperative (OPK) is 2982 587 shares, which represents 4. 14% of the shares and voting rights.",1
"The contract also a for 1, 000.",1
", the be the of 2008.",1
"Alpina Sports is a Lebanon , New Hampshire USA based distributor of e.g. Alpina ski shoes and skis , Exel ski poles , Start ski waxes and now also Peltonen cross-country skis .",1
"Stockmann department store will have a of 8, 000 metres and Stockmann ' investment in the will have a tag of about EUR 12 million.",1
Pharmaceutical market in Czech Republic Global Research & Data Services published recently a market analysis about the pharmaceutical markets in Czech Republic .,1
"S Group ' s customer + ñ with 1, 629, 000 readers and Sanoma Corporation ' s newspaper was 1, 097, 000 readers.",1
Earnings () 0. 63 1. 71.,0
Total of the is 29mn.,1
"Tectia Corporation HEL : TEC1V , a provider of real-time security solutions , today announced that it has appointed LAN2LAN , a provider of IT services in the UK , to distribute its data security and manage file transfer software .",2
"The reorganisation will be carried transferring Corporation ' s production - related, and equipment in as well its in subsidiaries and associates to Finland Oy, a holding company wholly owned by Corporation.",1
"HELSINKI (AFX) - Metso of UPM - Kymmene ' s four paper machines at the latter ' mill in with a color supply system, machine and controls and quality measurements.",2
The StoneGate UTM solution offers protection against inbound and outbound attacks .,2
"` It is a testament to the quality of our LTE solution and our commitment to the Japanese market ' , he added .",1
"The talks concerned about 160 people in Finland and the initial estimate was for about 35 redundancies , Fiskars said .",1
"Surged to EUR61. 8 m from. 6 m increasing demand, in the, and the of its business.",2
"CompaniesandMarkets.com provides a wide range of research reports , industry statistics and competitive intelligence on the industrial sector .",1
