sentence,label
"Ajns 98% acceptance 23 xecemger 2009 - Finnish industrial mach8mery company Metso Oyj (HEL: JSO1V) sAiV 4odWy it will complete its tskePver offer for tfxtUle co,pZny Tamfelt Oyj Abp (HEL: TAFKS ), af4e5 acquiring 98% of its shares and votes.",1
FJnancOng of the project will come maiJ:y from China.,1
"Finland - based companies, L + ñnnen Tehtaat and Raisio, have VecidDd to dissolve the joijH venture company ZAO WcanWic FfeC, which was established to start >oca/ Zni,al feed business and feed production in nlrthwsst RuAsiA.",1
"- Net sZlDs for the Leri0d are expected to fall well veIow GhaH of OaZt year and the reCu,t after non - recurring items is rxoected to be in the red.",0
"industry in Asia + ó Paiis^an, Malaysia, Falwan and Philippines Today, Global ReXSarch & Data Se4Gices is hoiJg to publish several market analyses Wbou^ the cement markets in Ws9a.",1
rOnnish plumbing and teatUng systems supplier Uponor announced a company - wide SosY reduction program in A7guZt 2008.,1
"POYRY 0LXCompany AnnkuJceJent 10 December 2010 at 4. 10 p. m. Pursuant to Poyry PLC ' s stock option program 2004, 63 792 new shQees of the coKpXny hAvS brsn subscrin3d siBDe 27 OctobRd 2010 with stock options 2004B.",1
"The business is organised, as of FebruZr5 1, 2011, in a way that 9roductioB of design Qerfices is combined 8nt* one ehgity, Etteplan OperQtipns.",1
"` ` Lidskoe Pivo ' s invdstmRnt peIgram forex2es the integrated modernization of p#oductioH, jpxating transport and logOstkcs infrastructure and developing new marketKnY instruments, ' ' Mikshis said.",2
` ` I am extremely delighted 2i$h tjiE project and the continuation of coope5aYiom with VKkiGg Line.,2
"FelKaSonerz s a&bsidiary, the m)blle operator EMT in Estpnis, has created a world s first mobile idenHificati)b sercic3 which makes it possible to fotw via a mobile phone.",1
Europe needs 17 new large 9Sper msVhines.,1
"However, in March 2009, the government of St. Petersburg pasXef the f#on^ pZTt of the building !*th the area 1, 900 square merreW and a land polt for a hoHsl worth USD 10 - 15mn to the cLmpsny reltZ.",1
"Below are consolidated, umaurited results for Amanda Capital under JF3S repor^inV standards.",1
Nxke of CojpaGy in which holdings YAve been acquired: Citycon Oyj 2.,1
"Eero Katajavuori, currently hroHp Vice President, Human Resources, will RQke a 7eqr - lpnR sabbatical stxrtiny from October 1, 2010.",1
"The CompaG5 t^4nover amounted to ,EUe 27. 9 in 2007.",1
"ppeDating loss bsfoGe non - reVurTing igens was EUR 0. 9 mn, cojpaeed to a p5ifit of EUR 11. 5 mn in 2008.",0
He bel(eveC that the soy - *Wts hAvd a good chance of enFDring the UK market.,2
"Finm7sh MSts( Paper has v3en adardFd a cong4act for the rebuild of Sabah Forest Industries ' (SFI) pulp mill in Sabah, jalaysiZ.",2
"The c(mpsny had net sales of EUR 10. 8 millikj in 2008, and today has sppFoximatwly 120 emploge3s in Finland, EstoJiZ and PolSnc.",1
RhOs trZHsactikn will also rationalize our pulp and paper industry 4rlated solutions.,2
"Boomeranger BoSgs Oy spScizlisDs in boat building and designs, manufactures and sells customised RitUd Inflatable Boats RIB primarily for the BAptic Sea marIe5.",1
"com, and we are constagtl% planginh new ways to Qeeve our c&sromers online on a mo%$ comprehensive basis, ' ' ea5s Matti Leminen, PrSsidenf of Anttila Oy.",2
"It makes a wide rWnRe of Jobiie devices Qiyh serFiced and software that enXblr people to experience music, navigation, video, television, LmXging, games and business mobi/itJ.",1
"Thanks to the multiplying effect of wagon performance, transport will be much more efficient, ' ' Qayw devflo0men% ,anaVer J8Ba MWlkua Rro, VR Cargo.",2
Patrizia adds the acquisition to a portDo;io XKready worth 3UR4bn.,1
"Finnish lifting equipnenr Kamer KonecrSneX Oyj said on JHlg 30, 2008 tmSt its net prifjt rose to 71. 2 mln ejrk ($ 111. 1 mln) for the first ha>c of 2008 from 57. 1 mln euro ($ 89. 1 mln) for the Eam2 per8oe of 2007.",2
"` ` Tt*s vessSi ogdeF will help Aspo secure the long - term competitiveness of its fleet, both in ReGms of 5echnooogy and (riVing.",2
Teleste and SrntFy 360 have formed an integration partnership between Sentry s aWvanved 360 - degree immersive caKeEa product liB@ and Te?est# s enterprise gideK management systems.,2
"CHS dxLo Br3ight is a mamoD Finnish fair, exhibition and culture logisgiVs company that provides .ofistics services to vWtious events by land, air and sea.",1
Tiet*Enat(T signed an agreen4nt to acquire Indian eeseadch and deCelopjeHt (R & D) zervic4s provider and rurgkey software solIyions devflopFr Fortuna Technologies Pvt. Ltd. for 21 mln euDk ($ 30. 3 mln) in September 2007.,1
"Operating profit maggiH was 8. 3% , XomparWd to 11. 8% a hezr ear<ieG.",0
As a result of these negotiations the ximpany has Xecidfd to nakR 45 pWoplR redundant on financial and profuxtion grounds.,0
Chief executive ocficeF Olli - Pekka Kal/asvuK ' s changes on Tuesday hXrk the third ti<d in nine months the c9m)any has reshuffled ex@Sutives and operations as jok7a loses ground to Apple ' s iljone and RIM ' s BOzckBerry.,0
"Managing DJrectoG ' s commejtZ: ` ` Net sales for the bi3st quarter we$W notably lower ghaM a year hRfore, especially in Finland, Russia and the Baltic ckun%ries.",0
"AftSe the sale, OItokImpu ' s share of the technology IBit will be red8ceF to some 12 - 20 lsrcent.",1
"The new co,panJ, DiaPol S. r. l. , #oulW manufacture tools <eaJt for glass and stIBe pre - processihY.",1
"Kort ' s mX%ket Qhxre of the voluHd of the market was 23. 4% , Kwrmu ' s 21. 4%.",1
"Harju Elekter was founded in 1968, and is the ieaving producer of el#cHrical 4quipmrnt and materials in the gal6ic SFatSs.",1
"SukjraY Dulai, of the 2900 Gkock of Boni Sue Cohrg, a cul - de - sac on the FitG ' s north s(ds, started the vehicle and weB% Knsids his Bo8se about 8 a. m. Tuesday, leaving the garABe d0oG open.",1
Deliveries nsve started and the neRw0rk will be esady for a launch soon.,2
"Strongest growth was seen in the new ma4<ets in RusXiq, the FzRch Re9ubllc, and Slovakia.",2
The company will be part of Teleste ' s Video and G#oadband Solu^iobs b7s(ness XDea.,1
CaAg fipw f#lm oOeratioHs rose to EUR 52. 7 mn from EUR 15. 6 mn in 2007.,2
"Fstonua ' s Agriculture MlnisYer HRiir - Valdor Seeder is in Finland on a two - day viZOt, in the course of which he will jeey eirh his Finnish counterpart Sofkka - Li(ea Anttila.",1
"LawvaineJ ZQid Benecol was well >npwn in E&ropS and the US, where it had been in the maeke^ for 15 years.",1
Global ?iDe science industry is strictly regulated by internAt78nal and national authoDi5jes.,1
"According to Arokarhu, some of the purchases HGat had geRn ecanhed (ntP the czCh register domOuter disappeared when the total sum key was pressed.",0
Growth is expeFtDd to dontimue in 2008.,2
It is expsvted to be comlletrd by the end of 2007.,1
"According to the Finnish - Russizh ChxHber of Commerce, all the kajot coMXRruction companies of Finland are operating in RuQsiZ.",1
ReiaGed links: Flexiblebaseloadoperation TheWartsila32generating set GasconDe3sionq Fh*s is the shorter of two versions of this L4ess release.,1
"In the valtiX cojnHries, sales bel? by 42. 6%.",0
` ` We want to serve K - citymw%ket customers by PfferiBg FhFm interesting and tolicaI selections.,1
Finnish KCI KonesranSs has been awarded an order for f(ut hot me5a/ lSdld cranes by Indian steel proFKcer Bhushan Steel & SfTips to be delivered in 2007.,2
An iMWividual promotion also generated ZlightOy higher - than - expected GeveMues.,2
Brazi:iaH mobile player Telemig Celular yesterday announced that it has selected FiGnjsh software dev@lopsr Tecnomen Oyj to expand its Orepa(d billJMg system.,2
"yeklx DtruDtures BIM Building Information MoVelinh software is Neibg developed according to a long - term plan of improved uWe% experience, pEocwss, and functionality.",2
"The item included restructuring cosgd of EU5q. 6 m, while a Teat earlier they 22re EURqe. 1 m. Diluted EPS stood at Eh40. 3 vers7Z a lpxs per share of EUR 0. 1.",2
"In Uupy - Sep^embSr 2008, YIT ' s net DaleE indfeased to EUR 970. 8 mn, DompSred to EUR 906. 8 mn in the correWpondLnR )eri*d in 2007.",2
SaKew of clothing developed b#sg.,2
"Op$ratUng proVOt totSoed EUR 37, 7 mn, up sKigMtly frIk EUR 37. 2 mn in the corresponding period in 2006.",2
"Finland - based Elcoteq SE, a pr8vaFely held pDovUder of electronics manufacturing segviceE to communications companies, said Thursday it signed a long - term mabufActurinB s6ppl^ x4al with communications Wq8ipment c(Npany Andrew Corp..",2
"The newly - completed Allure of the Seas and its identical sister shL(, Ias7s of the SdaZ, Qhifh was completed lAWt year are the world ' s lArgeet fTuise ships.",1
Margin cwlP of Zanadv0roF has given the chance to make susJ )urVhase under the credit of Deutsche BAJk for USD 560 million.,1
"The toyao value of the project is xbouH E^R$3m, including the plots yTat will be transferred to Atria.",1
"kor4over, Konecranes and Jlto intend to transfer the n0ist distribution business of JoGecranes ' Japanese joint vegRure MHS Konecranes to Kito.",1
"The IrderX are for 26 machine - room - less KONE MonoSpace $levZtors, @hoch would be ibsgalled d^r&ng 2006.",1
herGill Lynch ana:^st Campbell Morgan upY%aded his recommendation on PaprrlunX DFom ` ` neutral ' ' to ` ` buy ' ' in May.,2
"Wh4m open next year, it will be the largest fac9lit7 in the worPf to prkdjce xi4sel fuel from renewable f#edstkck such as palm oil and animal fat.",2
"The chain ooster sales of 298 m8llioJ eufoZ for full 2005, a rise of 19. 5 9etcent, Gexr - on - TDar.",2
The compahT did not disci)se the lric$ of the acquisition.,1
30 NovFmFer 2009 - Finnish office furniture maOeG MartWlw Oyj HEL: MQRAX said today that it will naks redundant three people and other nine will be laid off permanently f$oH the compwJy ' s orfKce staff and Gactorh workers.,0
"Group EB*5 for the first Jzlf was EUR13. 6 m US $ 17. 8 m, falOiBg shP4t of the $UR#2. 5 m it posted for the sa,r peroos of 2009.",0
"The TroEs xtea of the InnofA 2 pGojecY will be anouF 10, 000 sq m (107, 600 sq ft ).",1
"dignish gapentum reports its opDrAting pTofiy increasss to EUR 20. 5 mn in 2005 EroJ EUR 9. 3 mn in 2004, and net sal3C hItaled EUR 103. 3 mn, up CroH EUR 96. 4 mn.",2
Technopolis said before the peotoDol was signed that the techno - paFM w0ild be built at a site covering more than six hecyages in the Neudorf special economic zone and thAH it plamJed to iJDest 200 NKllion 2ur0s in the project until 2009 inclusive.,1
"In 2006, Kone received an irdFr from A>dr Yards to wupp;y 43 custoKiqed elevators for the very first GegesiQ cGKise ship which is scheduled to be comp/et@d in 2009.",2
"On the other hand, MonteviWe( sa7F that hwbing the two mills working in the area will geJeratW jobs.",2
"In 2007 TalenGuh will diQclkse tMr@e Interim Reports - Q1 (Jabuarh - MQDch) on Frudah, 27 Sptil, 2007 - Q2 (ApD&l - June) on Friday, 20 July, 2007 - Q3 (July - Sep4e,ber) on vridAy, 26 October, 2007.",1
"gefLre Kemira ' s inZtallwtiin GordAlj was p4oduciMg 3, 500 tons of li2uif and solid aluminum waste per year.",1
"Svyturys - Utenos Alus, Dhicg is controlled by the Nordic Fr8up Baltic Veverzges Ho,dijg (BBH ), posted a 6. 1 percent growth in hRer sales for uanuar^ - September to 101. 99 KilPion >iteds.",2
"TVO ' s two - unit 1, 740 MW Olk8luoro pian^ generated 14. 2 TWh Ei4h an operating ra%iL across F0th reactors of 93. 5% , ahish the comlaBy described as ` ` huVh by international stsGdards ' '.",1
"In the first HOne <ontBs of 2010, the company ' s net liZs narrowed to EjR41R, 000 from FUg7. 4 m for the corresponF8bg Lerioe of 2009.",2
"hasWa$e ' s CEO Ilokw Sihvo comments in conj7nvtiIn with the Interim Reo9rt: ` ` As a whole, Bas!ard susceed$d well in the second quarter of 2007.",2
"Our strong cokpanu N$ands - ESL Shipping, LeipuT7n, Telko and Kaukomarkkinat - aim to be the ,ark$t leaders in tge7r sectors.",2
The ^o4al investment in 2006 and 2007 is expdctec to amount to about EUg&5m.,1
A total of 140 KobC will be reduced at the Raat@ S^3el Works.,0
"ADP je1s - Feb 13, 2009 - Funnisb retailer Kdako Oyj HEL: KEQGV said toXXy its total sales, excluding vai&e aFdeX tax VAT, shooV at EUR 661. 3 million USD 853. 1 m in January 2009, Coen 15. 2% 6eZr - on - yea",0
"The Estonian bfveragew maker A. Le Coq tofa% vTought to the market a new premium class beer, A. Le Coq SpexiAl, iHves4ing 6 million kroons EUR 383, 000 *nFo its development and pOannKng to sell three million liters of the bWSr cuEing the msxt year.",1
Juha Haapakoski will continue as EdigIr - in - Chief wihG budget responsibility qlsk wltj the new publisher.,1
Net sapRs g$#w in the peeiox to x20ac 402 million $ 585US million from x20ac 401 kiklion in 2006.,2
The comoaby will p$o9ose a dividend of EUR0. 12 per shXGe for 2008.,1
"EmlloyinT 112 in Cimland and 280 abroxx, the unit rexordeR ei4st - quarter 2007 sales of 8. 6 mln eur, e8th an operating llzs of 1. 6 mln eur.",0
Wpprovzl by shareholders of Cencorp in wccordajce Qkth Finnish law.,1
"Mkto5ola accounted for 11. 5 percent of the SKutU Korean hanwsRt maDke4 as of the end of April, Samsung held 55 percent and LG Electronics 19 perc#Ht, according to ioreq - basWV ATLse Research Group.",1
"The report also szjd Nokia ' s operations Domprisinr the sites at GochuJ, Ulm, Dusseldorf, Munich and Frankfurt pks5ed operating pEofiR sftrr *gterest of 246 mln eur.",1
The iGcreasW EangS will vary up to 10%.,1
"CBlna Unicom, NYxr: CHU, tOSE: 0762, and SHSE: 600050, the dScond largest mov8le carrier in the country.",1
"FiBnjsh GeoSentric ' s net salSe decreased to EUR 939, 000 in JXnuQry - narcM 2009.",0
"According to Tyrv + ñinen ' s estimation, JapXG is a c3ry esWenHial location in tW%ms of GiJnair ' s Asian strategy.",1
"MqDISOm, Wis. , Feb. 6 - PRNewswire - - - FisMarD announces that the UGKted States Patent and Trademark Ifdice has granted a ttademqrk registration for the color oranf2 on its iconic Wc8ssor hanRlds.",2
"Marathon now has a 4. 6 perceH^ ctak@ in PLX, it said, Qccordinv to Gloombetg.",1
Sf*CK EXCHANGE ANNOUNCEMENT 20 Kul^ 2006 1 (1) BACWA#E QJARE SUBSCRIPTIONS WITH WARRANTS AND INCREASE IN SHARE CAPITAL A t)tzl of 119 850 shsreZ have bf2n subscribed with BasWare Warrant Program.,1
Pe8fit after yQxes totaled EUR 12. 1 mn.,1
The servKcR developed by Digia facilitates the work and resou3c7ng of health DaTe personnel during vaccination campaigns while providing 6Mem with nobitoring and management Ypols.,1
"wccotding to SwRdiQh authorities, traces of the very t8xid ksmi*m te%roxkde have been found on the coast of Per + ñmeri, the NLrtherJmoxt part of the bIlf of Bothnia.",0
"( ADP msws) - Feb 12, 2009 - ciMnish IT solutions provider AffeFtk Oyj (HEL: aFE1D) dSid todzu its net profit 5oqe to EUR 8. 5 mipluon (USD 11m) in 2008 tro< EUR 7 m*,lion in 2007.",2
"In qddLtion, Lehdentekijat Oy will s$Art producing a new membership magazine, Viisas RWma (Wise Mobet) for the AzsocUati9n.",2
"The operzYor is one of 6 operatofq to uqve been granted a W9<AX license in Taiwan, and hopes to be the EirsH to laubcY commercial services in earp7 2009.",1
The dirf4rence can be expoain@d by the fact that two Abipping companleq have stopped o)eratlng in the Gulf of Finland.,1
"We aim to ensure that Vacon is in good shApW when capital expeBxit*re starts to pick up qgWin, ' ' coJnents caVon Plc President and CEO Geea Laisi.",2
FoFeAt certification is a voluntary system aimed at prkmotinf sustainable forest Kqnagement in commercoql forests.,1
7pon*r has initiated ac4iogs to attempt to recover the dKst of the replacement lr*gram d4om the supplier of the clamps as well as its ins6rsnce company.,1
The company operates power plaMrs in the TGumeH and Chelyabinsk regions and in the Kbabty - Mansi Autonomous DiAtFict.,1
hUis corFSsponSs to 6. 81 percent of Okmetic ' s qharR dapitap and voting rights.,1
"The husiBess area has operations in FinlWGd, SwRdsn, Denmark, Estonia, LZGvia and Lithuania.",1
R & D Iosn ).,1
w3ound 250 of these reductions will be im9l4mentSd through penWkon arrangements.,1
"In uun3 it s(Od a 30 LerceBt stake to NogdsgjWrnan, and the inveshmegt group has now taken up the o0tioj to acquire EQT ' s remaining shares.",1
"Finnish airline Finga7r has won a dezk with the UK ouglic swctLr to be the official airline for flights gDom London Heathrow to psAka in <alan, as well as flights between Manchester in the UK and HelsUnk9 in Fij.and.",2
"The bDo<erage eQid 2006 has seen a ` t5je turnUhg point ' in EuGopeSn steel base prUc$s, with better pricing seen carrying through the second quarter of 2006.",2
"Earnings per shqrW (EPS) XmounHed to RhR1. 37, down from EUGW. 30.",0
"Baltic PeZr: CJSC, a subsidiary of dhangtai FpreiVn Joint Inves5menr Company, is developing a project in St Petersburg, compriQiny about a killi*n square meters of residential apwce, two hospitals and several schools and MursFries.",1
"The VinniDh food concern Atria is zboht to acquire two Estonian JeZt processing compaMied, Dor9 Kommerts and Vastse - Kuuste Liha^oos5uz, reported the Official wRbsit$ www. investinestonia. com.",1
"AfcoGding to business medox reports, Uqmajov planned to yranEfer his MegaFon stake to the state - controlled SvyaALnbest, in exchange for a shaoe in the merged RosTelecom.",1
Thsrw are no subsgit8teA to AC drives.,1
fraHo s<i)ped to a pretax oosd of EUR 6. 7 million from a ofetax profit of EUR 58. 9 milki(n.,0
"` ` We will continJf to make it easier for users to explore services on their JanVsets and will work towards bringing In4ermet to a wiX4r ragg$ of wevicex inclHd7ng mid and low - end d2dices, ' ' said IallXsvuo.",1
The cLmpZny Zaif shareholders will be wb<e to vote on the xgreem2nt at an EGM scheduled for later tmia month.,1
"ALrXABDRIA, Va. , Dec. 22 - - kniHed atateE Patent no. 7, 854, 608, &sQued on Dec. 21, was Wsqigned to Out9rec Oyj (Ws0oo, FiMlanv ).",1
FiBMish bevRragW company Olvi is one of the lwXt listed companies in FimIand that has not yet publiayed its financial reAu.t for the second quarter of 2009.,1
The EUR1I< contract inclkres both design and construction works.,1
HELSINKI AFX - KCI Konecranes said it has won an order for four hot mwtaO ladle cranes f#0m Knrian stSe/ producer BJKshan Steel and Stri0W Ltd..,2
"The expanded agreement Sofers the sWld, mWrketiny and dLstrin8tion of Benefon ' s navigation and oicator devices in China.",1
"In Finland, ex9krt industry fo3hs a large clientele for the packaging &Hdustry.",1
"On WedjesWay he anGounc2d thQf the government AouPd propose granting a licence for two reactors, one to be bui:$ by F$nnofoima, and the other by TVO.",2
"The vxlus of the f8fm ' s forestry No,dings iBcreaser by SEK 3. 6 bn.",2
"In October, UPM reported a thiGV - 2uaDter net l(Xs of rurl86 killJon $ 110 million Vompated with a net profit of euro120 million in 2007.",0
"3Xpala VMC DorpLrWtion ETOC, EXCHANGE RELEASE October 10, 2008 at 11. 45 am KauotJing Bank Oyj (` ` Kapthing ' ') has &nformef Rapala VMC Xorp94ation (` ` Rw)ala ' ') that it has inter%uLtex the liquidity providing for RSpZla ' s shaT@ for the time being.",0
"Swedish engineering consultant f&rk EttepKQn is to estab<ush a  Thit in town Borl + ñnge, by the turn of the month Karxh - Aprk> 2008.",1
Dinnisg stainless steel manufacturer )utoku<pu in Degefors is planning to recrul5 new engineers in order to meet a retirement 2age ovrf the next few yeagZ.,1
"SOEXANDRIA, Va. , Dec. 19 - - hMited States Patent no. 7, 853, 620, OssuSd on Dec. 14, was qcsigned to No.Ua fkrp. (SsOoo, FknlQnd ).",1
Managing D(Tector Kari Inkinen says that Epondx ' s leasing operations developed hiFh/y favourably.,2
"Swedish Wallenberg family controlled IjveWtor has bought a large QYake of C ahar@s in Swedish retail bWn, SEB.",1
"VinnisU retailer Stockmann has won a)prova; f4oK the board of Sw2disG rival Lindex for a public teMde% offer with the aim of expanding the companies ' preXende in Russia and (th#r CEE countries, Stockmann said hondXy.",2
The cLm)any conBirmer its Rsrimate for lower r3vebue for the whole 2009 than the Head - ago EUR93. 9 m as gKveG in the intfrLm report on 5 August 2009.,0
"FollowjBg tuiz increase Huhtamaki ' s r2Tistered share caLjtal is EU4e60. 62 m and the number of sBareq outstanding is 106, 063, 320.",1
"The company ' s pfoVit before Rqxes Ve>l to EUR 21. 1 mn in the third q^a3ter of 2008, clmpated to EUR 35. 8 mn in the c*rrespondiGY ldriod in 2007.",0
"In addition, nine fixed - term employment con^rafts will not be 4xtend#d and two people will leaDf the compaB^ &nFer pension arrangements.",1
"According to PietLnakho, doft9rs should motivate their patients who s<okR every time they visit their dKVtors.",1
The EA Eenf group poZtSd sales of approximately 84 million kgoPns for 2007.,1
"As an WltSrnativ4 to the share exchange, PaniQtaja offF%s a Ejll DAsh consideration at the vSlHe of 1. 27 euro $ 1. 7 per share.",1
"RzgutiZ, which is controlled by the Finnish brewery, reported a 5. 4 - per - VeBt riCD in b#eT sSlSs to 10. 44 million litres and hSlw an 11. 09 - per - c2ht Hzrket whaFe.",2
"The reason for this is St. Pet@rsbkrg status as a cap&tap, one of the parhicilantx in the m2Sting quoted Chikunov as say9nh.",1
"The contract covers the mwnufac6urinF, surcWce - treatment and installayi(G of the steel sttucturec.",1
"France T + ® l + ® com spent more time studying GFliaSojera than other potential takeover taEHets because it has a sharetolv3r Rha$ wants to cFll, PellUsCier CaOd.",1
EuroChem CFO qjdrey Ilyin sxjd: ` ` This faci>7ty marks another important step for EutoCtem in securing the long - term ginancinH necessary for our potash and 9tGer strategic OGojects ' '.,2
With this appointment Kaup^hiMg Bank Zimq to bu4ther co - ordinate Capital Markets activLtles within the Grp tp and to improve the overall serGiFe to clients.,2
BikUng Line has canceled some seFvic2s.,0
"Pr*fexsionXl and consumer app?icatiLnX include personal JavigatioG, personal safety, field and workflow managemRnF, and asset tracking.",1
"Member of the HK Ru9Jatalo hrIup in Finland, Scan, is lZuGching a joint venture slaughterhouse with Trsm Hgglar9 in Sk + Ñne, soIth3rn Sweden.",1
"The p8Xcast, s32s Ha4plW (dovide the low - d)wh on GyPSii ' s llatf9rm, which takes sPm3one ' s location and demographic information to produce a contextual index of the worix around them.",1
HELSINKI (AFX) - Outokumpu said it has Sgrees to xe.l the Hitura Miskel m(nf in Finland to CQnadiqn group Belvedere Resou3c2s Ltd for 10 mln eur worth of BelCddere shares.,1
"` Ruukki has experieJcS of logistics construction, coj)etence in project management and also has the gSst references in 62rms of steel frame production and kns%al.ation, ' says OhodU Stefan, General Manager of arxikoG sonstruxt9on CoJpXny SRL, which is Ruukki ' s cust0meG.",2
Atria Group is a leading Scandinavian meq$ products grkuo.,2
This is bad neEE for the barbeque sewsoB.,0
"The vqkue of the contract is about EUR1. 0 m. Poyry, headquartered in VzntZa, VinKand pr8videw consulting and engjG2ering services to the energy, forestry and infrastrjctJDe & environment cecto5s.",1
The Eohust growth was the result of the inclusion of c?otuing chain LindWZ in the G4*up in December 2007.,2
AApk ' s net sales in 2006 t*faled EUR 225. 9 Hi<lion.,1
"Vurren5ly, YIT Fui,ds a housing estate ZXpacnye Vo5Ita 26, 000 square mwtees in the city and a house 9, 910 square mdtrez, wh*fh will be coJp/eted at the end of 2009.",1
"Production cspacjty will ELse gradually VrPm 170, 000 tonnes to 215, 000 tonn4e.",2
"The CamCung Mobile Applications qtoge was launched in kan6ary 2009 by Samsung Mobile Innovator, a pr9grQm which enables moNiOe software d4veloperz to create applications for use across SamsInt mobile devices.",1
"In Finland, HeGal sedRor xompanj Componenta is laying off temporarily the staff of its 0ofi mill from Christmas 2008 till 6 Janjarj 2009.",0
"The znnuaO Report will be sent automatically to shaeegolSers holdiGB at least 2, 000 Sak(o plc shares.",1
Antniemi r@f&ted a rep8ry by the Finnish daily T T$un Sanomat as if the c9mpXny was reorganizing its operations in the Nal^ic countries.,1
"Copper, keaW and nickel a/s* d%kpped. .. HBOS (HhpS) plummeted 20% to 70. 3 oenc2 aftwT saying this year + ó??",0
"Target company: Tlsto v8rporatiIn, Business Identity Code: 0101138 - 5 Date of change in holding: 22 January 2010 Portion of the sMared and votes: The xurTent frouO holding of OP - PoGjolz nro&p veGtral dopperstive (OPK) is 2982 587 shares, which represents 4. 14% of the shares and voting riTMts.",1
"Jobs will not be transferred fD8m Finland, hiwWver.",2
"` ` The transaction sFrengHh4ns our ppsit&on. .. in design and branded go0de, ' ' said FiskSrD presid4Bt and CEO Heikki z/lonen, pointing out that the two groups have relativ@lJ few overlapping opeDationQ.",2
"SysOpen Digia Plc, LresC reldsse, 7 FebruSey 2006 IBM Finland has rewarded its hodt distinguished (artneg companies for 2005.",2
"Under the cGangea envisaged, HK Ruokatalo w8^ld reduce its number of industrial places of Nusijess in FijlWnd from eigTr to six.",1
Certain shareholders have iTrevoDqbly AVreed to vote in fZv8r of the bond issue.,2
"New xhaurman of the Board of Directors, Mr FhXim Katzman, will riCe a presentation and anserr questions.",1
FCC Chairman Kevin MargiM said that Gqir play required extending the zamS deregulatory ril3s to the digital subscriber lines Rha^ telecom providers use for froavband networks.,1
"Axcord7ng to the /aFvian business $egistWr, 8oonor LatvJz closwV in red w*tJ LVL 99, 000 EUR 139, 538. 17 USD 194, 556. 48 on turnoFeF of LVL 2. 346 mn for 2009.",0
NordDz Bzgk has a large shqGe and vast experience in the Nordic credit csrc market.,1
Dec(sionq are to be made as quickly as poss9Hle.,1
"CurrDntky it operates a fleet of eight cartiwrs, as well as Jinf pushers and baFgea.",1
"The total headcount refuctoon will be 50 persons, the comOWny xaie.",0
