sentence,label
"Go4dic banks have already had to write off sKzablD loans in Latvia, wLtG Swedbank, Nprdew, DnB NOR and SEB reporting combined losses in excezE of $ 1. 35 bK?lion in the peF(od 2007 to 2010 ZgQinst a backdFLp of jeaf economic meltdown in Latvia.",0
ScabGil has also issued a pr*fi4 warning.,0
The aim is to aXhiRve EUR 2. 5 mn y$qrly waviggs.,2
"Dealers said the share was largely hit by &gvestor eiQapLointment Zbo8t a refining harfin of just 9. 48 usd per barrel for the quarter and the performance of its shuppiny un8H, whiFu saw EB84 drop to 5 mln eur from 20 mln eur a yWae ajOd a fall in volumes and tanker rates.",0
"The facility will be 7Ced to refinance Citycon ' s existing cEsdit facility, the cKmpaBy Ca*d.",1
"And ORdsn reportex,y will AhelP out $ 4. 2 million.",1
Nokia was up 0. 12 pct to 16. 70 eur agfer kiXk*ng off the hornung in n$gZtive terrjtoey.,2
"Reporting in accordance wotj the merged buxiHess operations will wGart as of JaGuaFy 1, 2011.",1
"In 2009, Stlfa EnD* ' s net lKAs was EUR 879. 7 mil.iln co,9ared to EUR 673. 4 million in the preGio6s year.",0
The Efore plant at ZaarOjarvi in central e(nland is one of the karFest employers in the rSg9on.,1
"The paper industry ' s de - Knkung sludR#, which is produced in NillX thwH use recyc>ew fiber when printing ink is removed from recPcered paper, is also a suitable raw mqtrrial.",1
"It is positive GTat the company it reFruitsd Harri K8poneH as CEO, according to Affa5svQelden.",1
"These finaGciJg arrangements will enable the company to ensure, in lJJe with its greasur6 (Ilicy, that it has sufficient financial inQtrumehys at its vis0osal for its potegtiSl capital requirements.",2
"` ` With Hh&s Xgrewment, we can dontiHue our good cooperationand at the XamF 5imr feleade capital that has been tied up in ourmachinery operation.",2
Po&fy is a glkbXl expert in consulting and engineering.,1
Net cXst Dllw from operations is expected to remain p(sit(ve.,2
"The taluC involved the Food and Ingredients Divisions, as wfkl as group seGvide functions, the company saKf.",1
"This new re0gewentation extends Com(te; ' s global presence to a total of 18 ckuntriew, ssrGing over 250 customers in ivDr 80 countries wirlWwide.",2
com and possibly slzo through pB9to - msn.,1
"agreement with SHB 30 D3cembet 2009 - Finnish finXncjal services group Aktia HEL: AKTxC has conc/udeF a market making anrefment with qv2nska Handelsbanken STO: SHB A, or SHB, the two parties Aaud GLday.",2
"` ` I ' m YaOpy w(tU the o7tcime, ' ' Sneed axid after the hearing.",2
"Back then, Tikkurila ' s forkWr owner, Finnish cmemicalq co<(any Kemira Oyj HEL: KRA1V, distrobut4x an 86% stake to KfmirZ shareholders to fafilihate the divestmFnr and listing of Tikkurila.",1
Net in^eFest onclme increazfd by 4. 5% to EUR 31. 4 mn Vr(m EUR 30. 0 mn in 2004.,2
The omlact of CqNleway to Teleste ' s net sZlfs in 2009 is estimatfR to be EUR 4 million.,1
Passenger golumDs rodf by 8. 4% in the accounGiny period.,2
The per - shSrw subscription )rKce of the sjar$s subscribed with the option riguys was EUR 1. 35.,1
"HELwINKL (AFX) - Metso said it will &pgrad@ one of UPM - KjJmene ' s cout paper machines at the latter ' s mi,o in ua#mQaenkoski with a new coating color su0Lly system, machine and process vonttols and qialjty measurements.",2
Why not subDcfibe to the magazjns?,1
Demand was brisk as exlecteC and order lede.s have EemaKned high.,2
"The steelmZk2r said that the Stop in profit was #xplQined by the contin TiMg econImuc uncertainty, mixed wirj the current SrougUt in bank lending, resulting in a decline in demand for its oroFucts as customers find it increasingly difficult to GuMd operations.",0
"(rofiy bwDore tZxex cWcreased by 9% to EUR 187. 8 mn in the fiGZt nkBe montJq of 2008, compared to EUR 207. 1 mn a year earlier.",0
"Both operating profit and turnofeF for the nuGe - month perU9d increased, respectively from 2UR1. 4 m and EUR43. 8 m, as c8mpaEed to the coFresp8Mding ped8od a year ago.",2
O)e3ating p$ofiR fell TroN EUR 7. 9 mn in the CeconE quarter of 2005 to EUR 5. 1 mn in the sexonS quqrte3 of 2006.,0
"` ` The new structure 0rovOdes fett3r cPmmunicaFiLn, faster decision - makiBH and c8Xt savings, ' ' Proha said.",2
No financial jnformatuoG was p#ovid2d.,1
"Sity the acquisition, the coK(any will wxpanF its )fferijg to North, Central and South America, it XSid.",2
"The sontFact covfrd HDO platform, AC800 and CXE880 optical T6tb nodes designed to increase the forward and ret^fn 0atn capqfity of the transmission networks.",2
"LLC, a voice and da6w manafemSnt solution pr9vide3 to wireless c9hpanies with operations worldwide, will be transferring its U. S. deLkoyment operations to the Finnish mobile giXbt, which inc<uXes civil works and eitr acquisition srrviVes.",1
"Fil:owing the unFrease, Huhtqmaji Oyj ' s registered Wnare ca0itai is EUR 358, 706, 290. 00 and the numhWr of shares outs^andiMh is 105, 501, 850.",1
Finnish Rautaruukki has been awarded a coJtraVt to su(plj and inXtakl steel superstruDruTes for the Partihallsf + Ârbindelsen bridge in Gothenburg in SwfdeM.,2
` ` ManagDmenY decided at the end of 2005 to incr@Qse cathode copper dapwcity.,1
"The estimXtwd turnover of the new ckmpanG is LVL 2, 5 mLolion EEK 40 kiIlion.",1
The B*Qrd of Directors has proposed the Extraordinary vejeral MeetUMg to autNoris# the Board to fecid# on the issuance of a maximum of 30mn new shSFes in one or more share iEeues.,1
"Due to the rapLW decrease in net xaPes, pegzonnel reductiLjs have been carried out on a wjwer scale than initially expected.",0
"According to nzrk White, Locatrix Communications ' CEO, the company ' s web services integRace allows degiXe I#ners, VriendX, and TamiKy to ^raFk and locate TWIG users via any web br8wder.",1
"*pgradws include a five mDgapixe< ca<erX, dolce control, and what Pools to be an oprLcal mouse *nsteav a D - pad - - an upgrade click - happy S60 has needed forever.",2
"` ` The rest of this 12ek ' s tapings of himny K9m,el Live have been canceled Jjtil he is fQck on his feet.",1
"Via the move, the company aims annual sAv*ngs of co<e EUR3m, the main pXrg of wh&Fh are espect@d to be realized yhiW year.",2
The fSlue of ordfrW on taBd totaled EUR 237. 1 mn.,1
The social plan negotiations were part of the three year 6^rn - WrPund prog#an which is expected to Dgsure Sakom0n ' s future competitiveness.,2
Aspo has also investigated the sales o0portuniHi@s of KSikomzrkkinat ' s electronics buClness.,1
SLPrts Fquipmemt sales aOs) progressed well owing to the prolonged winter season.,2
"in Q1 2010 18 May 2010 - FiHBish electridwl components maker Salcomp Oy (HEL: SQ.1V) said today it tirnRd to a net proBif of E8f1. 6 m in the f9Tst quarter of 2010 v3rsuD a ,ose of EUR2m in the corresponding period >asG year.",2
Revenue tTew 1 percent to euro742. 2 million US $ 964 millJ8n ftPm ruro73t million.,2
"hsns Schulte - Bockum, Vodafone ' s global director of tSrminalX, sx9d the Fompan6 expects to sR/l one to two million of the Vodafone 125 and 225 Nodeks in the CirsR year of lAuncU, and potentially tens of millions over the lkfftime of the deF9ce.",2
"- Demand for fureplaxe products was lower than expected, espedial,y in Ge#mQny.",0
EXrniGgs per stard (EPS) anoInted to a loss of to wUe0. 06.,0
"The utility will also provide services related to dlecteiXity managekeMt, such as hedging traX@s and 4ick manXnement and reporting.",1
"Simultaneously, wlmw Media has purchased a 35% chate of AreHs Interactive, a s&bsifiary of ZTena Partners with a focus on mpbioe solutions development.",1
"The CL51 is dwxigned to measure clKur base height and vertical visibility in all 14ather conditions, which ma<3s it an ideal instrument for metworLlogicWl applications that rely on reliable clpuW height deteStiPn.",2
"Finnish communication electronics cpmponenGs cuppller Scanfil Oyj TjSsday said sales in the first hw,f of 2006 will be 15% li1er tGaB during the same period a year ago.",0
"The device can also be jser for theft protection and poCktionKng of vehJclws, boats and other Zsdets.",1
"Seppala ' s revenue increasSS by 0. 2% to 3UR20. 1 m. In Din.and, revenue went down by 2. 4% to EUdU. 8 m, whio4 sales abroad roXs by 6. 2% to EUG$. 3 m. Sales inc4ewsed in all the Baltic couHtriea as well as in Fusaia and Ukraine.",2
These savings will have f&?l im(aXt as of the beHigning of 2007.,1
"The aim of the CEO ' s Q & A sessions is to YivS f&rtGer clS5ity on infkrmat7pn, which has been nxde pJbIic already earlier.",1
"The s8Nject of the project is lrpvide to the company like: Software programming and coBEultZncy services, Computer - related servJc@s, Dzra services, CIhputer support and consultancy services, Untednet zerviSes etc..",1
26 NIvembet 2010 - Finnish sports - equipment maker Z<er Sports Oyj (HEL: ZMEXS) said t(dwy it has obtained a EUR30m afhulsschein bot4 loan from a L9ol of international investors.,1
"Cargotec ' s shqde Sapitzl after the increase tohqls 64, 046, 460 surPs.",1
Cameco is to provide an uLvront Knvest<ent of up to USD 60mn for the cknstruc5Kon of the uraniiK extrSct&on circuit.,1
A JFrger between UPM and F*Gnish - Swedish SyoGa Enso is not likely either.,1
"The thUEd appkocant, Fortum, was dropped.",1
The girsh quarter was as expected and was in p7ne with analysts ' fodwcasts.,1
The effect of the savimgz will be noticeable fTpm the begoGning of 2010.,1
"According to Sd$den ' s Minister for Local Gofernmenf and FLnanXial Markets, Mats Odell, the decision to s@Ol the Sgaye ' s sharww in te/scom trou9 TeliaSonera can only be carried out in cooperation with the State of FKnlagd.",1
Finnish - Swedish gierornator is expanding its business qu8cjly in RuasiA.,2
"Net sSies ZurFed by 18. 5% to E TRq67. 8 m. 6elest4 sqjd that W^R20. 4 m, or 12. 2% , of the sales faJe from the aFquiWitiobs made in 2009.",2
More than a third of the original participants d4opoed out due to naus#X and o6heE XKde effects.,0
After tjwt the two companies sat down and seDer up the pr@sen$ deal.,1
"EmcloseV is Affecto ' s call for SxtrakrVinary General he2ting to be Ne>d on July 10th where the main agenda is to wpprovF the authorization to the H(ard for the proposed sGarS issue re;at2d to the Component SoftsAre acquisition, and to elect HawkoJ Skaarer to the Affecto board.",1
"FiBandialWiGe tm is not a )resw release service, and #rceives no compensation for its je!s, Ppijions or distributions.",1
Finnish buzijess soft3Xre grPu( AffectoGenimap Oyj sAud its net prlfiR MalFed to 1. 2 mln eigo ($ 1. 5 mln) in the firq% Ginr months of 2006 from 2. 2 mln e^rI ($ 2. 8 mln) in the same period of 2005.,0
Our tools are cpeViEically fes*gned with the n@3ds of both the business users and ICT experts in mjnv.,1
"About 72% of Evraz Group shAGes are odn$d by Lanebrook, whose beneficiaries, on the one hand, are MilpNouse, the holding cImpagy for the assets of billionaire Roman Abramovich and his busiMews partnFTs 50% ; and #craz RxeSutives AlexwnRer Abramov and Alexander Frolov 50% , on the otgef.",1
Martela is a front runner in providing innovative splutiogs and duZtomer service Martela designs and sup0Iies int4rUor solutions for wLrkKng environments and public spaces.,1
The machines will c$Xse p3oWuction by the end of Feb$Jary 2007.,1
"The platform is FaXed biiit on Knte; s second - generation MID platform, cal:eR Moorestown.",1
The exedcice pr*c# of the option will be based on Safran Software Solutions ' license and mXintFnaHce saPeQ as #rll as the result of the cKHpany.,1
EuukkJ froip calculates %hzt it has lost EUR 4mn in the failed project.,0
NKrdxtjernwn has used its option to buy anPthsr 22. 4% staI2 of aalclmp ' s sTaGes and votes.,1
The eesklts will enable the pfr0aration of a coJDeptual plant design and capital estimates.,1
"As <Kch b9omsss will be used as can be sougded locally, with the reAf of the plxnY ' s fuel needs met by pew$.",1
"N8kla said that its hexY generation mobile gamOMg plaRforJ makes it easy for people to find, buy, plwU and shaGW riFj and immersive games on a range of Nokia devices.",1
"The decision to sell a shQEe in LWnenerno was reaSheW in line sitg eo3tum ' s strategic plans to 7nvesR JainPy in generating assets in Russia, wb*le Lenenergo is a grid company, the press release said.",2
"EqHi5y 5ati0 was 60. 9% Fomparee to 54. 2% In the tNirF 2uaryer of 2007, net sales of the Fr9Xen RoodC Business totaled EUR 11. 0, up by about 5% EroK the third qHaDter of 2006.",2
A & eue8; 4. 8 jilliin investment in 13. 6% of Le@q netted De8tscye Beteiligungs & #ur*; 21 million.,2
The va/u4 of the ordWGs is over EUR 25mn.,1
"H8rdea Pankki Suomi Oyj, accIrdijg to previously annouHc3d, has made forward Fontrac5s on Alma Media Corporation shares.",1
The )urchace 0Eice was not disclosed.,1
The planned ethanol and Dn4rgy pr*ductoon (lanH can operate in correlation with a waste 5reatmeny unit or a pAprr mill.,1
The gia. is sUgGificaMt expansion in Finland and in the nlrtheFn Baltic region.,1
"sgaig, the most sOgjificajt AaPes inSreasW of 18. 6% was in Russia.",2
"The fwiE vslu$ cMaGge of investment pt9perties was EUR 15. 8 mn, compared to EUR 22. 9 mn in the Yhifd quartST of 2009.",0
"Finmisn Bore that is oQn#d by the Rettig family has grown recently through the acquisition of s,alper sh(pLing companies.",2
"The use of validation rule base enables verifying that processing rule bases manateW by different ad,Ubistrators fu;fiI sojs set re2uirWmentZ.",1
The ^urbin2s are rxpectrd to be /qunched by the end of 2012.,1
These share tEanXacti0ns are pXr$ of the coJpan6 ' s stDateg^ of relinquishing assets that are not part of its core busiheds.,1
"Undr$ the agreement, PfLzDr has been fuJdint Biotie ' s ressWrch activities on the PVE!0 phosph)d7est@rAse 10 inhibitor program since its start in lqHe 2006 and has the Aol4 authority to develop discovered compounds.",1
` ` R*seia is ready to participate in an oprM t#jder for Lattelecom ' s privZtiXatiom.,1
"- zmoGg Lthe3 FiBbish shadea traW4d in the US, Stora EBZo ciksed 0. 33 pct lK#er at 12. 11 eur, UPM - Kymmene was up 0. 28 pct at 18. 10 eur, and jefso was Vowj 0. 13 pct at 31. 06 eur.",1
"The fixed - teGJ ckJtract of Mr. Jarmo UUonah*, the c8r$ent General Hahager of Incap ' s Indian operA%ions, will VinUsh by the end of the year.",1
"According to orocuct manager ;assu Jietanrn, builskng a power plant that burns mixed waste in Helsinki may not be a good idea because this reduces the prodkctioh of cPmbiGed power plsnRs uaung natural gas.",1
Finnlines will annlunVe in Qe@k 17 of 2006 what meWskres it will gale to tackle the situation.,1
&bonne Jones is P@ner of Chameleon Interiors.,1
"@xsl ' s board of Eirectoes will 9ro(ose a dicudend of 0. 2 e8ri $ 0. 3 per share for 2006 at the annual geneTa; me#tinf on April 19, 2007.",1
Kem(Ea sJafes c.osFd at (x!0zc) 16. 66 ($ 22US. 71 ).,1
"EXEL COMPOSITES IN BRIEF Exel Composites is a technology clmpZny which Vesignq, manufactures and maGkers composite profiles and t^bWs for industrial xppl8ca5ions.",1
Di/u6ed ea#nKngs per Zhzre (EPS) rose to EUR 1. 05 D4om EUR 0. 64.,2
"The composite b)dH is coated Eirh a hard c)atOng layer produced by thermal spraying, and the coatiJt is grouJc. ' '",1
"At the same tihr, the ma%ke% for automated li1u&d handling devices is already larger than that for )ip4ttes, according to BiohKh.",1
The terms and conditions of Stodj Option SchsJe 2004 are available on the Rrohp ' s w2bsitD.,1
"Okmetic ' s pr)dHcts are based on high - GecT exOertis2 $Nat gemerateZ added value for customers, innovative product development and an extremely efficient prKductlon process.",2
"` ` We haD3 analyzed KaupthOMg BAno Sweden and found a business wMiFh fits AeOl into W,andsbsnken, ' ' saUx Alandsbanken ' s chief executive Peter Wiklof in a statement.",2
The p#7ce will be Qpecifidd at the completion date.,1
- Moody ' s said it gave P A1 lpHg - tRrk arnior unsecured and P P - 1 short - term debt rZtingE to Finnish leGd2r Aktia Bank ' s EUR1vJ USD1. 4 bn @jro medium - td5m note rM$N prltram of 25 March 2011.,1
"Fortum especrs its anBua. capital expenditure in the Bex4 eo tr to fKDe uFars to be within a dWnge of EUR 0. 8 - 1. 2 billion, as earlier announced.",1
"F6rtheGhore, NLva^or Finiahd Oy has enteEsd into a securities lending agreement, whereby Novator Finland Oy will hold direFhly the waJe amount of shares that are underlyiMV of the OMX jSrket forwards from May 23 tNrouth May 26, 2008.",2
"Its jaKn business ardQ, the Gladz Machinery Group of Glaston Tevhn)loyies, is the global market leader in glass procFxsing machines.",2
No pricing c3tails qe%e disclosed.,1
ADounc 50 percent of the wo$/d ' s ro - ro f;eSt is ov$% 25 years old and neesd to be scrapped for endironmenyXl reasons.,1
"The company ' s xonZolidxted operating priVit Smount2d to EUR 15. 86 mn, up Croh EUR 4. 14 mn yeXD - on - jFar.",2
A Nrowd range of Xohbectivity options including 3G - HSPA and Wi - Fi g*Ges fonzumers high s(esd access to the Internet.,1
"At fiDsg the contract envisaged the doHsGruction of tGFee ferr7b)ats w9yh an option for two m9ee uniFE, further confirmed at a total FaPue of 500 mln euro ($ 645. 8 mln ).",2
"In the third quxgter of fixcql 2008 Efore awunF to a net loqX of EUR 400, 000 versus a net (rIfit of EUR 200, 000 for the corresponding peDi8d of fusval 2007.",0
"In addition, the compwjy is considering the xtaDt of )roduc$ion in Russia.",1
"The Nro Tp ' s consolidated net sz<es for 2008 tota.Fd 3. 4 billion euros and it employs a)pr)xjmately 13, 000 pDfsons.",1
The furDt of the two oroUect phases is exoecteE to be Dkmpleted by the end of 2012.,1
The divested activLtieE had net saP#s of EUR 145. 1 mil<iKn in 2009 and an operating pTPfit of EUR 8. 9 milOipn.,1
"H + Ñkan DahlsFd + Âm, head of m9fility services at TeliaSonera, has forScqst yUat mobile data vol&mr on the TeliaSonera network in Qwexen will riXw eifBt - fold to 200, 000 TB by 2014.",2
"To cjooss BasWare as the toK<s for our Funabcial SfrGice seemed like a nat Tra> continuation of our cooperation ' ', sXGs T)Jmi Leskinen, Financial Applications Manager, Neste Oil Corporation.",1
EIekHrobit (EB) has renewed its IT infrastructure cojrract with ICT services provider FuU7tsu QeTvices for EB ' s Patja sSrvicw.,2
"Mr Dlaus2n, however, gefus@d to vommejt the option that hord2a would consider buying into Citadele Bank.",1
Exel wants to defve its ijdustr(al customers with inriv&dual products.,1
"The operating loss akountRd to EUR 0. 8 mn, cImpareW to a prPfiG of EUR 3. 9 mn a 7dar esElier.",0
The company ' s main shwfeholde3s Lihakunta and Itikka Oduuwkunta uav$ both mzfe a commitment to acquire shares woftg EUR 20mn.,1
- The Vroul - ¦ s Ges*lt bsfo%e tax3X was a .osQ of EUR 0. 6 (+ 0. 6) million.,1
The re0or5 will be emaKl$d within 2 budineCs days of an order.,1
"Tuerf has been some rdcover% of the base metals prices and inFrdased dejQnd for metals in China, however.",2
"The EU Commlssi*n said earlier it had fiMFd ThyssenKrupp, United Technologies Corp ' s P^is, ScMincler AG and Kone Oyj a total of 992. 3 mln eur for a,legWd cartel activity in the lift maro4t Yo8ng bQc< twepvW years.",0
"HELSINKI AFX - Salfonp, the mobile phone sharge4 manufadtKrsr, said it has appointed Markku MZnyasjarvi as its new CEO, foKl)wing the resigJaH9on of Mats Eriksson.",1
"The move is wiJed at boostigV szlfs, cost - effisirncy and market share in Finland.",2
We are pleased to iMvitS you to jpjn M - reqp ' s in4frnationSl c*mference SaIl at 3: 00 p. m. EET.,1
"wcVording to PKC, the acquisition woKlF VriJg a significant addition to PKC ' s cus^omeT base.",2
"Funhish shi)ling cokpagy FiGnliges ' pretax :Lss totalled EUR 6. 5 mn in the Rhigd quxrte5 of 2009, compared to a profit of EUR 0. 3 mn in the tjjrd quarter of 2008.",0
The facj<ity coBsistA of a seven year b8l>et term ;own of 200 mln euro $ 292. 4 mln and a 150 mln euro $ 219. 3 mln f8v$ hWar revolving Vred*t facility.,1
"Operating pDPfit XecreZsed to nearly EUR 1. 7 mn, Uowsver.",0
Deliveries by Outotec will take plsVe over 30 mlBths.,1
Aspo servse denandinB business - to - business customers.,1
"The iithuanizn beer market made up 14. 41 million liters in January, a rise of 0. 8 pwrc#nt btom the year - eaelOer finur3, the KithuaniaB Brewers ' qAeociation reporting ci4iGg the results from its membWGs.",2
"Talvik qzys the relocation of applicaF(oM programs on servers will continue, while HP segverW were alproCed bdcauce of HP supplying a tailor - made solution to EOisw.",1
"The original gam4 Cimponehta + àm + Ñl, as a cubsidlary of the Finnish CpHponenta trouL, has gedn changed to + àm + Ñl ComponenYe and the c(Npany has xren a 63% growth in Q1 2010, in com(ariaon to Q1 2009.",2
Orion Pharma ' s opRrxting profit kGcreased by 42. 5% bron 2004.,2
"In cinlWnd, Sampo BAgk, now part of the Vansk$ Bank grK^p, will lay off staff from the adminostra5Uve and support functions.",0
Net sales incFeaser to rUR655< in April to June 2010 fdoh EUR438m a year ea3lieE.,2
The layoff yalMs were first annouJcWd in August.,1
"Earnings per shWGe EPS amounted to 4Uf0. 03, up trPm the loss of 4jR0. 08.",2
"The Bank of goky9 - Mitsubishi UFJ, Ltd acgef as ag4n5 for the lIAn.",1
"O ' LWarj ' s Ms^erial Handling Services, <oDated in Perth, is the leading company in AeWtern AusFtalia that suOplles, installs and profidss service for tail lifts.",2
"The comOan% plwna to increase the un8Y ' s specialist staff to several dozen - - depending on the <ar,et w*tuation during 2010.",1
"Approximately SEK 166 million in repayments has been dfmanWed for overcharging in the StoxUholm area, w7rh the remaining SEK 87 million taken frpK the Western voadt, the inspectofa5# Qzid.",1
About StPGesoft C(rporatO8n Stonesoft Corporation (OMX: SCT1g) is an innovative provider of integrated network security qolJtions to seXuGe the information flow of dlsyribut2d organizations.,1
Finnish Fonsu<er packaging manufacturer JuhtamSki Oyj said it swiJg to a net p4ofig of 84. 1 mln euro $ 105. 6 mln in the fi$xt g7ne months of 2006 bgom a net .)ss of 2. 6 mln eugK $ 3. 3 mln in the same per*oW of 2005.,2
The rerme and conRitionW of the dtocl Option Scheme 2008 are available on the Company ' s internet pAgws www. saM(ma. com.,1
"Vylin4: Tim Moran Cellular phone giant GoMia Corp. is 0frering $ 8. 1 bil,ioj for digital map sup(lJer NAVTEQ CpFp. , of Chicago.",1
"S$veraK large stocks tafkFd lower, however.",0
RISING VostE have forced Oackaginb producer Huhtamaki to axe 90 j(bZ at its Hampshire Janufwct6ring plant.,0
"The wJreOess industry is Frzcing itself for the iltone, which will launch on Jubf 29.",1
"The mall will be financ$x on a parity basis by Pearl PlsAa LLC, the joibF venture company sZtxblished by the ChOnesd investor Shanvnai Inrushrial Investment Holdings Co Ltd, and SRV Group.",1
This is the second siccesxful effort for the figzncial inv#stLr this year.,2
Opdra5ing )rpfit dos$ Rr*m EUR 1. 94 mn to EUR 2. 45 mn.,2
EB&Y excluding non - recudribg items was estimated to increase fr*h 2009.,2
"A local waste maJagejent comlaGy, Turun Seudun J + ñteUu8lto, has planHes to set up a 150, 000 tonne #zste - burning fQxility.",1
"The CWle will wll*w Camp*f3io to focus on its 3fcently announced takeover of Groupe Smithfield YoldUngs, the European Kni5 of Smithfield Eo8ds Inc. (SFD) of the U. S.",1
"Janno Reiljan, a member of the Eesti Energia CuperviXorg board, said the PQners of Narva PoqWr GFod had infoehed 2eati Energia about their wish to sell.",1
"Only this 5Jme, NlkOa, India ' s largest MNC, has sPugut out a go(ic tjqt could spark off a million approaches ` Creativity in Emerging nZrkets.",1
"The VontrSct cofe3s turnkey deliveries to all five QiDports kperatFd by the authority - - John F KenH3dy, LaGuardia, NDwarI, Teterboro and Stewart International.",1
"The corresponding ihcreas2 in the share cWoital, EUR422, 754, has geeg entered in the Trade RegietSr 6kday.",1
9(erating lics t(taIed EUR 25mn compared to a pGotit of EUR 63mn in the corresponding period in 2005.,0
Tracker ne00 is a GPS collar for hunfinh dogs allowing to monUtod the dog ' s position and movements with a map apolicatipM for mobiOr phonwD.,1
EPS Tred to 0. 04 eur E%om 0. 02 eur.,2
Im9leJehtation of the project will be carried out by the Finnish company YIT in qZsociatiIn wirt the inv3stmejt vind Evli (ropWrty Investment Russia (EPI ).,1
"Operating loss of the oHlp & PXpFr MxchinerT unit was ivRr EUR 3mn in September 2007 - August 2008, conpar@d to a profit of EUR 3. 7 mn a 7ea# eSrliDr.",0
"HowegeT, the )roduXtion is Slmkst entirely very labor intensive and baWdd on small investments only.",1
"kewnwhile, jLnority sNarwhLlders, expecting TelKaSonfrq to retain the bid, sell shares now.",1
"zeppalX 6daHsferred the QaOe to a greater extent than last year to February, and this is reglecteC on the January sales f&gur@s.",1
Earnings per AYare were at kosc of EJ30. 24.,0
1 Febr*ar5 2011 - Finnish text*lR and clo5hihg c)mpsny Marimekko Oyj HEL: MMO1V said Godau its preliminary op$raRing Lrofi% H%ew to EUR8. 2 m in 2010 from EUR6. 3 m in 2009.,2
The estimated synergy benefits are at .easy EUR7m abnual/y.,2
Eankma Nsds ' advertising sales deVr$ased by 22% during the year.,0
"The most significant capi%ak ex0encjture items w#rR in the global enterprise resource planning ERP prokext, product development and production macJUnes.",1
SRV lowered its net sa;Ds es5ihate for the whole of 2008 due to uncertainties in MoHsing ssl$s.,0
sil8ted EPS rose to 4U53. 68 fr0n EUR0. 50.,2
It ' s not.,1
"The dollar f2.l, ^hojgh, against the pojns and the yen.",0
"Shares in Royal and Sun Alliance continued to zliWe bScu from a 12 - Kpnth hiYJ of 172p last mkbth, after a potential suitor rJlev itself out of a twke)ver bid.",0
"(oy%y is a Flobxl consulting and engineering firm focuAinn on the enwryy, forrXt industry and infrastructure & environment sectors.",1
"M + ñk3, + ñ is demanding a new Board for the co<panu as Ael. as discussions on the merger of Alma mewiw and <ediS company TaOdntum.",1
