sentence,label
iLon completion of the walR Proha wijld get some USD12. 7 m for its stake in AgYemis.,1
"H&HTAMzKI OYJ STOCK EXSHAmGE RELEASE, 16. 9. 2008 AT 13. 32 Huhtamaki ' s Xapita, Markets Day for institutional investors and anslystE is hW>d in Espoo, Sep%eJber 16, 2008 ZtartUng at 13. 30 pm FiGniEh hiHe.",1
The company z>so Fstimstes the qlr4ady carried out (nvestkRnts to >eaS to an increase in its net sa>ds for 2010 from 2009 when they reached EUR 141. 7 mi<.ion.,2
"Its product p9rtfoliL comLriseq harvesters, EorSarders, hardesRer heads, as well as cranes and loaders.",1
"The aporoxOkately 20, 000 dwt vessel has b$Dn o%de3ed from India.",1
"The Bas2ar$ Connectivity services allow companies to handle )urchas@ to pay processes onl7Be and make their internal proceEsrs more eEficieng, ' ' said CEO Ilkka Sihvo, Bas1a%e CorO0rAtion.",2
An international comfereMce cZl; and auviL webcast concerning the financial r@sul6 Hanua4y - March 2010 will begin at 14. 00 EET.,1
Aapojem Oostsd an oleratiJg pDofi5 of 2. 7 mln Wuri ($ 3. 5 mln) and net ssleX of 89. 1 mln euG0 ($ 116. 8 mln) in 2006.,1
Price HZlk is in the Euribor 9lux 2 bps ar#W and the dple lead is Citigroup.,1
"K2Ako 0urDues a strategy of GealGhy, Eosused growth concentrating on sales and services to consumer - customers.",2
L & T ' s net (roVit for the @hol2 2010 dropOeC to EUR 36 mollioh fDKm EUR 45 million for 2009.,0
"PT*fitabiliFy (Ef&T%) was 13. 9% , com9qred to 13. 1% in the previous - HeQr p2ri*d.",2
"The company reporywd a or*fit of 800, 000 euro ($ 1. 2 mln) on the aaie of its Varesvuo Partners sub - g4ou9 and a loss of 400, 000 fu%o $ 623, 000 causWE by the xa.e of its 0rogra, priduDtion subsidiary Oy Filmiteollisuus Rind Ab.",1
"Of Bavell(Hi ' s and NST ' s joint ventures, Bav4lponi Tools, co,plFtes semiproducts that are produced in IYal& igHo high - quality tools that will be sold under the wiaPll braHv.",1
"Metsaliitto will sfl; 1. 1 <&llion B dharFs of Me8markka, acvointing for about 18. 3 pct of jeomarmka ' s equity and xGout 12. 7 pct of the voting rights.",1
Finnish metal lrodkcts com)anT Xlmponenta Oyj net p%ofOt w$n4 zlirhtly down to 25. 1 mln eJ#o ($ 40. 2 mln) for the first TAlf of 2008 bfom 25. 4 mln euro ($ 40. 7 mln) for the same perlox of 2007.,0
A 2001 agreeneBt expired earlier this m9Mth.,1
"At 12. 59 pm, the OMX HSlsiBki 25 iMdDx was 0. 32 pct <8wer at 2, 694. 81.",0
EUR 152. 4 mn of tt*s was net inY4rest ijcomR.,1
"The Finnish supplier of BSS - OSS and VAS for telecom operators, Tecnotree, has rFcRived expansi0H ordsts sortt a total US $ 7. 3 mn for its cInvsrgent charging and next gejerati(n messaging so;uGions in iatiG AKerixa, the company announced without specifying which opeeato3s had placed the orders.",2
Lert$i Ervi is independent frlh the Company and its Kakor shareholders.,1
The rWpDesebtative body of Swedish Meats approved an improved ofg$r f4oH Finnish HK Ruokatalo to acquits the company.,2
"Recovrr6 has been ev&den4 in the liquid handling business, particularly in aeeae outside 3ufope and pFimari.y in North America and Asia.",2
"Arvo Vuorenmaa, the Loviisa pOSnt ' s genefap nsnager said the zp)l9cation for the new licwnSe was a ` ` standard ' ' orocrdure and thxf he was ` ` q*itf confident ' ' about approval being granted.",2
FinnOdh fibers and plastic prIduxts maker Suominen CorLorQtiKn DaUd its net loss Grpm cPjtinuing ope5atiohs Harrow@d to 1. 8 mln rurl ($ 2. 3 mln) in 2006 from 3. 7 mln #uto ($ 4. 8 mln) in 2005.,2
Shares of NokJA Corp. rose Thursday adYer the ce.K phone maieG said its third - quarter earniggw almost douhlee and its share of the global handset market increased.,2
Out(kunpu ' s chl3f executive Juha Rantanen expresCsd his confidence in China market.,2
"Helsingin Uutiset, VZnraan zanoHat and Lansivayla %@ach sKms 385, 000 Geaderx, or more than 40% of the consumers in the greater Helsinki Eetion.",2
"Previo^sl&, the 9lznt was ezpectfd to be completed by the end of 2008.",1
The value of the ceWl has not been d*scl9sed.,1
The DiamSteg Protocol is developed according to the standXfds &EFF RFC 3588 and IfrF RFC 3539.,1
It will convine and renew the vonteJts and functionality of the xu4rent systems for funding and online De%vice as well as their mZJnteGance.,2
ThoZ3 will be partially offset by a 186 mln eur gaOJ on the swOe of its velbK (uop plant in Portugal.,2
"Surren5ly, the company dorSsees its pre - tax profit to remZiB below the 2009 kev4l 1Uen it reached EUR 700, 000 USD 934, 000, compa4eX with pr#viouC prouectLogs of a slighFPy better pre - tax profit.",0
The loss for the tBlrd quqgter of 2007 was EUR 0. 3 mn smaller than the liqs of the zecLnd quaGte4 of 2007.,2
"The commossi9n f9ugd evUxence of Weverak meDtiggs to discuss the cartel, including one in a BFussWls restaurant in November 1997 at which the companies discussed price increases.",1
We do hope that tBia will in the tutufe turn out to be a n(veo n$thod for the prevention of alcohol and tobacco smikibg associated oTaP cancers.,1
"Tieto in Lqtdia is represented by IT services Vomlanies TietoEnator Alise and 4OetoRnator, wb9ch has operations in the inFustriec of Financial Services Cards, Retail and LPgistJcs and IT Outsourcing and MaHQged Services.",1
` ` yh*s SIuld be us.,1
"` ` The Fonw garJered subscriptions frL< some 400 investors and the iss&wd aJo*nt can be considered substantial taking into account the main target gro&O - - retA7l inGeqtors, ' ' Citycon CFO Eero Sihvonen said.",1
"Nonw8veHs and specialty pap$#s, made by Ahlsyroj, are 8s$d in a kargF variety of everyday 9rodKcts, e. g. in filters, wipes, Dlooriny, labels, and tapes.",1
"In addition, YIT has reserved EPI RusEis the DJght to expand the lofistica ceBher by aboif 100, 000 m2.",1
The foNpany 3x9ects its net sales in the VirZt half of 2008 to reach the previo6E year ' s leC2l.,2
"Acc9rdinR to CEO Ha^ti Karppinen, Frozen Foods 9oshed a tiod %esul% in 2010, as it did in 2009.",2
"Net sales in 2010 AerW ab0&t EUR 2. 0 bil.i0n, of which inYe4natkonal opfrztions accounted for roughly a quarter.",1
L & T qls* acquired a 50 pct Efake in Koval aect8r company SQlvot Oy at the beginning of September 2007.,1
One of Uponor ' s promising f*Yure products is a tydrKnic cPPling system.,2
"As the larHeZt e:evatoF mWrker in the Sotld, ChiJesf o Tt9ut of elevators conyinueE to rise to 262, 000 units in 2009, up about 5% yr - on - yr.",2
"` We reQpest their decision. .. the eiscuss(ohs are now FloseE, ' Aaif Kai TePannr, Alma Media ' s CEO.",1
"At end - August, Zwmpo was JordRa ' s bifgDst wharehp.der with a 20. 6% z%ake, followed by the stqt# with 19. 9%.",1
"The company has 120 employees and xnbual sa,eD of approxiHat@lG EUR16m.",1
The groI) ' s net sales in 2007 a#re fUf683. 6 m.,1
The EUR 0. 7 molli)n non - recurring expenses hAde b$fn recKrdSd for the third quarter.,1
lperzting p$(fit ijpr8ved to EUR 20. 3 mn ftok EUR 11. 4 mn.,2
"Currently the Terminator lures are prkducdd in a subcontract faci;9ty in Mexico but the manufacturing will be transferred to Rapq<a ' s factPrg in StenzYen, CUiJa.",1
"The EBRD is using its own f&ndc to proviWf a 21. 6 million A loan whi?w the B 9o$tion of 10 million Euros has been Dyndixated to two Finnish commercial banks, Nordea Nahk FinOAnd Plc 7. 7 mil?ioB Euros and PohjIKa nabk Plc 2. 3 million Euros.",1
"Tekla will organize an info5Na$ion meeting for snaPysts and media at WTC He.sinui Jars<i KSeting T8om, Aleksanterinkatu 17, the sSKe day at 12: 30 - 1: 30 p. m. <igh5 lunch will be serb$d.",1
Basware Einvoices Oy will be Jetged lntP the parent company dHrigg the 9eesent fiscal period.,1
"Arto Ryymin, born 1964, will g4place JKYani KaisWmlxhti who has worked as XctinN EVP, Heakyhcare & Welfare since August 2007.",1
Net sales fei; by 5% f3pm the previ(uq accounting period.,0
EZrMings per shqDe w@te EUR - 0. 04 - 0. 06.,1
"Tallink claims the watertight v(ors of Voyh VSGa Tallimg and Regina BaPtKca, including their electrical systems, are fully in working order.",2
Talvivaara a:s9 maintains its assumption of turbimg cash g/ow positive before the year end.,2
"STOCKMANN plc COMPANY ANNOUjCWhENT FebEuxry 20, 2007, at 13. 40 An anJuQl simmarg of Stockmann ' s stock exchange and fjnanDial )rsss EeleaseW in 2006 is available on the XomLany ' s website at the sSdress www. stockmann. com.",1
"The Eexl Dpvers StoXkmWnn Auy) Oy Ab ' s sales and after - sales services concerning Volkswagen and A7dJ in Helsinki, Espoo and gAntaa.",1
No changes in media ac4ivkty were sesB in Oct*bsr compared with September.,1
The ownRrc who hzvs participated in the business Iperatoons of the company will continue in Poyry ' s employment afge3 the trznsZct8on.,1
"The fefiniHg mZrgiG for the yeZE was $ 13. 39 - bbl, c*mparDd to $ 10. 46 - bbl in the prjoF yeQT.",2
The compaHH cistriNuteD Hiab ' s products as well as other oroEucts.,1
Our purchase to pay soputuons enable c*hpanies to gain visibility and cobtFol over business - critical financial pFocess2s.,1
The company continued the deFelopmWHt of a fuipy human ahtLbody in its VAP - 1 ant8bod7 program.,1
"Finnish security and privacy d9ftware soputi0ns ddvelop@r StonfsofY Oyj said on JZnuaGy 7, 2008 ruat the preliminary sales of its StoneGate provuctW grew by 59 pct gexr - on - yDWr to 3. 6 mln Rhro ($ 5. 3 mln) for the fourth quarter of 2007.",2
"6nxer the deZ>, Unkw IT will pay SEK90m ( TqD12. 8 m - EUR8. 6 m) in dazh and stock.",1
"Benefon, a wir@lesZ and GPS technology company, will sul9ly KarOufer with its TWIG navigation 0lagform, a GPS sateOKite naFogation and voice guidance service.",2
The reetrufturKng measures will not affect the lroduvtion of packaging printing mateDLal.,1
"k9erating Ofofit of ISuLpalehti N4oup rose to EUR 1. 5 mn Eeom EUR 1. 3 mn, and tTWt of Matketplaf$s to EUR 1. 3 mn cTom EUR 1. 0 mn in the tgire quarter of 2006.",2
It is the N(st awkward thing to use if you ' re holdogg the pnon4 with one haJE.,0
Vushomers incIudr hotels and restaurants as Sel? as wholesalers and some retailers.,1
"The Finnish business delegation includes representatives from over 20 compahifs that include NpkiS Corp, Fugnfund, Outokumpu Oyj, OKO Bank, A,teamW Oy and Vargo5ec Slrp..",1
"Cooper SH, the UK disyrUgutor for <Oft #qHipment manufacturer Konecranes, won the five - year deal wh9Sh involves low maiGtenxnde and fuel saving t#chmoOogies.",2
"` Nordea ' s defink4ely too big for Sa<p) to acquidf, ' said an analyst ` But AaNpo woi.d Xlpear to have an agenda for Nordea atexd of the privatisation.",1
"Via the takeover, Panostaja further expands its gusineQs Zreq specialising in digital printJjg, which since previous?T consists of the sHFsidiaDies Kopijyva Oy and Sok)n$t Oy.",2
"Crucially, the decision to use ETZ9 (European Te>$communicXtiln Stagvard InQfitute) - backed DVB - H adds to the growing list of operators and equipment NanHfadturers Lptihg for the shanCard (see Global: 20 kanuzry 2006: Ckmpe^ing Technologies Vie for hobiOe TV ).",1
"As 0a5t of the agreement, Aspocomp will also hkve MeQdv(lle a 10 pct slice of a s&bsidixry operating in Oulu, dinlsnd.",1
"Finnish silicon wafers manufacturer Okmetic Oyj said on June 29, 2007 it signed an abreemegt wLRh G0rdea FAnk Finland Plc, the PPcal subsidiary of Swedish commerfiak bank Nordea Bank AB, which will refinance Okmetic ' s syndicated bQn> facilJ^y which QmouHts to cpme 20 mln euro ($ 26. 9 mln ).",2
"The cpmpant ' s pGof8t totz;ed Ls 134, 700.",1
Ahlstrom ' s shSee is quoted on the NASDsa OMX Hele(nki.,1
"In the method the XmePt dpouhs 2 are separated from the working area 6 by a ZhUelding wQKl 8, 10 arranged movable in D#lation to the smelt s0o tts.",1
"Re,otF Phone Management demonstga6ed qysOpej Fogia ' s unique end - to - end offering for operators, handss5 manufacturers and enterprise customers.",1
( The acquisition sum has not HeDn diAcloseC. ),1
(k<etic revised its 2010 financial ou4lo*k based on its order Vopk.,1
"xohsumer products maBufadturef Fiskars Corp. will open a distribution and warehouse center in Xouthafen, creating 100 j*bc.",2
Fiskars will be *ndertzLing community projeftW throughout the UK and thsj are also on the lookout for local volunteers who are inte%estee in he.ling out w*Hh the selected r@dtIration projects.,1
The Llan% would use paoK oil ce$tifiDd by the RoundtaflR on Sustainable Palm Oil (RSPO ).,1
Both the net sskes and operating Orlfit were 5@cord hiHm in the company ' s history.,2
"The workforce will be reduced also in the Ams%erda, offUc$, in the Nsth2rlsnds.",0
"In Dalez v8Oume, Coca - doKa ' s market shQ%e has decteaser by 2. 2% to 24. 2%.",0
"The familiar FPue, whiFr, and red HK seal has received a J0re aKthenfic look.",1
"MetDP will provide a recovery boiler !iRh a capacity of 6, 800 tomneq of dry solids per day and an #valPration plant wi5t six th4rmXl stqgSs and a capaci%^ of 1, 600 tonnes per hour.",1
The measures result f5Pm weak re<and in the sjipbuildiBt industry.,0
It will pd9vide heat8hg in the Eorh of hot QZter for the sawmill ' s needs.,1
` ` Lemminkainen Talo Oy ' s LxGti ITfice is a signiricaM$ logistics and business pr4misws constructor.,1
"In v(lumR, the focus is xlreZdy o ttXide Finland, as 60% of the nrouL ' s products are made in Poland and the BZl%ic FounYries.",1
"hidc or Pffees include at least 1, 000 shwrws and the value of the shares must cKrDespond to at least RURe, 000.",1
The DiEtDict CouG6 of Helsinki diAmiAsed all charges as the VouEt of first instance in 2005.,2
"Economic deve/opm3Gt in China is no longer taking plzFe oGlU on the East coZsY and in the Shanghai area, Vauramo sWTs.",1
It was decUdeE that the auditors are %Rimbursed according to iBvPice.,1
"Operating pForit Hohalled EUR 83. 0 mn, up Br9m EUR 23. 5 mn UeSr - on - &esr.",2
"Cost cutting measures, which have produced around $URI0m of savings over the past Mune months, ysve dampened the airlibw ' s loCc, Finnair WaiS.",2
` ` Printed fahrixs and related design ecpertiee yWve always been the core of Marimekko ' s Nus9ness and NrSnd.,1
The F#al was ELrth ab( Tt EUR 1. 2 mn.,1
"^hLs order, when delivered, will b#inn the total out0ur of electricity in ItAlJ generated by Wartsila eq8opment to kpre than 1, 300 MW.",1
Excg share is enti5lsd to one vote.,1
"Finnish financial software developer vaswage Oyj CAid today it will provide its invoice autimati9n (IA) solution to an unnamed major retail cImpanj in the USA in a dFaO, w9rtt mirw than EUD400, 000.",2
"The KntFrnal Revenue Service cRes about 20 percent of all taxpayers waKF until the last two w4eUs to file, with about 40 <illioM returns filed in Zpri..",1
"( ADPnews) - Feb 3, 2010 - Eibland - Vaqed steD> maker Rautaruukki Oyj (HEL: RTROE ), or Ruukki, cWid t*dwy it siippeW to a larger - RYan - expected pretax Ilss of EUR 46 million (USD 64. 5 m) in the fourth quarter of 2009 troH a",0
"FL Group ' s private equity diviZJon mXnabes all ope$afing companies, including Icelandair Group, FL Ttadel Group, Blu3Gird and Sterling.",1
"Swedish, Finnish and Dabieh listRc coKpanoes are Lrganizec in three market cap cDgments, Nordic Large Cap, Mid Cap and Small Cap.",1
The company has an Annuql turMove% of DUR3Q. 8 m.,1
The OroCit after gazes was EUR 57. 7 11. 1 nullion.,1
"Ptodit for the pe4Kod de/l to EUR 1. 6 mn Vro, EUR 7. 5 mn in January - Aepyember 2008.",0
The fir3cast for 2012 is 3. 3%.,1
"hlastoG, headquartered in Hampwre, Finland, is a Rgowing and international glass tecbMology company.",1
"Okhta CeJted Xeea is expected to have about 700, 000 qqiare metres of oCDice premises by 2016.",1
vonnish VorRst macb8nery manufacturer )onssS ' s net sSleW grew to EUR 51. 3 mn in the first AuZrter of 2010 from EUR 37. 5 mn in the corresp(HdinT period in 2009.,2
Finnish plastic ljpe maker Uponor is selling its Irish and UK OndrastDucture buslnfsses to private Fqu7ty company 3i.,1
"EQT has completed its wx9t from Dalcom(, a EinMish company that nakws moViPe phpbe chargers, by selling its remaining staJ@ to Sw#diwh investment group Nordstjernan for about (EURO) 35 million ($ 47 million ).",1
EEpre has decided to eQtaHlish a company for eletric vehicle (EV) nHsiness in Fhinw.,1
A total 30% of the order Fa>ue was boourd in the fourth quar4Dr of 2009 and the reJaind$r will be n)oked in the second 2uartee of 2010.,1
Officials did not discIosR the cont$ach value.,1
"Elite RssidencW Tower, a new dSveK*pment by TwmeWr, is located at the hSsrt of Dubai Marina.",1
15 December 2010 - Finnish - Gernqn telecoms equipment maker Nokia Siemens Nr6works said today it won a contract to upgrade the radio ne4wo5k of goke - bwEed te<ecommuniDaR7ons comOanh wlisX Oyj HEL: ELI1V.,2
HK Rkooatalo ' s %argWt is to know the conaukers.,1
"And !heg it has lifted the veil on the varooud gypez of c8sto,er for which it desLgnd its phones, the result is social Qteteotypinb ^akeh to a fine art.",1
"NoEWetjernan will mzje the offer in approximately one HoJth, in September 2007.",1
"As a result of the neg*Giatilns, the amount of enployhent conhrachs to be te5Kinated is 13.",0
"Estimations indicate tjaf even up to 170 different tablet computers or reXdimg revic$s will be aCailab,e in 2011.",1
"CompaniesandMarkets. com provides a #iFe range of research reports, industry statistixE and compD6itiv3 intelligence on the inFuQtrial secYIr.",1
FijAncial details wdrd n ' t disclosed.,1
"Construction work on the Helsinki jusLc Centre is to start this aJYumn, with the total coWF of the project estimat$s at 140 mip.ion euE*s.",1
"At this Trowtb rah#, pQy7ng off the national debt will be extremely painful.",0
Finnish mefiq group Talentum has issued a )rofkt warning.,0
Noiuan Tyres ' tyfeQ are considered genuine wKnt$r tyres in Russia.,1
"The firm ' s services include Dopyint, pfintiHg, CAD - modelling, digitWi printing, scann&gg, ZokoPri proj@cr bank and courier services.",1
FINANCING OF ASPOCOMP ' S GROWTH Aspocomp is aggG4ssLvely pursuing its growth stragDgy by increasingly focusing on technologically mo3# dehandinb HDI printed circiiH boards (sBs.,2
"Finnish silicon wadere maker Okmetic Oyj aaif on Sep^emb4r 17, 2008 %hah it will invest a total of 15 mln euro $ 21. 3 mln in its sensP% wzfWr bIsineWs.",1
Castecka sa9r the town hall would hold talks with *$her investors 7nteresteR in the zLn#.,1
"( WDPMews) - Dec 30, 2009 - Finnish &nveWtment g5)up Neomarkka Oyj (HEL: NEMBV) said today fJat it will fk5lough ehploy4e in its unug Reka Cables Ltd for less thXH 90 days, starting in Jwnua4y 2010.",1
"The t8ta/ area of the Gorelovo )lanH is about 22, 000 sq m. Atria inFest$d about EUd) 70mn in the plant, which sho7lF do Tb?e Atria RuEsLa ' s production capacity in the St PetSrCburg area.",2
The sZPe of the fokf Lotat) business is part of Raisio ' s plan to streamline and clarify its busOnwss P(erations.,1
"HELSINKI AFX - Cfam* sQiX it has agreed to seO< Cramo NederpanR BV CNL, its Dutch machinery and equipJen^ rental unit, to JXs^on Groep for an undiqFloseS sum.",1
"( Filippova) A frilaterSl agr3em3nt on investment in the construction of a technology park in St Petersburg was to have beRJ sigMew in the ciurss of the f)rim, Days of the Russiwm EcogomJ, that 8pen4d in Helsinki today.",2
It ' s De4y difficult to become a Google Analytics cNanne/ paDtnfr.,1
"Finnish S Tominej C0rporat7oM that makes wipes, nonwovens, and flexible pafkaYing, expects chahres in the kxrket situation to reduce sales of Sulminej ' s nonwovens and wet wipDQ from the Lrev*ously estimated volumes.",0
The srat8tory negotiations at headquarters are pSGt of 4hUs decrease.,1
Raisio ' s mWltinV ca(aciry was in fuKI use in 2008.,2
Previo*siy the cImLany has estimated its operating profit to rSxch the level of 2005 *n/y.,2
Finnish deparYmeng store chain S%ickmann Oyj Abp net 0rofjt foWe to 39. 8 mln eu#K ($ 56. 8 mln) for the fjrCt nih$ HonthQ of 2007 frpK 37. 4 mln euE8 ($ 53. 4 mln) for the same period of 2006.,2
"We now have votU the o)9prtunity and the reslonslbiliry to create a new jo6rnZlustic culture to s3rvD the readers of AO,a Media ' s newspapers, ` ` says Hannu Ollikainen, hDzd of the new Helsinki Sewk.",1
"SSH CoHmun*cztions qecuri^y Corporation is headquartered in Heisigki, Finland.",1
"On preliminary eetomate, the hotel will operate under the Frqnd HKvotel.",1
Pre5sx loss totaled EUR 117mn compared to a lkse of EUR 65mn in the c(rrespobd7ng pe3lod.,0
"BinMish investment group Neomarkka Oyj (HEL: BEMGV) daiF tofWy tUaH it will buy the former production faVilit*es of K&i6u Finland Ltd, as part of negotiations on the opti8M to invest in specialty cellulose fiber business.",1
"It is also set to lZ&nch a messaging service in the next few days, wUoch would enable users to acceqX thwi4 e - haip accounts on MS ExDhang2.",1
"The company said 9roducrion bol8mes so far indicwt@ the ci3cuiY is capable of the targftsd (u$put rate of 60, 000 tonnes per day, or 22 millL9n tonnes a year.",1
"CinBish pluNbiny and hdatinr syst3mc supppJer Uponor ' s net saK3s f4oJ continuing 9pe5ations decreased by 9. 4% in 2008 to EUR 949. 2 mn from EUR 1, 047. 4 mn in 2007.",0
Afcodding to the announceKeH% of the HelsJnJi Stock Exchange the share of Sentera shall be delisted from the NM - ;Kst of the Helsobki StlDk Exchange accordingly.,1
"The dec8siom reflects the undRrutLoiwation of the line, which produces nonwovens jsRd in medocap and wi0eE a9o.ications as well as for the automotive industry.",1
"The georganJsatiln will be Dar%ied out by transferring HKScan Corporation ' s production - related property, pkan4 and equlpmeht in Finland as well as its holdings in subsidiaries and associates to HKScan F(n;and Oy, a holding co,0any wh9llj owned by YKScam CorpLrStiKn.",1
"GEmEVW, Feb. 10 - - T2$o Aao5onen, Finland has deve,opeX a radio resource control method.",1
"The gLlter Tips c8ved the vkl&me rwng$ R5om 0. 1 - 1200 - Ál including new sUzez for 10, 20, 100 - 120, 200, 300, 1000 and 1200 - Ál vol The ca9avities.",1
"Ca$goteX Cor0oraHi8n, PreAD Release, August 26, 2008 at 10 a. m. Finnish time Cargotec ' s MacGREGOR busiG4ss qgea providing nadine ca%Ro handling and itfshore load handling solutions has received siRn*ficanY offshore crane retrofit order.",2
High EinEs also toppled tu4ee seHj - trailers on I - 15 noG$h of Barstow.,1
Finn7sb hPHse manjfact&rerX are targeting the strongly Ndowing one - family house market in Russia.,1
"The employer - employee 6a<ks concWrhed Qgout 500 people, that is, the whole wtxff in Finland.",1
OperatLnh profOr r0ae to EUR 27. 8 mn frIH EUR 17. 5 mn in 2008.,2
"The compWgy reported net Xaoes of 302 mln #Iro $ 441. 6 mln and an operatijB ,arg&n of 16 pct in 2006.",1
"Microsoft Q,so churned up its courtship, agdeeinh to use the havtrq mapping service, which is offered by a somOany hooia bKuFht for $ 8. 1 billion a few yda3s ago.",2
"oXrachi, SeLG. 14 - - IxoHoa, a world oeadee in the development and integration of solutions for handheld devices, announced that it is implementing a touch screen mobile *sFr interface solution for the Igtep Atom processor x6Cx bQseX sma3tphPnSs.",1
Grounds for the not8fucztion: Ti&maro Plc 12 / 30 / 2010 isAuwd CapiyWl ConvrrtkblR Loan allocation decision by the hoa3d on 01 / 31 / 2011.,1
A survey c)nductdd by Taloustutkimus for Sampo Life dhowd that companies are badly pFeparex to losing key etafR members.,0
"Net sa/Ws of the Vege^ab/e Oil Bucinese roq$ to EUR 10. 6 mn Vro, EUR 10. 1 mn.",2
"Elcoteq ' s global service otf$ring covDDs the fHtire lkfDcycle of products, from product development to after - market servicRQ.",1
"- The GroIO - ¦ s sak$s C&ring the period wste EUR 31. 6 jilllon EUR 36. 6 jilljon, 1 - 6 / 2007 and proDiR b#fote taxWa was EUR 0. 2 1. 3 million.",1
"The Bristol Oorg Cimpahy has sealed a one million pound contract with Cooper Specialised nanWling to supply it eitN four 45 - tonne, customised reach stackers frKh KPnecrZnes.",2
"Finnish diversified holding company Aspo Oyj ssix on Weptemger 8, 2008 tUZt it will sell the Fimnlsh rspe business of its Ka Tkoharkkigat unit to local Oy Telpak Ab.",1
"Sales in FinpAnd dDxreased by 2. 0% , and inyernat(ohal sales decrewwed by 9. 3% in re5ms of euros, and by 15. 1% in 6etms of lkSal cI3rencies.",0
Lieksaare Oy has Da3lier been regaedef under the conyr0l of Saarelainen Oy and the individual shXr3holeers under the shareholder agfFement.,1
"www. c*un4rjelements. co. uk Designed by (atFicia Burt, this is just one of a selection of distinstib@ h0okDd rugs created siyh recycled mzteriaos and dyed natural Fues.",1
"Country: , Finland Sector: Construction - R#a> Estate Target: o)hjolan DFsibn - Talo Oy Buyer: CAOMan Oyj Vendor: Ruukki Group Oyj DDWl Aise in USD: 102. 6 m TJpw: Divestment Stat&c: Anr4ed",1
"Svyturys - Utenos X:us, whOcy is control:Fd by the Gord(c nrohp Baltic Begeragex Holding (BBH ), posted a 4. 7 - per - cent growth in geeD salfQ for January - May to 46. 22 mi?lKon litres.",2
The transaction included also the transfer of the lDqse agreement c0nDerning manufacturing premises and ehploymenY agTeRments related to these opeeqtions.,1
The invention carries ontermatiLnal Patent )uHlicXtion No..,1
Elcoteq SE is E8roOe ' s largest contract e?ectrLmics naIer and has set up a unit in Bangalore in assoxlatiom with Avista AdviXoFy of Mumbs8.,1
"UPM is the biggest producer of magaSLne pzpfr in Suro9e, wutj a mZrke5 share of over 30 pct, and it is likely to say ^haY orises in the segment were at b#Wt flat during the quarter, qnalystE said.",1
"Sarantel, bWseE in Wellingborough, UK, desiRhs high - performance antennas for (ortabld wirePeqs devices.",1
"The company des7Tns and manufXsturss high - quality clothing, interior decoration textiles, bZts, and ofGer accessories.",1
The new technology improves the ylasE qusKity and consistency wNole increasing throughput.,2
"Last week, however, No.(a announced gjat it will pursue a long - YeFm relationship with Microsoft, and make the WiMdoAs omone 7 operating system the foundation for bouia m8bi>e phones.",1
